Category,Title,Total Time,All Ingredients,Ingredient Groups,Instructions,Nutrition,Cuisine,Yields,Image,Ratings,Description,Status
Appetizer,Chipotle Mushroom Zucchini Rolls Recipe,20,"10 zucchini (sliced in four slices lengthwise), 2 tablespoons olive oil, 1 (7 oz) can chipotle peppers in adobo sauce, 1 clove garlic (minced), ¼ onion (diced), 20 whole white (or portabella mushrooms, sliced in half lengthwise), salt and pepper (to taste)","IngredientGroup(ingredients=['10 zucchini (sliced in four slices lengthwise)', '2 tablespoons olive oil', '1 (7 oz) can chipotle peppers in adobo sauce', '1 clove garlic (minced)', '¼ onion (diced)', '20 whole white (or portabella mushrooms, sliced in half lengthwise)', 'salt and pepper (to taste)'], purpose=None)","Heat a grill pan or large skillet over medium heat. Drizzle in olive oil and cook zucchini about 3-5 minutes on both sides. Remove from skillet and set to the side to cool slightly.
Heat chipotle peppers, garlic and onion in skillet until heated throughout, about 5 minutes. Stir in mushroom halves, and cook for 5-7 minutes until the mushrooms are tender.
Spoon one mushroom piece with a bit of sauce into the center of each slice of zucchini. Fold zucchini over the mushroom lengthwise until the zucchini resembles a roll. Pierce with a toothpick or small skewer for easy serving. Serve warm.","{'calories': '17 kcal', 'carbohydrateContent': '2 g', 'proteinContent': '1 g', 'fatContent': '1 g', 'saturatedFatContent': '1 g', 'sodiumContent': '5 mg', 'fiberContent': '1 g', 'sugarContent': '1 g', 'unsaturatedFatContent': '2 g', 'servingSize': '1 serving'}",American,40 servings,https://addapinch.com/wp-content/uploads/2014/01/chipotle-mushroom-zucchini-rolls-DSC_1826.jpg,5.0,"Chipotle Mushroom Zucchini Rolls make an easy appetizer recipe. A flavorful dish, these zucchini rolls are a great meatless, grain-free option to serve.",Complete
Appetizer,Bacon Wrapped Jalapeno Poppers Recipe,25,"12 medium jalapeno peppers (cut in half lengthwise with seeds removed), 1 (8-ounce package) cream cheese, softened, 1/2 cup shredded sharp cheddar cheese (optional), 12 slices bacon (cut in half)","IngredientGroup(ingredients=['12 medium jalapeno peppers (cut in half lengthwise with seeds removed)', '1 (8-ounce package) cream cheese, softened', '1/2 cup shredded sharp cheddar cheese (optional)', '12 slices bacon (cut in half)'], purpose=None)","Preheat oven to 400ºF.
Fill cleaned jalapeno half with cream cheese (or cream cheese and cheddar mixture). Be careful not to overfill as it will ooze out of the jalapeno poppers as they bake.
Wrap each stuffed jalapeno half tightly with a piece of bacon. Arrange on a rimmed baking sheet and bake until the bacon is cooked through and crispy, about 15 minutes.
Remove from the oven and allow to cool about 5 minutes before serving.","{'calories': '58 kcal', 'carbohydrateContent': '1 g', 'proteinContent': '2 g', 'fatContent': '5 g', 'saturatedFatContent': '2 g', 'cholesterolContent': '10 mg', 'sodiumContent': '88 mg', 'fiberContent': '1 g', 'sugarContent': '1 g', 'servingSize': '1 serving'}",American,24 servings,https://addapinch.com/wp-content/uploads/2016/08/jalapeno-poppers-recipe_DSC3758.jpg,5.0,"Bacon Wrapped Jalapeno Poppers Recipe - Bacon Wrapped Jalapeno Poppers make an appetizer that everyone loves! This easy recipe combines creamy cheeses, spicy jalapenos and crispy bacon for classic baked jalapeno poppers that are irresistible!",Complete
Appetizer,Baked Korean Chicken Wings Recipe,35,"24 chicken wings (cleaned and tips removed), 3 cups reduced-sodium soy sauce, 3 cups light brown sugar (packed), 1 cup + 1/4 cup water (divided), 1 cup soju (or sake), 1/2 cup gochujang, 1/2 cup mild honey, 1/3 cup rice wine vinegar, 1/4 cup + 2 tablespoons minced garlic, 1/4 cup grated fresh ginger root, 4 scallions (trimmed off the root end, thinly sliced), 1 ripe pear (peeled, cored and grated on the finest side of a box grater), 1 teaspoon ground black pepper, 1 teaspoon Korean chili pepper powder ( or crushed red pepper flakes), 3 tablespoons Clear Jel (or other canning starch)","IngredientGroup(ingredients=['24 chicken wings (cleaned and tips removed)'], purpose=None), IngredientGroup(ingredients=['3 cups reduced-sodium soy sauce', '3 cups light brown sugar (packed)', '1 cup + 1/4 cup water (divided)', '1 cup soju (or sake)', '1/2 cup gochujang', '1/2 cup mild honey', '1/3 cup rice wine vinegar', '1/4 cup + 2 tablespoons minced garlic', '1/4 cup grated fresh ginger root', '4 scallions (trimmed off the root end, thinly sliced)', '1 ripe pear (peeled, cored and grated on the finest side of a box grater)', '1 teaspoon ground black pepper', '1 teaspoon Korean chili pepper powder ( or crushed red pepper flakes)', '3 tablespoons Clear Jel (or other canning starch)'], purpose='For the Korean Barbecue Sauce: (makes 4 pints, you’ll use about 1/2 of 1 pint)')","Preheat oven to 425º F.
Place chicken wings into a large zip top bag.
Pour 5 teaspoons of Korean Barbecue Sauce over chicken. Close bag and turn from side to side until all chicken wings are well coated. Remove chicken wings from bag with tongs and place on a rimmed baking sheet.
Bake for 30 minutes or until wings are cooked through. Remove from oven and brush rmore of the barbecue sauce over wings. Serve.
For the Korean Barbecue Sauce:
Combine the soy sauce, light brown sugar, 1 cup water, soju or sake, gochujang, honey, rice wine vinegar, garlic, ginger, scallions, grated pear, black pepper, and chili powder or crushed red pepper flakes in a large stainless pot. Stir well while bringing to a boil. Boil for 5 minutes, stirring frequently.
In a small measuring cup, whisk together the canning starch with 1/4 cup water until well-combined. Stir the barbecue sauce in the stockpot briskly and pour the gel and water mixture in a steady stream to combine. Return the sauce to a boil and boil for 1 minute or until thickened.
Ladle the sauce into sterilized pint jars, leaving 1/2-inch headspace at the top of each jar. Clean the tops of the jars with a paper towel that has been moistened with vinegar. Place lids onto the jars and fasten to fingertip tightness.
Use canning tongs to transfer the jars to a stockpot full of boiling water that covers the jars by 2 inches. Put the lid on the stockpot, return the water to a boil and boil for 15 minutes. Transfer the jars to a towel-lined counter and allow them to cool completely.
Store the jars in a cool, dark place for up to 1 year. Once opened, store in the refrigerator for up to 3 weeks.","{'servingSize': '1 wing', 'calories': '109 kcal', 'carbohydrateContent': '5 g', 'proteinContent': '5 g', 'fatContent': '7 g', 'saturatedFatContent': '2 g', 'cholesterolContent': '22 mg', 'sodiumContent': '170 mg', 'sugarContent': '4 g', 'unsaturatedFatContent': '1 g'}",Korean,6 servings,https://addapinch.com/wp-content/uploads/2016/08/korean-chicken-wings-recipe-addapinch-1221.jpg,5.0,"Baked Korean Chicken Wings Recipe - Chicken Wings are always a favorite appetizer, snack, or even an entree! These sweet and spicy baked Korean chicken wings will quickly become a favorite for all of your gatherings!",Complete
Snack,Crispy Snap Peas Recipe,25,"1 pound sugar snap peas, 1 tablespoon olive oil, 1 teaspoon kosher salt, 1/2 teaspoon ground black pepper, 1 1/2 teaspoons homemade ranch seasoning, 1 1/2 teaspoons spicy dry rub mix","IngredientGroup(ingredients=['1 pound sugar snap peas', '1 tablespoon olive oil'], purpose=None), IngredientGroup(ingredients=['1 teaspoon kosher salt', '1/2 teaspoon ground black pepper'], purpose='Salt and Pepper Crispy Snap Peas:'), IngredientGroup(ingredients=['1 1/2 teaspoons homemade ranch seasoning'], purpose='Ranch Crispy Snap Peas:'), IngredientGroup(ingredients=['1 1/2 teaspoons spicy dry rub mix'], purpose='Sweet & Spicy Crispy Snap Peas:')","Preheat oven to 450ºF.
Wash and dry sugar snap peas. Toss with 1 tablespoon olive oil and seasoning of choice. Arrange in a single layer on a rimmed baking sheet. Bake until crispy, about 20 minutes.
Remove from oven and serve.","{'calories': '53 kcal', 'carbohydrateContent': '6 g', 'proteinContent': '2 g', 'fatContent': '2 g', 'saturatedFatContent': '1 g', 'sodiumContent': '391 mg', 'fiberContent': '2 g', 'sugarContent': '3 g', 'unsaturatedFatContent': '3 g', 'servingSize': '1 serving'}",American,6 servings,https://addapinch.com/wp-content/uploads/2016/06/snap-pea-crisps-recipe-addapinch-0975.jpg,5.0,Crispy Sugar Snap Peas Recipe - These crispy sugar snap peas will quickly become a favorite snack! Ready in minutes!,Complete
Appetizer,Avocado Dip Recipe (Avocado Crema),5,"1 medium avocado, 1/4 cup Greek yogurt, 2 tablespoons lime juice, 1 tablespoon cilantro, 1/2 teaspoon kosher salt","IngredientGroup(ingredients=['1 medium avocado', '1/4 cup Greek yogurt', '2 tablespoons lime juice', '1 tablespoon cilantro', '1/2 teaspoon kosher salt'], purpose=None)","Cut avocado in half and remove the pit. Scoop out the contents of the avocado from the peeling and place into a medium mixing bowl. Mash the avocado until fairly smooth. Then, add the Greek yogurt, lime juice, half of the chopped cilantro and the kosher salt. Mix all of the ingredients together with the fork until well combined. Place into a serving bowl and top with the remaining chopped cilantro.","{'servingSize': '1 tablespoon', 'calories': '44 kcal', 'carbohydrateContent': '2 g', 'proteinContent': '1 g', 'fatContent': '4 g', 'saturatedFatContent': '1 g', 'cholesterolContent': '1 mg', 'sodiumContent': '149 mg', 'fiberContent': '2 g', 'sugarContent': '1 g', 'unsaturatedFatContent': '3 g'}",American,8 servings,https://addapinch.com/wp-content/uploads/2016/05/avocado-crema-recipe-addapinch-0849.jpg,5.0,"Avocado Dip (Avocado Crema) Recipe - This avocado dip recipe is quick, easy and delicious! It comes together in five minutes and is delicious served with so many dishes!",Complete
Appetizer,Mango Blueberry Salsa Recipe,12,"1 mango (peeled, pitted and diced), 1 bell pepper (deseeded and diced), 1 - 2 jalapeno pepper (deseeded and diced), 3 green onions (diced), 1 cup fresh blueberries, 1/4 cup cilantro (chopped), 1 tablespoon lime juice, pinch kosher salt (optional)","IngredientGroup(ingredients=['1 mango (peeled, pitted and diced)', '1 bell pepper (deseeded and diced)', '1 - 2 jalapeno pepper (deseeded and diced)', '3 green onions (diced)', '1 cup fresh blueberries', '1/4 cup cilantro (chopped)', '1 tablespoon lime juice', 'pinch kosher salt (optional)'], purpose=None)","Stir together the mango, pepper, jalapeno, onion, and blueberries in a medium bowl. Add cilantro, lime juice and salt, if using. Stir well to combine all ingredients and then serve.","{'calories': '39 kcal', 'carbohydrateContent': '9 g', 'proteinContent': '1 g', 'fatContent': '1 g', 'saturatedFatContent': '1 g', 'sodiumContent': '2 mg', 'fiberContent': '2 g', 'sugarContent': '7 g', 'unsaturatedFatContent': '2 g', 'servingSize': '1 serving'}",American,7 servings,https://addapinch.com/wp-content/uploads/2016/05/mango-blueberry-salsa-recipe-addapinch-0797.jpg,5.0,"This Mango Blueberry Salsa makes a fresh fruit salsa recipe perfect for serving with fish, chicken, or on a chip!",Complete
"Appetizer,dinner,Lunch,Snack",Meatball Sliders Recipe,30,"1 pound ground beef, 1 teaspoon Stone House Seasoning, 2 tablespoons chopped fresh parsley (optional), 2 teaspoons oregano flakes, 1 large egg, 2 tablespoons breadcrumbs, 4 slices bacon (cooked and cut into thirds), 1 cup tomato sauce, 12 dinner rolls (or slider buns), 12 slices provolone cheese","IngredientGroup(ingredients=['1 pound ground beef', '1 teaspoon Stone House Seasoning', '2 tablespoons chopped fresh parsley (optional)', '2 teaspoons oregano flakes', '1 large egg', '2 tablespoons breadcrumbs'], purpose='For the Meatballs'), IngredientGroup(ingredients=['4 slices bacon (cooked and cut into thirds)', '1 cup tomato sauce', '12 dinner rolls (or slider buns)', '12 slices provolone cheese'], purpose='For the Sliders')","Prep. Line a baking sheet with parchment paper. Preheat oven to 425º F.
Make the Meatballs. Add all of the ingredients for the meatballs to a large mixing bowl. With clean hands, combine all of the ingredients until just well combined. Do not overmix. Use a medium cookie scoop (2-tablespoon) or a spoon and scoop the meatball mixture. Roll in your hands to form the meatballs. Place onto the prepared baking sheet. Once all of the meatballs have been formed, bake until an instant-read thermometer reaches 160º F, about 10 - 12 minutes. Remove from the oven.
Make the sliders. Add a slice of bacon to the bottom half of a dinner roll or slider bun. Place a meatball on top and spoon a tablespoon of tomato sauce over each meatball. Top with a slice of provolone cheese. Return to the oven until the cheese has melted and the tomato sauce is warmed, about 5 minutes. Remove from the oven and rest for 5 minutes before serving.","{'calories': '331 kcal', 'carbohydrateContent': '23 g', 'proteinContent': '17 g', 'fatContent': '19 g', 'saturatedFatContent': '8 g', 'transFatContent': '0.5 g', 'cholesterolContent': '60 mg', 'sodiumContent': '650 mg', 'fiberContent': '2 g', 'sugarContent': '2 g', 'unsaturatedFatContent': '9 g', 'servingSize': '1 serving'}",American,12 servings,https://addapinch.com/wp-content/uploads/2016/02/meatball-sliders-DSC_1927.jpg,5.0,"This easy Meatball Sliders recipe makes a great appetizer, lunch, or dinner! Tender, juicy meatballs nestled in slider rolls topped with tomato sauce, and melted cheese are always a crowd favorite!",Complete
Appetizer,Easy Ranch Dip Recipe,5,"1 tablespoon homemade ranch seasoning, 1/2 cup sour cream (Greek yogurt, plain yogurt, or Kefir)","IngredientGroup(ingredients=['1 tablespoon homemade ranch seasoning', '1/2 cup sour cream (Greek yogurt, plain yogurt, or Kefir)'], purpose=None)","Stir homemade ranch seasoning into your choice of sour cream, yogurt, or Kefir. Serve immediately, or in an airtight container in the refrigerator for up to a week.","{'servingSize': '1 tablespoon', 'calories': '30 kcal', 'carbohydrateContent': '1 g', 'proteinContent': '1 g', 'fatContent': '3 g', 'saturatedFatContent': '2 g', 'cholesterolContent': '7 mg', 'sodiumContent': '158 mg', 'sugarContent': '1 g', 'unsaturatedFatContent': '2 g'}",American,8 servings,https://addapinch.com/wp-content/uploads/2016/01/homemade-ranch-seasoning-recipe_DSC3091.jpg,5.0,"Easy Ranch Dip - Ranch dip makes the perfect little dip as an appetizer or snack! Quick and easy, this ranch dip is made of whole food ingredients you most likely have on hand!",Complete
Appetizer,Chocolate Dipped Pecans Recipe,25,"1 recipe roasted pecans, 1 cup chocolate chips (dark, milk, or semisweet), 1 teaspoon coconut oil, kosher salt","IngredientGroup(ingredients=['1 recipe roasted pecans', '1 cup chocolate chips (dark, milk, or semisweet)', '1 teaspoon coconut oil', 'kosher salt'], purpose=None)","Line a rimmed baking sheet with parchment paper.
Prepare simple roasted pecan halves according to the recipe instructions. Allow to cool completely.
Meanwhile, add chocolate chips and coconut oil to a glass bowl. Microwave at 50% power for 1 1/2 - 2 minutes. Remove from microwave and stir until smooth.
Dip each pecan half halfway into the melted chocolate and place onto the parchment lined baking sheet. Repeat until all pecans have been dipped. Sprinkle with salt and allow chocolate to dry completely.","{'calories': '280 kcal', 'carbohydrateContent': '11 g', 'proteinContent': '4 g', 'fatContent': '26 g', 'saturatedFatContent': '6 g', 'transFatContent': '1 g', 'cholesterolContent': '9 mg', 'sodiumContent': '178 mg', 'fiberContent': '3 g', 'sugarContent': '9 g', 'unsaturatedFatContent': '18 g', 'servingSize': '1 serving'}",American,16 servings,https://addapinch.com/wp-content/uploads/2015/12/chocolate-pecans-recipe_DSC2943-2.jpg,5.0,"Chocolate Dipped Pecans make an easy, yet elegant treat perfect for entertaining and gifts!",Complete
Snack,Halloween Snack Mix Recipe,4,"4 cups popped popcorn, 1/4 cup cocktail peanuts, 1/4 cup mini pretzels, 1/4 candy pumpkins or candy corn, 1/2 cup white chocolate chips, 1 teaspoon shortening","IngredientGroup(ingredients=['4 cups popped popcorn', '1/4 cup cocktail peanuts', '1/4 cup mini pretzels', '1/4 candy pumpkins or candy corn', '1/2 cup white chocolate chips', '1 teaspoon shortening'], purpose=None)","In a large bowl, stir together popcorn, peanuts, pretzels, and candy pumpkins. Spread onto a parchment paper lined jelly roll pan.
Add white chocolate chips to a microwave safe bowl and add in shortening or coconut oil. Microwave at medium (50%) for about 20 seconds and stir until smooth. If chips are not smooth, return to microwave at 10 second intervals, stirring after each until smooth. Drizzle over popcorn mix and allow to reach room temperature for the chocolate to harden before serving.","{'calories': '63 kcal', 'carbohydrateContent': '7 g', 'proteinContent': '1 g', 'fatContent': '3 g', 'saturatedFatContent': '1 g', 'transFatContent': '1 g', 'cholesterolContent': '1 mg', 'sodiumContent': '33 mg', 'fiberContent': '1 g', 'sugarContent': '4 g', 'unsaturatedFatContent': '2 g', 'servingSize': '1 serving'}",American,15 servings,https://addapinch.com/wp-content/uploads/2015/10/halloween-popcorn-snack-mix-recipe-DSC_5330-1.jpg,5.0,"This Halloween Snack Mix is a sweet and salty treat perfect for all of your festivities! Made with a few easy ingredients, it's always a hit!",Complete
Appetizer,So Easy Fruit Dip Recipe,5,"1 (8-ounce) package Neufchatel cheese (or cream cheese, softened), 1 cup sugar ( cane sugar or granulated sugar), 2 tablespoons molasses (or packed dark brown sugar), 1 teaspoon vanilla extract, 1/8 teaspoon kosher salt","IngredientGroup(ingredients=['1 (8-ounce) package Neufchatel cheese (or cream cheese, softened)', '1 cup sugar ( cane sugar or granulated sugar)', '2 tablespoons molasses (or packed dark brown sugar)', '1 teaspoon vanilla extract', '1/8 teaspoon kosher salt'], purpose=None)","Cream together Neufchatel cheese and cane sugar with an electric mixer until light and fluffy, about 3 minutes. Add in molasses, vanilla and salt until well incorporated. Serve immediately or store an in airtight container for up to a week in the refrigerator.","{'servingSize': '1 tablespoon', 'calories': '62 kcal', 'carbohydrateContent': '10 g', 'proteinContent': '1 g', 'fatContent': '2 g', 'saturatedFatContent': '1 g', 'cholesterolContent': '7 mg', 'sodiumContent': '24 mg', 'sugarContent': '10 g', 'unsaturatedFatContent': '2 g'}",American,24 servings,https://addapinch.com/wp-content/uploads/2015/10/Fruit-Dip-Recipe_DSC2757-1.jpg,5.0,This apple dip recipe is quick and easy and uses just five ingredients for a dip everyone loves!,Complete
"Appetizer,Snack",Baked Apple Chips Recipe,65,"2 medium apples (sliced 1/8-inch thick), ground cinnamon (optional), granulated sugar (optional)","IngredientGroup(ingredients=['2 medium apples (sliced 1/8-inch thick)', 'ground cinnamon (optional)', 'granulated sugar (optional)'], purpose=None)","Preheat oven to 225º F. Line two rimmed baking sheets with parchment paper. Arrange apple slices on sheet pans in a single layer. If using cinnamon and sugar, combine together in a small bowl and sprinkle over top apple slices. Place sheet pans in preheated oven and bake 45 minutes, flip apple slices over and bake another 30 minutes or until crisp. Store in an airtight container for up to a week.","{'servingSize': '0.5 cup', 'calories': '47 kcal', 'carbohydrateContent': '13 g', 'proteinContent': '0.2 g', 'fatContent': '0.2 g', 'saturatedFatContent': '0.03 g', 'sodiumContent': '1 mg', 'fiberContent': '2 g', 'sugarContent': '9 g', 'unsaturatedFatContent': '0.06 g'}",American,4 servings,https://addapinch.com/wp-content/uploads/2015/10/baked-apple-chips-recipe_DSC2751-2.jpg,5.0,"Baked apple chips are so simple to make at home! Crispy and delicious, these apple chips are addictive!",Complete
Snack,Boiled Peanuts Recipe,1445,"3 pounds green peanuts, 1/4 cup kosher salt, 6 cups water","IngredientGroup(ingredients=['3 pounds green peanuts', '1/4 cup kosher salt', '6 cups water'], purpose=None)","Rinse peanuts until the water runs clear.
Place into slow cooker. Add in salt and pour in water.
Cook for 12 hours on high setting, checking occasionally to add more water if needed.
Turn slow cooker to warm setting and allow to sit in slow cooker for another 9-12 hours.
Serve straight from the slow cooker to keep warm, straining off brine and pouring into cups or bowls.","{'calories': '160 kcal', 'carbohydrateContent': '7 g', 'proteinContent': '7 g', 'fatContent': '11 g', 'sodiumContent': '2364 mg', 'fiberContent': '3 g', 'sugarContent': '2 g', 'servingSize': '1 serving'}",American,12 servings,https://addapinch.com/wp-content/uploads/2015/10/boiled-peanuts-b-8-602x399-1.jpg,5.0,"Boiled Peanuts are a favorite southern treat! Get this delicious, easy boiled peanuts recipe that you'll love!",Complete
Appetizer,Sausage Cheddar Biscuit Bites Recipe,15,"3 cups self-rising flour, 1 teaspoon baking powder, 1/4 cup shortening, 1 (16-ounce) package breakfast sausage (, browned and drained), 1 cup shredded sharp cheddar cheese, 3/4 cup buttermilk, 1/2 teaspoon hot sauce (optional)","IngredientGroup(ingredients=['3 cups self-rising flour', '1 teaspoon baking powder', '1/4 cup shortening', '1 (16-ounce) package breakfast sausage (, browned and drained)', '1 cup shredded sharp cheddar cheese', '3/4 cup buttermilk', '1/2 teaspoon hot sauce (optional)'], purpose=None)","Preheat oven to 475º F. Whisk together flour and baking powder in a large bowl. Cut in shortening with a pastry blender or using a fork until the flour mixture resembles coarse crumbs.
Stir in sausage, cheddar cheese, buttermilk and hot sauce until well combined. The dough will be moist and shouldn't have any visibly dry flour remaining in the mixture.
Scoop biscuit bites using a tablespoon or a small cookie scoop and place onto rimmed baking sheets. Place into the oven and bake until cooked through and lightly browned, about 8 to 10 minutes. Remove from the oven and serve.
Freezer instructions:
Bake as directed and allow to cool completely. Then, place into freezer safe zip top bags and place into the freezer for up to a month. To reheat, simply remove the number of biscuit bites you need and reheat in a 350º F preheated oven for about 8 to 10 minutes or heat in the microwave at 80% power for about 45 seconds.","{'calories': '99 kcal', 'carbohydrateContent': '12 g', 'proteinContent': '3 g', 'fatContent': '4 g', 'saturatedFatContent': '2 g', 'transFatContent': '1 g', 'cholesterolContent': '6 mg', 'sodiumContent': '40 mg', 'fiberContent': '1 g', 'sugarContent': '1 g', 'unsaturatedFatContent': '2 g', 'servingSize': '1 serving'}",American,24 servings,https://addapinch.com/wp-content/uploads/2015/09/sausage-cheddar-biscuit-bites-recipe-_DSC23921-2.jpg,5.0,"These sausage cheddar biscuit bites are a quick and easy, yet oh so delicious biscuit recipe your whole family is sure to love!",Complete
Appetizer,Hot Pimento Cheese Dip,15,"8 ounces cheddar cheese (shredded), ½ cup mayonnaise, 1 1/2 tablespoons Dijon mustard, 1/2 teaspoon mustard powder, ¼ teaspoon kosher salt, ¼ teaspoon ground black pepper, 2 tablespoons jalapeno pepper (chopped), ½ cup pimento","IngredientGroup(ingredients=['8 ounces cheddar cheese (shredded)', '½ cup mayonnaise', '1 1/2 tablespoons Dijon mustard', '1/2 teaspoon mustard powder', '¼ teaspoon kosher salt', '¼ teaspoon ground black pepper', '2 tablespoons jalapeno pepper (chopped)', '½ cup pimento'], purpose=None)","Combine all ingredients in a large bowl.
Pour into a microwave-safe dish and microwave for about 20 seconds, or until hot.
Serve warm with tortilla chips or your favorite vegetable sticks such as celery, asparagus, or cucumbers.","{'calories': '286 kcal', 'carbohydrateContent': '2 g', 'proteinContent': '10 g', 'fatContent': '26 g', 'saturatedFatContent': '10 g', 'cholesterolContent': '47 mg', 'sodiumContent': '493 mg', 'fiberContent': '1 g', 'sugarContent': '1 g', 'unsaturatedFatContent': '16 g', 'servingSize': '1 serving'}",American,6 servings,https://addapinch.com/wp-content/uploads/2015/09/hot-pimento-cheese-dip-b-42-602x407-1.jpg,5.0,"Hot Pimento Cheese Dip is a delicious twist on the classic pimento cheese recipe, taking it to dip form. Get this family-favorite recipe!",Complete
Main Course,Brisket Nachos Recipe,22,"3 cups tortilla chips, 2 cups cooked shredded smoked brisket or oven-cooked brisket, 1 1/2 cups grated cheddar cheese, 1 deseeded jalapeno (diced), 1 medium tomato (diced), 1 medium avocado (diced), salsa, sour cream","IngredientGroup(ingredients=['3 cups tortilla chips', '2 cups cooked shredded smoked brisket or oven-cooked brisket', '1 1/2 cups grated cheddar cheese', '1 deseeded jalapeno (diced)', '1 medium tomato (diced)', '1 medium avocado (diced)'], purpose=None), IngredientGroup(ingredients=['salsa', 'sour cream'], purpose='Optional toppings')","Preheat oven to 350º F. Arrange half of tortilla chips in a single layer on the sheet pan. Top with half of each: brisket, cheese, and jalapeno. Repeat layer with remaining chips, brisket, cheese and jalapeno. Place in the oven until the cheese has melted, about 12 to 15 minutes. Remove from oven and top with tomato and avocado. Serve with optional toppings, if desired.","{'calories': '1042 kcal', 'carbohydrateContent': '31 g', 'proteinContent': '103 g', 'fatContent': '54 g', 'saturatedFatContent': '18 g', 'cholesterolContent': '303 mg', 'sodiumContent': '674 mg', 'fiberContent': '4 g', 'sugarContent': '1 g', 'servingSize': '1 serving'}",American,8 servings,https://addapinch.com/wp-content/uploads/2015/07/brisket-nachos-recipe_DSC1948-1.jpg,4.0,"Brisket Nachos make a quick and easy way to repurpose leftover brisket. So simple and so delicious, it will become a favorite!",Complete
