Category,Title,Total Time,All Ingredients,Ingredient Groups,Instructions,Nutrition,Cuisine,Yields,Image,Ratings,Description,Status
Side Dish,Roasted Sweet Potato Wedges Recipe,30,"3 medium sweet potatoes (scrubbed clean), 2 tablespoons olive oil, 1 teaspoon Stone House Seasoning, 1/2 teaspoon chili powder","IngredientGroup(ingredients=['3 medium sweet potatoes (scrubbed clean)', '2 tablespoons olive oil', '1 teaspoon Stone House Seasoning', '1/2 teaspoon chili powder'], purpose=None)","Prep the Sweet Potatoes
Cut the ends off of the sweet potatoes and then cut the sweet potatoes in half. Next, cut each half into four equal sized wedges. You should have 8 wedges. Arrange the wedges on a rimmed baking sheet and drizzle with the olive oil. Sprinkle the sweet potato wedges with Stone House Seasoning and chili powder. Toss the sweet potato wedges to coat well with the oil and the seasonings.
Oven Roasted Sweet Potato Wedges
Preheat the oven to 450º F.
Place the baking sheet with the seasoned sweet potato wedges into the preheated oven. Roast until the potatoes are browned, crispy on the outside and fork tender on the inside, about 25 minutes. Remove from the oven and serve.
Air Fryer Sweet Potato Wedges
Preheat air fryer to 400º F. Spritz the air fryer basket with olive oil or nonstick cooking spray. Arrange a single layer of the seasoned sweet potato wedges onto the air fryer basket, taking care not to let the wedges touch. You may have to cook in batches to prepare all of the wedges depending on the size of your air fryer.
Cook for 10 minutes and then turn the wedges over to cook to the desired level of crispiness, about 10 - 12 more minutes. Remove from the air fryer and serve.","{'calories': '139 kcal', 'carbohydrateContent': '23 g', 'proteinContent': '2 g', 'fatContent': '5 g', 'saturatedFatContent': '1 g', 'sodiumContent': '453 mg', 'fiberContent': '3 g', 'sugarContent': '5 g', 'unsaturatedFatContent': '4 g', 'servingSize': '1 serving'}",American,6 servings,https://addapinch.com/wp-content/uploads/2016/05/spicy-sweet-potato-wedges-recipe-addapinch-0858.jpg,5.0,"Spicy Sweet Potato Wedges Recipe - Spicy Roasted Sweet Potato Wedges make an easy and delicious recipe! Made with just five ingredients, these roasted sweet potatoes will definitely become a favorite!",Complete
Appetizer,Cheese Straws Recipe,32,"1/2 pound sharp Cheddar cheese, 1/2 cup butter (softened), 1 1/2 cups all-purpose flour, 1 teaspoon kosher salt, 1/4 teaspoon cayenne pepper, 1/4 teaspoon smoked paprika, 1/4 teaspoon ground black pepper, pinch garlic powder","IngredientGroup(ingredients=['1/2 pound sharp Cheddar cheese', '1/2 cup butter (softened)', '1 1/2 cups all-purpose flour', '1 teaspoon kosher salt', '1/4 teaspoon cayenne pepper', '1/4 teaspoon smoked paprika', '1/4 teaspoon ground black pepper', 'pinch garlic powder'], purpose=None)","Preheat oven to 375º F. Line baking sheets with parchment paper or non-stick silicon baking sheets. Set aside.
Grate cheddar cheese and place all but 1 cup into the bowl of a stand mixer. Add butter and cream butter and cheese together until it reaches a smooth, creamy consistency, about 5-10 minutes.
In a large bowl, sift together flour, salt, cayenne pepper, paprika, black pepper and garlic powder. Gradually add flour mixture into cheese and butter mixture by large spoons full, taking care to fully incorporate after each addition.
Once all flour has been incorporated and dough is smooth, stir in final cup of grated cheddar cheese.
Place portions of dough into cookie press or large piping bag fitted with large star piping tip. Slowly pipe long strands of cheese straw dough onto prepared baking sheets about 1 - 1 1/2-inches apart. Then, cut into 6-inch lengths.
Bake cheese straws for 10-12 minutes, until edges just begin to turn golden brown. Remove from oven and allow to cool. Store in an airtight container, layering between parchment paper to keep fresh.
Best eaten the day they are made, but will keep up to 3 days in an airtight container.
Note that cheese straws are extremely delicate and will break easily. This is part of their charm and character.","{'calories': '68 kcal', 'carbohydrateContent': '4 g', 'proteinContent': '2 g', 'fatContent': '5 g', 'saturatedFatContent': '3 g', 'transFatContent': '1 g', 'cholesterolContent': '14 mg', 'sodiumContent': '127 mg', 'fiberContent': '1 g', 'sugarContent': '1 g', 'unsaturatedFatContent': '2 g', 'servingSize': '1 serving'}",American,36 servings,https://addapinch.com/wp-content/uploads/2013/03/cheese-straws-DSC_2386-2.jpg,5.0,"These delicious Cheese Straws are an heirloom family recipe and Southern classics! Made with a cookie press, ready in 30 minutes and perfect for entertaining!",Complete
Appetizer,Southern Pimento Cheese Recipe,10,"1 (8-ounce) sharp cheddar cheese (shredded), 1 (8-ounce) mild cheddar cheese (shredded), 1 (8-ounce) package cream cheese (softened), ¼ cup diced pimentos, 1/2 teaspoon kosher salt, 1/4 teaspoon ground black pepper, 2-3 tablespoons mayonnaise (optional)","IngredientGroup(ingredients=['1 (8-ounce) sharp cheddar cheese (shredded)', '1 (8-ounce) mild cheddar cheese (shredded)', '1 (8-ounce) package cream cheese (softened)', '¼ cup diced pimentos', '1/2 teaspoon kosher salt', '1/4 teaspoon ground black pepper', '2-3 tablespoons mayonnaise (optional)'], purpose=None)","Cream together cheddar cheese with the softened cream cheese until well combined.
Stir in pimentos and salt and pepper.
If you prefer your pimento cheese to be a bit thinner for spreading, add in optional mayonnaise, Greek yogurt, or liquid from the diced pimentos to preference.","{'servingSize': '0.25 cup', 'calories': '112 kcal', 'carbohydrateContent': '1 g', 'proteinContent': '7 g', 'fatContent': '8 g', 'saturatedFatContent': '4 g', 'cholesterolContent': '23 mg', 'sodiumContent': '361 mg', 'sugarContent': '1 g'}",American,12 servings,https://addapinch.com/wp-content/uploads/2010/10/pimento-cheese-recipe-0346-scaled.jpg,5.0,"Southern Pimento Cheese Recipe – A staple spread in Southern home and parties, pimento cheese is a classic! Made with cheddar cheese, pimentos and a secret ingredient, this pimento cheese recipe is always a hit!",Complete
"Appetizer,Side Dish",Classic Deviled Eggs,35,"12 eggs (hard boiled), 1/3 cup mayonnaise, 1/4 teaspoon kosher salt, 1/4 teaspoon ground black pepper","IngredientGroup(ingredients=['12 eggs (hard boiled)', '1/3 cup mayonnaise', '1/4 teaspoon kosher salt', '1/4 teaspoon ground black pepper'], purpose=None)","Prepare the eggs: Chill your hard-boiled eggs for at least an hour to overnight. Slice the eggs in half lengthwise and remove the yolk to a medium bowl. Place the egg whites onto a serving platter or in a container for storing if making in advance.
Make the filling: Mash yolks with a fork until the yolks are crumbled. Stir the mayonnaise, salt, and pepper with the egg yolks until well combined.
Assemble the deviled eggs: Spoon the egg yolk mixture into the egg white. You can also transfer the egg yolk mixture to a piping bag fitted with a star tip and pipe the egg yolk mixture into the egg white. Top with optional toppings, if desired.
Refrigerate and serve: Refrigerate until ready to serve.","{'calories': '66 kcal', 'carbohydrateContent': '1 g', 'proteinContent': '6 g', 'fatContent': '4 g', 'saturatedFatContent': '1 g', 'cholesterolContent': '164 mg', 'sodiumContent': '113 mg', 'sugarContent': '0.3 g', 'transFatContent': '0.02 g', 'fiberContent': '0.01 g', 'unsaturatedFatContent': '3 g', 'servingSize': '1 serving'}",American,12 servings,https://addapinch.com/wp-content/uploads/2016/02/classic-deviled-eggs-recipe-2234-scaled.jpg,5.0,"Deviled eggs make the perfect appetizer or side dish for family meals, parties, showers, and other events. Get this family favorite deviled eggs recipe you are sure to love.",Complete
"Appetizer,Snack",Buffalo Cauliflower Recipe (Air Fryer or Oven),20,"1 whole cauliflower (cut into florets), 2 tablespoons olive oil, 1 1/2 teaspoons Stone House Seasoning, 3/4 cup buffalo sauce","IngredientGroup(ingredients=['1 whole cauliflower (cut into florets)', '2 tablespoons olive oil', '1 1/2 teaspoons Stone House Seasoning', '3/4 cup buffalo sauce'], purpose=None)","Air Fryer Buffalo Cauliflower
Preheat air fryer to 380º F.
Add cauliflower florets to a large bowl. Pour in the olive oil and sprinkle with Stone House Seasoning. Toss to coat. Arrange the cauliflower florets in the air fryer and cook for 8 to 10 minutes, shaking the basket halfway through cooking.
Transfer the cooked cauliflower from the air fryer basket back into the bowl. Pour in the buffalo sauce and toss to coat.
Serve with ranch dressing and blue cheese dressing, if desired.
Oven Baked Buffalo Cauliflower
To make buffalo cauliflower in the oven, preheat oven to 400º F. Line a baking sheet with parchment paper.
Add cauliflower florets to a large bowl. Pour in the olive oil and sprinkle with Stone House Seasoning. Toss to coat. Arrange the coated cauliflower on prepared baking sheet and bake for 25 to 30 minutes.
Transfer the cooked cauliflower from the baking sheet back into the bowl. Pour in the buffalo sauce and toss to coat.
Serve with the reserved buffalo sauce, ranch dressing and / blue cheese dressing, if desired.","{'calories': '41 kcal', 'carbohydrateContent': '0.01 g', 'proteinContent': '0.003 g', 'fatContent': '5 g', 'saturatedFatContent': '1 g', 'sodiumContent': '1501 mg', 'sugarContent': '0.003 g', 'fiberContent': '0.003 g', 'unsaturatedFatContent': '3.5 g', 'servingSize': '1 serving'}",American,6 servings,https://addapinch.com/wp-content/uploads/2019/01/Buffalo-Cauliflower-Recipe-16.jpg,5.0,"This Buffalo Cauliflower recipe makes a spicy, crunchy, and easy appetizer or snack! Made with four ingredients, it is gluten and dairy-free!",Complete
Salad,Classic Egg Salad Recipe,10,"6 large hard cooked eggs, ¼ cup mayonnaise, salt and pepper (to taste)","IngredientGroup(ingredients=['6 large hard cooked eggs', '¼ cup mayonnaise', 'salt and pepper (to taste)'], purpose=None)",Place peeled eggs into a large bowl or the bowl of your stand mixer and mash with a fork or using the paddle attachment of your stand mixer. Add mayonnaise and mix together until well-combined and eggs are light and fluffy. Add salt and ground black pepper to taste.,"{'calories': '141 kcal', 'carbohydrateContent': '1 g', 'proteinContent': '6 g', 'fatContent': '12 g', 'saturatedFatContent': '3 g', 'transFatContent': '1 g', 'cholesterolContent': '190 mg', 'sodiumContent': '121 mg', 'sugarContent': '1 g', 'unsaturatedFatContent': '9 g', 'servingSize': '1 serving'}",American,6 servings,https://addapinch.com/wp-content/uploads/2014/02/Egg-Salad-Recipe-8.jpg,5.0,"The best Egg Salad Recipe made with three basic ingredients featuring hard-boiled eggs. This quick and easy, classic egg salad is a favorite!",Complete
"Appetizer,Breakfast",How to Make Perfect Hard Boiled Eggs,15,"12 large eggs, water, 1/4 teaspoon baking soda","IngredientGroup(ingredients=['12 large eggs', 'water', '1/4 teaspoon baking soda'], purpose=None)","To boil eggs, place eggs in a single layer in a heavy-bottomed saucepan. Do not add more eggs than a single layer or they will not produce the perfect hard boiled egg.
Cover the eggs with fresh water, plus about 1 to 2 inches of water. Add baking soda. Place saucepan onto stovetop at medium-low heat and bring to a boil for 1 minute. Cover and remove the saucepan from the heat and allow to sit for 12 minutes.
Remove eggs from water with a slotted spoon and plunge into a bowl of ice water to stop all cooking.
To peel eggs, simply tap them on their sides onto a hard surface such as a counter top. Then, carefully peel the shell away. If the eggs seem hard to peel, I've found peeling them under a slight stream of running, cold water to be helpful. Eggs, once peeled, may stay in an airtight container for 5 to 7 days.","{'servingSize': '1 egg', 'calories': '75 kcal', 'proteinContent': '7 g', 'fatContent': '5 g'}",American,12 servings,https://addapinch.com/wp-content/uploads/2014/03/Hard-Boiled-Eggs-Recipe-10.jpg,5.0,Fail-proof hard boiled eggs recipe for how to boil eggs so they come out perfectly every time.,Complete
Appetizer,The BEST Easy Hummus Recipe,5,"2 (15-ounce) cans chickpeas (garbanzo beans), drained and rinsed, 1/4 cup olive oil, 1/3 cup tahini, 1/2 cup lemon juice, 1/2 teaspoon Stone House Seasoning, 2-4 tablespoons water, fresh parsley (optional), pine nuts (optional)","IngredientGroup(ingredients=['2 (15-ounce) cans chickpeas (garbanzo beans), drained and rinsed', '1/4 cup olive oil', '1/3 cup tahini', '1/2 cup lemon juice', '1/2 teaspoon Stone House Seasoning', '2-4 tablespoons water', 'fresh parsley (optional)', 'pine nuts (optional)'], purpose=None)","Add chickpeas, olive oil, tahini, lemon juice, and Stone House Seasoning to food processor. Pulse until the hummus is combined well and beginning to become smooth.
Through the top of the food processor, slowly pour in the water a tablespoon at a time until the hummus recipe has reached a smooth and creamy consistency as desired.
Transfer to a serving dish and top with optional garnishes of olive oil, fresh parsley and pine nuts.","{'servingSize': '2 tablespoons', 'calories': '70 kcal', 'carbohydrateContent': '4 g', 'proteinContent': '2 g', 'fatContent': '5 g', 'saturatedFatContent': '4 g', 'sodiumContent': '130 mg', 'fiberContent': '2 g', 'sugarContent': '1 g'}",American,3 servings,https://addapinch.com/wp-content/uploads/2018/03/classic-hummus-recipe-0371-scaled.jpg,5.0,This Easy Hummus Recipe is delicious and ready in minutes! Simple to make with only six ingredients and perfect for serving as a dip or spread for sandwiches and wraps!,Complete
"Appetizer,Main Course",Sheet Pan Nachos Recipe,25,"1 (9-ounce) package tortilla chips, 1 pound ground beef, 1 teaspoon ground cumin, 1 teaspoon chili powder, 1 teaspoon Stone House Seasoning, 1 cup grated monterey jack cheese, 1 cup grated Cheddar cheese, 1 (15-ounce) can black beans, drained and rinsed, 1/4 cup pickled jalapeno slices, 3 green onions (sliced), 1/2 cup restaurant style salsa, 1 (4-ounce) container sour cream, 2 medium avocado (pitted and diced), 1 medium lime (sliced into wedges)","IngredientGroup(ingredients=['1 (9-ounce) package tortilla chips', '1 pound ground beef', '1 teaspoon ground cumin', '1 teaspoon chili powder', '1 teaspoon Stone House Seasoning', '1 cup grated monterey jack cheese', '1 cup grated Cheddar cheese', '1 (15-ounce) can black beans, drained and rinsed', '1/4 cup pickled jalapeno slices', '3 green onions (sliced)', '1/2 cup restaurant style salsa', '1 (4-ounce) container sour cream', '2 medium avocado (pitted and diced)', '1 medium lime (sliced into wedges)'], purpose=None)","Preheat oven to 350º F. Line a baking sheet with foil or parchment paper. Arrange the tortilla chips in a single layer on the prepared baking sheet and set aside.
Add the ground beef to a medium skillet set over medium heat. Sprinkle on cumin, chili powder, and Stone House Seasoning. Cook, stirring frequently, until all of the meat is brown, about 5 minutes. Remove the skillet from the heat.
Remove the meat mixture from the skillet using a slotted spoon and arrange it on top of the chips. Then, top with the cheeses and the the black beans. Place the sheet pan into the preheated oven and bake until the cheeses have melted, about 5 - 7 minutes. Remove from the oven and top with peppers, green onions, salsa, sour cream, and avocado. Squeeze two lime wedges over the top of the nachos and serve the remaining lime wedges on the side.","{'calories': '463 kcal', 'carbohydrateContent': '10 g', 'proteinContent': '24 g', 'fatContent': '37 g', 'saturatedFatContent': '14 g', 'transFatContent': '1 g', 'cholesterolContent': '89 mg', 'sodiumContent': '924 mg', 'fiberContent': '6 g', 'sugarContent': '2 g', 'unsaturatedFatContent': '18 g', 'servingSize': '1 serving'}","American,Mexican",6 servings,https://addapinch.com/wp-content/uploads/2017/02/sheet-pan-nachos-recipe_DSC5349-2.jpg,5.0,This Sheet Pan Nachos Recipe makes a quick and easy appetizer for a crowd or a favorite weeknight supper! These delicious nachos are ready in less than 30 minutes and are simple to make on your sheet pan.,Complete
"Appetizer,Snack",Best Homemade Salsa Recipe (Restaurant Style Salsa),5,"1 (28-ounce) can crushed tomatoes, 1/2 large onion (roughly chopped), 2 cloves garlic (roughly chopped ), 1-3 medium jalapeno peppers (roughly chopped), 1/2 cup cilantro, 1/4 teaspoon ground cumin, 1 medium lime (juice and zest), 1/2 teaspoon kosher salt, 1/4 teaspoon ground black pepper","IngredientGroup(ingredients=['1 (28-ounce) can crushed tomatoes', '1/2 large onion (roughly chopped)', '2 cloves garlic (roughly chopped )', '1-3 medium jalapeno peppers (roughly chopped)', '1/2 cup cilantro', '1/4 teaspoon ground cumin', '1 medium lime (juice and zest)', '1/2 teaspoon kosher salt', '1/4 teaspoon ground black pepper'], purpose=None)","Add all ingredients to the container of a food processor or blender. Pulse the food processor or blender until the salsa recaches the consistency that you prefer, about 3-5 pulses. It is best when you allow the flavors to combine by letting the salsa rest about 15 minutes before serving. Store any remaining in an airtight container in the refrigerator.","{'servingSize': '0.25 cup', 'calories': '21 kcal', 'carbohydrateContent': '4 g', 'sodiumContent': '584 mg', 'sugarContent': '1 g'}","American,Mexican",2 servings,https://addapinch.com/wp-content/uploads/2014/04/restaurant-salsa-recipe-DSC_3375-2.jpg,5.0,The Best Salsa Recipe is a delicious restaurant-style salsa that's easy to make and ready in about five minutes! It's the perfect appetizer with tortilla chips and tastes fantastic with Mexican food and many other dishes!,Complete
Appetizer,French Onion Soup Stuffed Mushrooms Recipe,40,"24 whole fresh mushrooms (cleaned and stems removed with stems chopped), 1 medium onion (thinly sliced), 1 tablespoon butter, 1/4 cup beef stock or broth, 1 slice sourdough bread, 1/2 teaspoon Stone House Seasoning, 1/2 cup grated Gruyere cheese, 1/4 cup grated Parmesan cheese, chopped fresh parsley (optional)","IngredientGroup(ingredients=['24 whole fresh mushrooms (cleaned and stems removed with stems chopped)', '1 medium onion (thinly sliced)', '1 tablespoon butter', '1/4 cup beef stock or broth', '1 slice sourdough bread', '1/2 teaspoon Stone House Seasoning', '1/2 cup grated Gruyere cheese', '1/4 cup grated Parmesan cheese', 'chopped fresh parsley (optional)'], purpose=None)","Preheat oven to 450º F. Arrange clean mushroom caps with the open cavity up on a parchment paper lined baking sheet.
Add chopped mushroom stems, sliced onion, and butter to a medium skillet set over medium heat. Cook until the onions are tender, about 7 minutes. Add the beef stock and cook until the onions are glazed and caramelized, about 10 more minutes.
Meanwhile, pulse the bread in a blender or food processor until you have made breadcrumbs. Toss with Stone House Seasoning and fill each of the mushroom caps with the seasoned bread crumbs.
Top the breadcrumbs with the onion mixture and then top with grated cheeses. Bake in the oven for 15 minutes. Remove from the oven and allow to rest on the pan to cool slightly before serving, about 5 minutes. Top with fresh parsley, if using, and serve.","{'servingSize': '2 mushrooms', 'calories': '79 kcal', 'carbohydrateContent': '10 g', 'proteinContent': '7 g', 'fatContent': '2 g', 'saturatedFatContent': '1 g', 'cholesterolContent': '4 mg', 'sodiumContent': '193 mg', 'fiberContent': '2 g', 'sugarContent': '4 g'}","American,French",12 servings,https://addapinch.com/wp-content/uploads/2018/09/french-onion-soup-stuffed-mushrooms-recipe-DSC_0551-scaled.jpg,5.0,French Onion Soup Stuffed Mushrooms Recipe - This easy and delicious French Onion Soup Stuffed Mushrooms recipe makes the perfect holiday and party appetizer! Rich French Onion Soup meets savory stuffed mushrooms in this favorite recipe!,Complete
Dessert,Sugared Cranberries Recipe,63,"1 1/2 cups sugar (divided), 1 (12-ounce bag) fresh cranberries","IngredientGroup(ingredients=['1 1/2 cups sugar (divided)', '1 (12-ounce bag) fresh cranberries'], purpose=None)","Combine 1/2 cup sugar and 1/2 cup water in a medium saucepan set over medium heat. Stir until the sugar is completely dissolved, about 3 minutes. Add the cranberries and stir until well coated. Transfer the coated cranberries, using a slotted spoon, to a wire rack situated over a baking sheet. Let dry until the cranberries are just tacky to the touch, about 30 minutes.
Working in batches, roll the cranberries in a bowl of the remaining sugar until well coated, return to the wire rack and let dry completely.
Roll the cranberries in the remaining 1 1/2 cups sugar until well coated; let dry for at least 1 hour.
Store in an airtight container in a cool place for up to a week.","{'calories': '164 kcal', 'carbohydrateContent': '42 g', 'proteinContent': '0.3 g', 'fatContent': '0.1 g', 'sodiumContent': '1 mg', 'fiberContent': '2 g', 'sugarContent': '39 g', 'servingSize': '1 serving'}",American,8 servings,https://addapinch.com/wp-content/uploads/2017/12/sugared-cranberries-recipe-0152.jpg,5.0,"Sugared Cranberries Recipe - These sparkly sugared cranberries come together quickly and easily with just two simple ingredients! Beautiful as garnish for cakes, cookies, cocktails, or to serve as a sweet, yet tart treat!",Complete
Appetizer,Sweet and Spicy Cranberry Cocktail Meatballs Recipe,30,"1 pound ground beef, 1/4 medium onion (finely diced), 1 large egg (lightly beaten), 1/4 cup whole milk, 1/2 teaspoon kosher salt, 1/2 teaspoon ground black pepper, 1/2 cup dry bread crumbs, 1 1/2 teaspoons Worcestershire sauce, 3/4 cup ketchup, 1/4 cup cranberry juice, 1 tablespoon orange juice, 1 teaspoon yellow mustard, 1/2 cup packed brown sugar, 1 tablespoon Worcestershire sauce, 1/2 teaspoon kosher salt, 1/2 teaspoons ground black pepper, 1/2 teaspoon onion powder, 1 clove garlic (minced or 1/2 teaspoon garlic powder), 1 medium jalapeno pepper (deseeded and diced)","IngredientGroup(ingredients=['1 pound ground beef', '1/4 medium onion (finely diced)', '1 large egg (lightly beaten)', '1/4 cup whole milk', '1/2 teaspoon kosher salt', '1/2 teaspoon ground black pepper', '1/2 cup dry bread crumbs', '1 1/2 teaspoons Worcestershire sauce'], purpose='For the Meatballs'), IngredientGroup(ingredients=['3/4 cup ketchup', '1/4 cup cranberry juice', '1 tablespoon orange juice', '1 teaspoon yellow mustard', '1/2 cup packed brown sugar', '1 tablespoon Worcestershire sauce', '1/2 teaspoon kosher salt', '1/2 teaspoons ground black pepper', '1/2 teaspoon onion powder', '1 clove garlic (minced or 1/2 teaspoon garlic powder)', '1 medium jalapeno pepper (deseeded and diced)'], purpose='For the Sauce:')","Preheat the oven to 325º F. Line a baking sheet with parchment paper or foil, arrange a wire rack onto the lined baking sheet, spray the wire rack well with nonstick cooking spray and set aside.
Mix together ground beef, onion, egg, milk, salt, pepper, bread crumb, and Worcestershire sauce in a medium mixing bowl until well combined. Scoop the mixture into about tablespoon sized balls and roll firmly between palms of hand to form meatballs. Place onto the wire rack lined baking sheet.
Once all of the meatballs are formed, bake until the meatballs are cooked through, about 20 minutes.
Meanwhile, combine all of the ingredients for the sauce in a large skillet set over medium heat. Cook, stirring occasionally, until the sauce has thickened, about 10 minutes.
Arrange the cooked meatballs in a slow cooker and pour the thickened sauce over the meatballs. Gently stir the meatballs to coat with the sauce. Secure the lid on the slow cooker and set on low setting to keep warm as serving.","{'calories': '60 kcal', 'carbohydrateContent': '6 g', 'proteinContent': '3 g', 'fatContent': '3 g', 'saturatedFatContent': '1 g', 'transFatContent': '0.2 g', 'cholesterolContent': '14 mg', 'sodiumContent': '144 mg', 'fiberContent': '0.1 g', 'sugarContent': '5 g', 'unsaturatedFatContent': '1.1 g', 'servingSize': '1 serving'}",American,36 servings,https://addapinch.com/wp-content/uploads/2017/12/sweet-spicy-cranberry-cocktail-meatballs-recipe-0098.jpg,5.0,"Sweet and Spicy Cranberry Cocktail Meatballs Recipe - An update on a classic party favorite, these sweet and spicy cocktail meatballs are always a hit!",Complete
