Category,Title,Total Time,All Ingredients,Ingredient Groups,Instructions,Nutrition,Cuisine,Yields,Image,Ratings,Description,Status
Main Course,Maple Glazed Chicken Wings Recipe,50,"6 pounds chicken wings, 2 tablespoons melted butter, 1 tablespoon kosher salt, 1 tablespoon ground black pepper, 1/4 cup maple syrup, 3 tablespoons Dijon mustard, 2 tablespoons balsamic vinegar, 2 tablespoons low-sodium soy sauce (or coconut aminos), 1 clove garlic (minced), 2 teaspoons Sriracha sauce, 1/2 teaspoon ground cumin, pinch red pepper flakes","IngredientGroup(ingredients=['6 pounds chicken wings', '2 tablespoons melted butter', '1 tablespoon kosher salt', '1 tablespoon ground black pepper', '1/4 cup maple syrup', '3 tablespoons Dijon mustard', '2 tablespoons balsamic vinegar', '2 tablespoons low-sodium soy sauce (or coconut aminos)', '1 clove garlic (minced)', '2 teaspoons Sriracha sauce', '1/2 teaspoon ground cumin', 'pinch red pepper flakes'], purpose=None)","Preheat oven to 400º F. Line baking sheet pan with aluminum foil, set aside. Place chicken wings into a large glass bowl.
Mix together melted butter, salt, pepper, maple syrup, mustard, balsamic vinegar, soy sauce, garlic, Sriracha sauce, ground cumin, and red pepper flakes until well-combined. Pour half over chicken wings and toss until well-coated. Place chicken wings onto lined baking sheet and bake until chicken wings are baked through and the skin is crispy, about 40-45 minutes. Brush with additional sauce and return to oven until the sauce is glossy, about 5-8 minutes.
Remove from oven and serve warm.","{'calories': '473 kcal', 'carbohydrateContent': '9 g', 'proteinContent': '34 g', 'fatContent': '32 g', 'saturatedFatContent': '10 g', 'transFatContent': '1 g', 'cholesterolContent': '149 mg', 'sodiumContent': '1257 mg', 'fiberContent': '1 g', 'sugarContent': '7 g', 'unsaturatedFatContent': '19 g', 'servingSize': '1 serving'}",American,8 servings,https://addapinch.com/wp-content/uploads/2014/01/maple-glazed-chicken-wings-recipe-DSC_2004-2.jpg,5.0,"Maple Glazed Chicken Wings are the perfect combination of sweet, spicy, hot, and smokey chicken wings recipe. Get this family favorite chicken wings recipe for your next get together.",Complete
Appetizer,Smoked Chicken Wings Recipe,50,"3-4 pounds chicken wings, dry rub (optional)","IngredientGroup(ingredients=['3-4 pounds chicken wings', 'dry rub (optional)'], purpose=None)","Prep and preheat grill or smoker to a stable 350º F.
Place chicken onto grill or smoker and smoke until internal temperature registers 165º F when checked with an internal meat probe.
Remove from smoker and wrap with aluminum foil and allow to rest for 5 to 10 minutes.","{'calories': '204 kcal', 'proteinContent': '17 g', 'fatContent': '15 g', 'saturatedFatContent': '4 g', 'transFatContent': '1 g', 'cholesterolContent': '71 mg', 'sodiumContent': '67 mg', 'unsaturatedFatContent': '9 g', 'servingSize': '1 serving'}",American,8 servings,https://addapinch.com/wp-content/uploads/2014/01/smoked-chicken-wings-DSC_1422-2.jpg,5.0,"Smoked Chicken Wings make a delicious addition to any game day, when entertaining, or any time! Get this family favorite smoked chicken wings recipe.",Complete
Appetizer,Crab Dip Recipe,35,"1 pound jumbo lump crabmeat (picked through for shells), 2 (8 ounce) packages cream cheese, (softened to room temperature), 1/4 cup mayonnaise (or Greek yogurt), 1/4 cup shredded Parmesan cheese, 2 cups shredded sharp Cheddar cheese, 2 cloves garlic (minced), 1 teaspoon onion powder (or 1/2 small onion, grated), 1 tablespoon lemon juice, 2 - 3 teaspoons hot sauce, 2 tablespoons Worcestershire sauce, 1/2 teaspoon kosher salt, 1/2 teaspoon ground black pepper","IngredientGroup(ingredients=['1 pound jumbo lump crabmeat (picked through for shells)', '2 (8 ounce) packages cream cheese, (softened to room temperature)', '1/4 cup mayonnaise (or Greek yogurt)', '1/4 cup shredded Parmesan cheese', '2 cups shredded sharp Cheddar cheese', '2 cloves garlic (minced)', '1 teaspoon onion powder (or 1/2 small onion, grated)', '1 tablespoon lemon juice', '2 - 3 teaspoons hot sauce', '2 tablespoons Worcestershire sauce', '1/2 teaspoon kosher salt', '1/2 teaspoon ground black pepper'], purpose=None)","Preheat oven to 350º F. Spray 9x13 baking dish or two small casserole dishes with nonstick cooking spray.
Combine all until well-combined. Spread into casserole dish(es). If baking in one 9x13, bake about 30-35 minutes. If baking in two smaller casserole dishes, bake about 15-20 minutes, depending on the size of the dish. Serve hot with crackers or corn or tortilla chips.","{'calories': '185 kcal', 'carbohydrateContent': '2 g', 'proteinContent': '19 g', 'fatContent': '11 g', 'saturatedFatContent': '7 g', 'cholesterolContent': '56 mg', 'sodiumContent': '956 mg', 'fiberContent': '1 g', 'sugarContent': '1 g', 'unsaturatedFatContent': '4 g', 'servingSize': '1 serving'}",American,8 servings,https://addapinch.com/wp-content/uploads/2014/01/hot-crab-dip-DSC_1611-2.jpg,5.0,Crab Dip makes a favorite appetizer or snack to serve. Get this family-favorite crab dip recipe everyone will love!,Complete
Appetizer,Chicken Cheese Ball Recipe,10,"1 (12-ounce) can chicken (white meat only preferred), 2 (8-ounce packages) cream cheese (room temperature), 1/2 cup chopped onion (or 1/2 teaspoon onion powder), 1/2 teaspoon garlic powder, 1/2 teaspoon Kosher salt, 2 cups chopped pecans, crackers and fruit (for serving)","IngredientGroup(ingredients=['1 (12-ounce) can chicken (white meat only preferred)', '2 (8-ounce packages) cream cheese (room temperature)', '1/2 cup chopped onion (or 1/2 teaspoon onion powder)', '1/2 teaspoon garlic powder', '1/2 teaspoon Kosher salt', '2 cups chopped pecans', 'crackers and fruit (for serving)'], purpose=None)","Mix together chicken, cream cheese, onion or onion powder, garlic powder, salt, and 1/2 cup of chopped pecans in a medium mixing bowl.
Pour chicken cheese ball mixture into the center of a large piece of plastic wrap. Using plastic wrap, press chicken cheese ball mixture to form a ball.
Press remaining chopped pecans onto top and sides of chicken cheese ball.
Wrap with plastic wrap and store in the refrigerator for 1 hour up to 3 days before serving.
Serve with crackers and fruit.","{'carbohydrateContent': '6 g', 'proteinContent': '8 g', 'fatContent': '25 g', 'saturatedFatContent': '9 g', 'cholesterolContent': '45 mg', 'sodiumContent': '256 mg', 'fiberContent': '2 g', 'sugarContent': '1 g', 'calories': '269 kcal', 'unsaturatedFatContent': '11 g', 'servingSize': '1 serving'}",American,12 servings,https://addapinch.com/wp-content/uploads/2013/12/chicken-cheese-ball-DSC_1394-2.jpg,5.0,"Chicken Cheese Ball makes an easy, elegant dish when entertaining. This family favorite chicken cheese ball recipe can be made up to three days ahead.",Complete
Appetizer,Praline Brie Recipe,8,"1/2 cup packed brown sugar, 1/4 cup granulated sugar, 2 tablespoons light corn syrup, ½ cup water, 2 tablespoons butter, 1½ teaspoons vanilla extract, 1 cup chopped pecans, 1 round of brie, apples (pears, grapes, and crackers for serving)","IngredientGroup(ingredients=['1/2 cup packed brown sugar', '1/4 cup granulated sugar', '2 tablespoons light corn syrup', '½ cup water', '2 tablespoons butter', '1½ teaspoons vanilla extract', '1 cup chopped pecans', '1 round of brie', 'apples (pears, grapes, and crackers for serving)'], purpose=None)","Add brown sugar, granulated sugar, corn syrup, water, and butter to a medium skillet over medium heat. Stir to combine and cook until praline sauce has thickened enough to coat the back of a wooden spoon. Remove from heat and stir in vanilla and pecans.
Place brie into a rimmed serving platter. Pour hot praline sauce over brie.
Serve with sliced apples, pears, grapes, and / or crackers.","{'calories': '303 kcal', 'carbohydrateContent': '26 g', 'proteinContent': '7 g', 'fatContent': '20 g', 'saturatedFatContent': '8 g', 'transFatContent': '1 g', 'cholesterolContent': '36 mg', 'sodiumContent': '211 mg', 'fiberContent': '1 g', 'sugarContent': '25 g', 'unsaturatedFatContent': '11 g', 'servingSize': '1 serving'}",French,8 servings,https://addapinch.com/wp-content/uploads/2013/11/praline-brie-recipe-DSC_1163.jpg,5.0,"Praline Brie is an elegant, yet simple appetizer perfect for entertaining. Warm brie, juicy fruit and a decadent praline sauce makes this a party favorite!",Complete
Appetizer,Cheesy Bacon Bread Recipe,13,"1 baguette (cut into individual slices), butter (softened), 1 (10-ounce) package Cheddar cheese (cut into slices), 3-5 pieces cooked bacon (diced), 2 green onions (sliced)","IngredientGroup(ingredients=['1 baguette (cut into individual slices)', 'butter (softened)', '1 (10-ounce) package Cheddar cheese (cut into slices)', '3-5 pieces cooked bacon (diced)', '2 green onions (sliced)'], purpose=None)","Preheat oven to 350º F.
Place baguette slices onto rimmed baking sheet and smear with a little bit of butter. Top with a slice of cheese and a few pieces of diced bacon.
Heat for 10 minutes or until the cheese has melted.
Remove from the oven and sprinkle with slices of green onion.
Serve warm.","{'carbohydrateContent': '24 g', 'proteinContent': '12 g', 'fatContent': '16 g', 'saturatedFatContent': '8 g', 'transFatContent': '1 g', 'cholesterolContent': '40 mg', 'sodiumContent': '478 mg', 'fiberContent': '1 g', 'sugarContent': '1 g', 'calories': '264 kcal', 'unsaturatedFatContent': '6 g', 'servingSize': '1 serving'}",American,8 servings,https://addapinch.com/wp-content/uploads/2013/11/cheesy-bacon-bread-DSC_0436-2.jpg,5.0,"Cheesy Bacon Bread makes a delicious, quick-cook snack or appetizer.",Complete
Appetizer,Lighter Fried Ravioli Recipe,20,"1 package refrigerated cheese ravioli, nonstick cooking spray, 1 cup panko, 1 tablespoon Italian Seasoning, 1/4 cup Parmesan cheese (grated), 1 egg white, 2 cups marinara sauce (warmed)","IngredientGroup(ingredients=['1 package refrigerated cheese ravioli', 'nonstick cooking spray', '1 cup panko', '1 tablespoon Italian Seasoning', '1/4 cup Parmesan cheese (grated)', '1 egg white', '2 cups marinara sauce (warmed)'], purpose=None)","Preheat oven to 375º F. Spray a baking sheet pan with nonstick cooking spray. Prepare ravioli according to package instructions and drain ravioli in a strainer and set aside.
Add Panko, Italian Seasoning and Parmesan cheese to a small bowl and stir to combine. In another bowl, add slightly beaten egg white.
Dredge ravioli in egg whites and then into the Panko mixture, making sure that both sides of ravioli are well-coated with Panko crumbs. Spray lightly with nonstick cooking spray and place into preheated oven.
Bake until Panko coating turns a light, golden brown, about 10-12 minutes.
Serve with marinara sauce.","{'calories': '166 kcal', 'carbohydrateContent': '22 g', 'proteinContent': '8 g', 'fatContent': '5 g', 'saturatedFatContent': '2 g', 'cholesterolContent': '19 mg', 'sodiumContent': '598 mg', 'fiberContent': '2 g', 'sugarContent': '3 g', 'unsaturatedFatContent': '0.6 g', 'servingSize': '1 serving'}",American,8 servings,https://addapinch.com/wp-content/uploads/2016/03/fried-ravioli-DSC_0611.jpg,5.0,Lighter Fried Ravioli with this simple recipe allows you to enjoy this favorite appetizer without all the guilt!,Complete
Appetizer,Beef Enchilada Dip Recipe,13,"1 1/2 - 2 pounds ground beef, 1/2 onion (diced), 2 cloves garlic (minced), 2 cups enchilada sauce, 2 cups grated monterey jack cheese ( or cheddar cheese), Sour Cream (optional), tortilla chips (optional)","IngredientGroup(ingredients=['1 1/2 - 2 pounds ground beef', '1/2 onion (diced)', '2 cloves garlic (minced)', '2 cups enchilada sauce', '2 cups grated monterey jack cheese ( or cheddar cheese)', 'Sour Cream (optional)', 'tortilla chips (optional)'], purpose=None)","Brown ground beef in a large skillet. Drain. Add in onion and garlic and cook until tender, about 3 minutes. Stir in enchilada sauce and top with grated cheese. Cover and allow cheese to melt, about 3 more minutes.
Top with sour cream and serve with tortilla chips.","{'calories': '362 kcal', 'carbohydrateContent': '2 g', 'proteinContent': '30 g', 'fatContent': '25 g', 'saturatedFatContent': '11 g', 'cholesterolContent': '101 mg', 'sodiumContent': '325 mg', 'fiberContent': '1 g', 'sugarContent': '1 g', 'unsaturatedFatContent': '10 g', 'servingSize': '1 serving'}",Mexican,8 servings,https://addapinch.com/wp-content/uploads/2013/10/beef-enchilada-dip-DSC_6244.jpg,4.84,"Beef Enchilada Dip makes a perfect warm, meaty, cheesy and delicious dip. If you love enchiladas, then this dip is definitely for you! Get this simple beef enchilada dip for your next event.",Complete
Main Course,Chicken Strips Recipe,40,"3 - 4 boneless skinless chicken breasts, 2 cups buttermilk, 1/2 teaspoon Sriracha sauce ( or cayenne pepper), 2 cups all-purpose flour, 1/2 teaspoon dried thyme, 1/4 teaspoon cayenne pepper, 1 teaspoon seasoned salt, 1/2 teaspoon ground black pepper, 1/2 cup canola oil","IngredientGroup(ingredients=['3 - 4 boneless skinless chicken breasts', '2 cups buttermilk', '1/2 teaspoon Sriracha sauce ( or cayenne pepper)', '2 cups all-purpose flour', '1/2 teaspoon dried thyme', '1/4 teaspoon cayenne pepper', '1 teaspoon seasoned salt', '1/2 teaspoon ground black pepper', '1/2 cup canola oil'], purpose=None)","Preheat oven to 375º F.
Butterfly chicken breasts by cutting in half horizontally, holding sharp knife parallel to the cutting board. Then, cut halves into strips, making about 6 - 8 strips per chicken breast.
Pour buttermilk into a shallow dish to be used for the wet portion of dredging chicken. Add Sriracha sauce and whisk together to combine with a fork.
Add flour, thyme, cayenne pepper, seasoned salt, and black pepper to another shallow dish to be used for the dry portion of dredging. Whisk together with a clean fork.
Dip chicken strips into buttermilk mixture and then into the flour mixture, making sure each chicken strip is well-coated. Place onto a kitchen sheet pan to rest while preparing for cooking.
Pour canola oil into 10- or 12-inch skillet over medium heat. Allow to heat until the oil begins to shimmer slightly and when water is dropped into the skillet, it sizzles.
Place chicken strips, about 3 to 5 depending on the size of the skillet, into the skillet with heated oil and cook until chicken strips are browned on one side, about 3 minutes, and then turn to cook on the other side. Cook for about 3 more minutes on the other side. Remove chicken and place onto a clean kitchen sheet pan until all chicken strips have been browned.
Place kitchen sheet pan into the preheated oven and cook for about 12-18 minutes until the juices of the chicken run clear when pricked with a sharp knife. Allow to rest for about 3 minutes before serving.","{'calories': '488 kcal', 'carbohydrateContent': '54 g', 'proteinContent': '39 g', 'fatContent': '12 g', 'saturatedFatContent': '4 g', 'transFatContent': '1 g', 'cholesterolContent': '81 mg', 'sodiumContent': '788 mg', 'fiberContent': '2 g', 'sugarContent': '6 g', 'unsaturatedFatContent': '238 g', 'servingSize': '1 serving'}",American,4 servings,https://addapinch.com/wp-content/uploads/2013/09/chicken-strips-recipe-DSC_6037-1.jpg,5.0,"Chicken Strips make a delicious addition for lunch, supper or even as an appetizer when entertaining. Get this easy Chicken Strips Recipe that you are sure to love.",Complete
"Appetizer,Main Course",Cheesy Garlic Pizza Sticks Recipe,30,"1 pizza dough recipe, 1 bulb roasted garlic, 4 tablespoons butter (softened), 1/2 cup pizza sauce recipe, 2 cups grated Mozzarella cheese, 1 cup grated monterey jack cheese, 1 cup grated cheddar cheese","IngredientGroup(ingredients=['1 pizza dough recipe', '1 bulb roasted garlic', '4 tablespoons butter (softened)', '1/2 cup pizza sauce recipe', '2 cups grated Mozzarella cheese', '1 cup grated monterey jack cheese', '1 cup grated cheddar cheese'], purpose=None)","Preheat oven to 475º F. Sprinkle cornmeal onto a rimmed baking sheet pan.
Spread pizza dough onto baking sheet pan, forming a large rectangle. Remove roasted garlic from bulb and add to a medium bowl with softened butter. Cream together to make a garlic butter spread to spread over the pizza dough.
Spread pizza sauce on top of garlic butter mixture. Top with grated cheeses and bake in the oven until crust has turned slightly golden around edges and the cheese has melted and become bubbly, about 15 minutes. Remove from oven and allow to rest for about 5 minutes.
Slice into 2-inch rectangular ""sticks"" and serve.","{'calories': '373 kcal', 'carbohydrateContent': '32 g', 'proteinContent': '14 g', 'fatContent': '27 g', 'saturatedFatContent': '11 g', 'transFatContent': '0.2 g', 'cholesterolContent': '49 mg', 'sodiumContent': '601 mg', 'fiberContent': '1 g', 'sugarContent': '3 g', 'unsaturatedFatContent': '10 g', 'servingSize': '1 serving'}",Italian,12 servings,https://addapinch.com/wp-content/uploads/2013/09/pizza-sticks-DSC_5626-2.jpg,5.0,Cheesy Garlic Pizza Sticks make a great addition to any fun menu - from game day to Halloween to a fun idea for dinner. Get this delicious Cheesy Garlic Pizza Sticks Recipe!,Complete
Main Course,Shredded Beef Nachos Recipe,25,"1 tablespoon olive oil, 2 cups shredded beef, 1/2 medium onion (diced), 1 clove garlic (diced), 2 cups black beans (or black eyed peas or 1 (15-ounce) can black beans with juices), 8 ounces tortilla chips, 2 cups grated cheddar cheese, 1 cup pepper jack cheese, 1 (4.5 - ounce) can green chiles, Pico de Gallo, 1 tablespoon cilantro, Sour Cream, Guacamole","IngredientGroup(ingredients=['1 tablespoon olive oil', '2 cups shredded beef', '1/2 medium onion (diced)', '1 clove garlic (diced)', '2 cups black beans (or black eyed peas or 1 (15-ounce) can black beans with juices)', '8 ounces tortilla chips', '2 cups grated cheddar cheese', '1 cup pepper jack cheese', '1 (4.5 - ounce) can green chiles', 'Pico de Gallo', '1 tablespoon cilantro', 'Sour Cream', 'Guacamole'], purpose=None)","Preheat oven to 350º F.
Drizzle olive oil into a 12 or 15-inch skillet over medium heat. Add shredded beef, onion and garlic. Cook until onion begins to become translucent. Remove from heat and spoon half of beef mixture into a medium bowl.
Add the following in loose layers, making sure that bites of all ingredients can be made by lifting a chip and scooping: tortilla chips, shredded beef, beans, cheeses, pico de gallo. Repeat layers until skillet is full and mounded, reserving about 1/2 of the pico de gallo for serving alongside nachos.
Place in oven and bake until cheese is fully melted. Remove from oven and serve warm with sour cream, guacamole, and additional pico de gallo.","{'calories': '415 kcal', 'carbohydrateContent': '27 g', 'proteinContent': '21 g', 'fatContent': '25 g', 'saturatedFatContent': '11 g', 'transFatContent': '1 g', 'cholesterolContent': '62 mg', 'sodiumContent': '688 mg', 'fiberContent': '5 g', 'sugarContent': '1 g', 'unsaturatedFatContent': '11 g', 'servingSize': '1 serving'}",American,8 servings,https://addapinch.com/wp-content/uploads/2013/09/shredded-beef-nachos-DSC_5968-2.jpg,5.0,"Shredded Beef Nachos make the perfect, hearty game day meal or served for when entertaining. Shredded Beef Nachos also make a great quick supper for busy weeknights for a crowd.",Complete
Appetizer,Cheddar and Bacon Puffs Recipe,38,"1 cup milk (or water), 1/2 cup unsalted butter (cut into pieces), 1/2 teaspoon kosher salt, 1 cup all purpose flour, 4 large eggs (room temperature), 1 cup packed coarsely grated Cheddar cheese, 4 slices cooked bacon (coarsely chopped), 1/4 teaspoon ground black pepper, pinch cayenne pepper","IngredientGroup(ingredients=['1 cup milk (or water)', '1/2 cup unsalted butter (cut into pieces)', '1/2 teaspoon kosher salt', '1 cup all purpose flour', '4 large eggs (room temperature)', '1 cup packed coarsely grated Cheddar cheese', '4 slices cooked bacon (coarsely chopped)', '1/4 teaspoon ground black pepper', 'pinch cayenne pepper'], purpose=None)","Preheat oven to 425º F. Line baking sheet pans with parchment paper or silicon baking mats.
Bring milk (or water), butter, and salt to a rolling boil in a medium, heavy- bottomed saucepan over medium-high heat. Stirring vigorously, add in all of the flour, and cook until the dough begins to pull away from the edges of the saucepan. Remove dough from heat and transfer to the bowl of a stand mixer and allow to cool for approximately two to three minutes. Alternately, you can leave in the saucepan and use a hand mixer, if desired. Add in eggs, one at a time, beating in completely after each addition. Stir in cheese, bacon pieces, black pepper, and red pepper, making sure all ingredients are well-combined.
Scoop tablespoon pieces onto baking sheet. Using a damp finger or back of a spoon, press down any pieces of dough that are sticking up to prevent them from overbrowning. Bake 25-30 minutes, until puffs have turned a golden brown. Remove from the oven and allow to cool slightly.
Serve immediately or allow to cool completely, place in airtight container or zip top freezer bags and freeze up to three months.","{'servingSize': '36 g', 'calories': '54 kcal', 'carbohydrateContent': '3 g', 'proteinContent': '2 g', 'fatContent': '4 g', 'saturatedFatContent': '2 g', 'transFatContent': '0.1 g', 'cholesterolContent': '26 mg', 'sodiumContent': '77 mg', 'fiberContent': '0.1 g', 'sugarContent': '0.04 g', 'unsaturatedFatContent': '1.3 g'}",American,36 servings,https://addapinch.com/wp-content/uploads/2013/08/Cheddar-and-Bacon-Puffs-Text-DSC_4996-3.jpg,4.83,"Cheddar and Bacon Cheese Puffs make a delicious, quick, and easy appetizer or snack. This a great make-ahead and freezer-friendly appetizer recipe for light, buttery, and delicious cheese puffs.",Complete
Appetizer,Sun Dried Tomato Hummus Recipe,5,"1/4 cup lemon juice, 1/4 cup tahini, 2 tablespoons olive oil, 1/4 cup sundried tomatoes, 1 clove garlic (minced), 1/2 teaspoon ground cumin, 1/2 teaspoon Kosher salt, 1 15-ounce can chickpeas (, drained and rinsed)","IngredientGroup(ingredients=['1/4 cup lemon juice', '1/4 cup tahini', '2 tablespoons olive oil', '1/4 cup sundried tomatoes', '1 clove garlic (minced)', '1/2 teaspoon ground cumin', '1/2 teaspoon Kosher salt', '1 15-ounce can chickpeas (, drained and rinsed)'], purpose=None)","Add lemon juice, tahini and olive oil to the container of a blender or food processor. Blend until smooth, about 40 seconds. Scrape down sides and add sundried tomatoes, garlic, cumin, salt, and 3/4 of the can of chickpeas. Blend until smooth, about 1 minute. Scrape down sides and blend again for another minute until even smoother. Add remaining chickpeas and blend for about 20 seconds or until the hummus has reached the creaminess you desire.
Pour into a serving bowl and drizzle with additional olive oil and top with more sundried tomatoes.
Keep in an airtight container for up to one week in the refrigerator.","{'servingSize': '2 tablespoons', 'calories': '52 kcal', 'carbohydrateContent': '5 g', 'proteinContent': '1 g', 'fatContent': '3 g', 'saturatedFatContent': '1 g', 'sodiumContent': '126 mg', 'fiberContent': '2 g', 'sugarContent': '1 g', 'unsaturatedFatContent': '3 g'}",Mediterranean,20 servings,https://addapinch.com/wp-content/uploads/2013/08/sundried-tomato-hummus-DSC_5360-3.jpg,4.86,"Sun Dried Tomato Hummus makes a wonderful addition to any get together or as a sandwich spread or snack. Get this simple, family favorite hummus recipe.",Complete
Main Course,Pulled Pork Stuffed Poblano Peppers Recipe,25,"1 pork roast recipe, 1 Coca Cola BBQ Sauce recipe, 1/2 red onion (diced), 1 clove garlic (minced), 6 poblano peppers (halved and deseeded), 1 (8-ounce) package grated cheddar cheese","IngredientGroup(ingredients=['1 pork roast recipe', '1 Coca Cola BBQ Sauce recipe', '1/2 red onion (diced)', '1 clove garlic (minced)', '6 poblano peppers (halved and deseeded)', '1 (8-ounce) package grated cheddar cheese'], purpose=None)","Preheat oven to 450º F.
Mix together pulled pork from pork roast with about 1 cup of bbq sauce until well-coated. Add onion and garlic and mix well. Using tongs, stuff pulled pork mixture into each half of poblano pepper and place into a skillet. Cover with aluminum foil.
Place in preheated oven and bake for 10 minutes or until heated through and the pepper begins to soften slightly. Remove foil and top with grated cheese. Return foil cover and bake an addition 5 minutes, or until cheese has completely melted.
Serve with additional BBQ sauce on the side.","{'calories': '350 kcal', 'carbohydrateContent': '34 g', 'proteinContent': '30 g', 'fatContent': '24 g', 'saturatedFatContent': '1 g', 'cholesterolContent': '231 mg', 'sodiumContent': '227 mg', 'fiberContent': '4 g', 'sugarContent': '11 g', 'unsaturatedFatContent': '2 g', 'servingSize': '1 serving'}",American,6 servings,https://addapinch.com/wp-content/uploads/2013/08/pulled-pork-stuffed-poblano-peppers-DSC_5150-3.jpg,5.0,"Pulled Pork Stuffed Poblano Peppers make a hearty, spicy and delicious dish. Get this simple pulled pork stuffed peppers recipe for your next get together.",Complete
