Category,Title,Total Time,All Ingredients,Ingredient Groups,Instructions,Nutrition,Cuisine,Yields,Image,Ratings,Description,Status
Salad,Mimi's Mexican Cornbread Salad Recipe,10,"1/2 pan Southern Buttermilk Cornbread Recipe (baked and cooled), 1/2 head iceberg lettuce (chopped), 1 (26.5-ounce) can black beans (drained and rinsed well), 3 (10-ounce) cans diced tomatoes with green chiles (, drained well), 6-8 slices cooked bacon (diced), 1 1/2 cups grated Cheddar cheese, 2 avocados (diced), 2 tablespoons lime juice (divided), Sour cream (optional)","IngredientGroup(ingredients=['1/2 pan Southern Buttermilk Cornbread Recipe (baked and cooled)', '1/2 head iceberg lettuce (chopped)', '1 (26.5-ounce) can black beans (drained and rinsed well)', '3 (10-ounce) cans diced tomatoes with green chiles (, drained well)', '6-8 slices cooked bacon (diced)', '1 1/2 cups grated Cheddar cheese', '2 avocados (diced)', '2 tablespoons lime juice (divided)', 'Sour cream (optional)'], purpose=None)","Crumble and layer half of the cornbread in the bottom of a large glass bowl or trifle dish. Next, add half of each in layers: lettuce, black beans, diced tomatoes, bacon, cheese, and avocados. Sprinkle 1 tablespoon of lime juice on top of avocados to prevent from browning. Repeat layers and top final salad with remaining tablespoon of lime juice. Top or serve with sour cream, if desired.","{'calories': '372 kcal', 'carbohydrateContent': '28 g', 'proteinContent': '13 g', 'fatContent': '23 g', 'saturatedFatContent': '8 g', 'transFatContent': '1 g', 'cholesterolContent': '60 mg', 'sodiumContent': '297 mg', 'fiberContent': '6 g', 'sugarContent': '3 g', 'unsaturatedFatContent': '12 g', 'servingSize': '1 serving'}",American,8 servings,https://addapinch.com/wp-content/uploads/2015/08/Mexican-Cornbread-Salad-Recipe_DSC2256-400x600.jpg,5.0,"Mexican Cornbread Salad makes a delicious layered salad recipe using buttermilk cornbread, beans, tomatoes, and so much more!",Complete
Salad,Pesto Chicken Salad Recipe,40,"4 - 6 bone-in chicken breasts, olive oil, salt and pepper, 1/2 pint cherry or grape tomatoes (slice in half), 1/2 cup pesto","IngredientGroup(ingredients=['4 - 6 bone-in chicken breasts', 'olive oil', 'salt and pepper', '1/2 pint cherry or grape tomatoes (slice in half)', '1/2 cup pesto'], purpose=None)","Preheat oven to 350º. Arrange chicken breasts on rimmed baking sheet. Drizzle with olive oil and sprinkle with salt and pepper. Place into oven and roast until juices run clear when pricked with a sharp knife and an instant read thermometer registers 160º F when inserted into the thickest part of the chicken, about 35 to 40 minutes. Remove chicken from the oven and allow to cool enough to handle.
Once chicken has cooled, pull chicken off the bone, discarding the skin and the bone of the chicken. Place chicken into a medium to large bowl. Add tomatoes and pesto. Stir until well combined.
Serve warm or cold. Store in an airtight container in the refrigerator if serving later.","{'calories': '329 kcal', 'carbohydrateContent': '5 g', 'proteinContent': '39 g', 'fatContent': '16 g', 'saturatedFatContent': '3 g', 'transFatContent': '1 g', 'cholesterolContent': '104 mg', 'sodiumContent': '385 mg', 'fiberContent': '1 g', 'sugarContent': '2 g', 'unsaturatedFatContent': '3 g', 'servingSize': '1 serving'}",American,4 servings,https://addapinch.com/wp-content/uploads/2015/07/pesto-chicken-salad-recipe-_DSC1971-2.jpg,5.0,Pesto Chicken Salad makes a quick and easy recipe perfect for lunch or supper!,Complete
Salad,Watermelon Salad Recipe,10,"1 small watermelon (cut into 2-inch thick slices about 6-inches round), 4 cups fresh arugula (spinach or spring mix salad greens), 1/4 cup blue cheese crumbles, 2 tablespoons roasted sunflower seeds, raspberry vinaigrette, salt and pepper (to taste)","IngredientGroup(ingredients=['1 small watermelon (cut into 2-inch thick slices about 6-inches round)', '4 cups fresh arugula (spinach or spring mix salad greens)', '1/4 cup blue cheese crumbles', '2 tablespoons roasted sunflower seeds', 'raspberry vinaigrette', 'salt and pepper (to taste)'], purpose=None)","Arrange watermelon slices on plates. For each watermelon salad: pile about 1/2 cup fresh arugula, spinach or greens on top of watermelon slice. Sprinkle on about 1 tablespoon blue cheese crumbles and 1/2 tablespoon roasted sunflower seeds. Then drizzle with raspberry vinaigrette and salt and pepper to taste. Serve cold.","{'calories': '234 kcal', 'carbohydrateContent': '47 g', 'proteinContent': '6 g', 'fatContent': '5 g', 'saturatedFatContent': '2 g', 'transFatContent': '1 g', 'cholesterolContent': '6 mg', 'sodiumContent': '165 mg', 'fiberContent': '2 g', 'sugarContent': '34 g', 'unsaturatedFatContent': '3 g', 'servingSize': '1 serving'}",American,4 servings,https://addapinch.com/wp-content/uploads/2015/06/watermelon-salad-recipe-c-DSC_1849-2.jpg,5.0,"This watermelon salad is a welcome addition to your summer meals! Ready in minutes, it makes a warm weather favorite!",Complete
Salad,Arugula Greek Salad Recipe,10,"6 cups arugula, 2 cucumber (peeled and diced), 1 pint cherry tomatoes (halved), 1 cup sliced Kalamata olives, 1/2 red onion (diced), 1 bell pepper (seeded and diced), 1 (8-ounce) container Feta cheese (, crumbled), ¼ cup olive oil, ¼ cup red wine vinegar, ½ teaspoon garlic powder, ½ teaspoon dried basil, ½ teaspoon dried oregano, ½ teaspoon onion powder, 1 teaspoon Dijon mustard, salt and pepper","IngredientGroup(ingredients=['6 cups arugula', '2 cucumber (peeled and diced)', '1 pint cherry tomatoes (halved)', '1 cup sliced Kalamata olives', '1/2 red onion (diced)', '1 bell pepper (seeded and diced)', '1 (8-ounce) container Feta cheese (, crumbled)'], purpose=None), IngredientGroup(ingredients=['¼ cup olive oil', '¼ cup red wine vinegar', '½ teaspoon garlic powder', '½ teaspoon dried basil', '½ teaspoon dried oregano', '½ teaspoon onion powder', '1 teaspoon Dijon mustard', 'salt and pepper'], purpose='For the dressing:')","Assemble arugula, cucumbers, tomatoes, olives, onion, pepper and half of Feta cheese in a large bowl.
To make the dressing, simple add all dressing ingredients to a Mason jar, fit with the lid and shake vigorously until well-combined.
Pour about half of dressing over salad and toss. Then, top with remaining Feta cheese and serve with additional dressing on the side.","{'calories': '114 kcal', 'carbohydrateContent': '11 g', 'proteinContent': '2 g', 'fatContent': '8 g', 'saturatedFatContent': '1 g', 'cholesterolContent': '1 mg', 'sodiumContent': '374 mg', 'fiberContent': '3 g', 'sugarContent': '5 g', 'unsaturatedFatContent': '7 g', 'servingSize': '1 serving'}",Mediterranean,6 servings,https://addapinch.com/wp-content/uploads/2015/05/arugula-greek-salad-recipe-DSC_1451-2.jpg,5.0,Arugula Greek Salad - A quick and easy solution to what's for lunch or supper! So flavorful and easy to make ahead for even easier meals!,Complete
Salad,Beet Salad Recipe,10,"3 cups spring salad greens mix, 1/2 cup beet greens, 3-5 asparagus spears, 1 raw beet (peeled and sliced into thin slices), Citrus Vinaigrette","IngredientGroup(ingredients=['3 cups spring salad greens mix', '1/2 cup beet greens', '3-5 asparagus spears', '1 raw beet (peeled and sliced into thin slices)', 'Citrus Vinaigrette'], purpose=None)","Wash spring salad greens and beet greens and dry in a salad spinner or with paper towels. Arrange on one serving platter or on individual plates for serving. Add asparagus spears and beet slices to the salad as you are serving.
Spoon on citrus vinaigrette as serving.","{'calories': '64 kcal', 'carbohydrateContent': '12 g', 'proteinContent': '5 g', 'fatContent': '1 g', 'saturatedFatContent': '1 g', 'sodiumContent': '137 mg', 'fiberContent': '5 g', 'sugarContent': '2 g', 'unsaturatedFatContent': '2 g', 'servingSize': '1 serving'}",American,4 servings,https://addapinch.com/wp-content/uploads/2015/04/beet-salad-recipe-DSC_1534-1.jpg,5.0,"This beet salad makes a delicious and beautiful starter, side dish, or even a main salad recipe! Colorful and full of flavor, this beet salad is sure to become a favorite!",Complete
Dressing,Citrus Vinaigrette Recipe,10,"1/4 cup champagne vinegar, 3/4 cup olive oil, 3 tablespoons lemon juice, 3 tablespoons fresh orange juice, 1 tablespoon honey (optional), 1/2 teaspoon Stone House Seasoning (or 1/4 teaspoon each salt and pepper and 1/8 teaspoon granulated garlic)","IngredientGroup(ingredients=['1/4 cup champagne vinegar', '3/4 cup olive oil', '3 tablespoons lemon juice', '3 tablespoons fresh orange juice', '1 tablespoon honey (optional)', '1/2 teaspoon Stone House Seasoning (or 1/4 teaspoon each salt and pepper and 1/8 teaspoon granulated garlic)'], purpose=None)","Whisk together all ingredients until well-combined and emulsified. Alternately, you may add all ingredients to a jar with a tight-fitting lid and shake vigorously until emulsified.","{'calories': '193 kcal', 'carbohydrateContent': '3 g', 'proteinContent': '1 g', 'fatContent': '20 g', 'saturatedFatContent': '3 g', 'sodiumContent': '147 mg', 'fiberContent': '1 g', 'sugarContent': '3 g', 'unsaturatedFatContent': '17 g', 'servingSize': '1 serving'}",American,8 servings,https://addapinch.com/wp-content/uploads/2015/04/citrus-vinaigrette-recipe-text-2-DSC_1540-2.jpg,4.91,This citrus vinaigrette recipe makes a quick and easy homemade dressing that is delicious with so many dishes!,Complete
Salad,Carrot Salad Recipe,5,"4 cups shredded carrots, 1 cup raisins, 1/2 cup finely diced pineapple, 1/4 cup mayonnaise (or Greek yogurt)","IngredientGroup(ingredients=['4 cups shredded carrots', '1 cup raisins', '1/2 cup finely diced pineapple', '1/4 cup mayonnaise (or Greek yogurt)'], purpose=None)",Stir together all ingredients until well combined. Serve immediately or store in an airtight container in the refrigerator for up to 3 days.,"{'servingSize': '1 cup', 'calories': '129 kcal', 'carbohydrateContent': '20 g', 'proteinContent': '1 g', 'fatContent': '5 g', 'cholesterolContent': '2 mg', 'sodiumContent': '93 mg', 'fiberContent': '3 g', 'sugarContent': '3 g'}",American,8 servings,https://addapinch.com/wp-content/uploads/2015/04/carrot-salad-recipe-DSC_3129.jpg,5.0,"Classic Carrot salad made of grated carrots, raisins, and pineapple makes a delicious side dish. So simple to prepare, carrot salad will become one of your quick-fix favorites!",Complete
Salad,Buffalo Chicken Salad Recipe,20,"2 boneless skinless chicken breasts (sliced into ½-inch strips or 12 chicken tenderloins), 4 tablespoons melted butter, 4 tablespoons hot sauce, 1 1/2 teaspoons vinegar, 2 dashes Worcestershire sauce, 1 tablespoon olive oil, 4 cups mixed salad greens, blue cheese crumbles, blue cheese ( or ranch dressing)","IngredientGroup(ingredients=['2 boneless skinless chicken breasts (sliced into ½-inch strips or 12 chicken tenderloins)', '4 tablespoons melted butter', '4 tablespoons hot sauce', '1 1/2 teaspoons vinegar', '2 dashes Worcestershire sauce', '1 tablespoon olive oil', '4 cups mixed salad greens', 'blue cheese crumbles', 'blue cheese ( or ranch dressing)'], purpose=None)","Place chicken tenders in a zip top bag. In a separate bowl, mix together melted butter, hot sauce, vinegar, Worcestershire sauce until well-combined. Pour half of mixture over chicken tenders, close bag and make sure the sauce coats each piece of chicken well. Place in refrigerator for at least 1 hour up to overnight. Refrigerate remaining buffalo sauce in an airtight container.
When ready to cook, heat olive oil in large skillet over medium heat. Remove chicken tenders from zip top bag and place into skillet. Cook for about 5-7 minutes per side, until cooked through.
While chicken is finishing cooking, pour remaining buffalo sauce over chicken tenders while in the skillet. Turn chicken tenders in buffalo sauce until well-coated.
Remove chicken from skillet and serve on a large salad with your favorite salad toppings and dressing.","{'calories': '204 kcal', 'carbohydrateContent': '2 g', 'proteinContent': '13 g', 'fatContent': '16 g', 'saturatedFatContent': '8 g', 'transFatContent': '1 g', 'cholesterolContent': '66 mg', 'sodiumContent': '524 mg', 'fiberContent': '1 g', 'sugarContent': '1 g', 'unsaturatedFatContent': '7 g', 'servingSize': '1 serving'}",American,4 servings,https://addapinch.com/wp-content/uploads/2015/01/buffalo-chicken-salad-recipe-DSC_06754.jpg,5.0,"Buffalo Chicken Salad makes a delicious, flavorful salad that has all the flavor of buffalo wings and the freshness of a salad! Ready in 20 minutes!",Complete
Main Course,Salmon Salad Recipe,20,"1 recipe Baked Salmon, 4 cups spinach, 4 cups salad greens, 4 tangerines (peeled and sectioned or 2 cups jarred mandarin oranges), 1/2 red onion (thinly slices (optional)), 1 cup berries (optional), Vinaigrette Dressing (for serving)","IngredientGroup(ingredients=['1 recipe Baked Salmon', '4 cups spinach', '4 cups salad greens', '4 tangerines (peeled and sectioned or 2 cups jarred mandarin oranges)', '1/2 red onion (thinly slices (optional))', '1 cup berries (optional)', 'Vinaigrette Dressing (for serving)'], purpose=None)","Prepare baked salmon according to recipe instructions.
As the salmon is baking, assemble salad of baby spinach, salad greens, citrus fruit of tangerines or mandarin oranges. If using, add slices of red onion and/ or fresh berries.
Place salmon filet on top of salad or break into large chunks and arrange on salad.
Serve with dressing on the side.","{'calories': '147 kcal', 'carbohydrateContent': '20 g', 'proteinContent': '10 g', 'fatContent': '3 g', 'saturatedFatContent': '0.1 g', 'cholesterolContent': '23 mg', 'sodiumContent': '201 mg', 'fiberContent': '4 g', 'sugarContent': '13 g', 'unsaturatedFatContent': '0.3 g', 'servingSize': '1 serving'}",American,4 servings,https://addapinch.com/wp-content/uploads/2015/01/salmon-salad-DSC_0396-1.jpg,5.0,"Salmon Salad makes a delicious salad I turn to time and again. Ready in 15 minutes, it is perfect for a busy weeknight meal or for easy entertaining.",Complete
Salad,Chicken Salad with Pickles Recipe,5,"1 pound boiled chicken (cut into bite-sized pieces), 1 cup mayonnaise, 1/2 cup dill pickles (chopped), 1/4 red onion (diced)","IngredientGroup(ingredients=['1 pound boiled chicken (cut into bite-sized pieces)', '1 cup mayonnaise', '1/2 cup dill pickles (chopped)', '1/4 red onion (diced)'], purpose=None)","Stir together chicken, mayonnaise, pickles and onions. Store in an airtight container in the refrigerator or serve immediately.","{'calories': '185 kcal', 'carbohydrateContent': '2 g', 'proteinContent': '18 g', 'fatContent': '12 g', 'saturatedFatContent': '3 g', 'transFatContent': '1 g', 'cholesterolContent': '58 mg', 'sodiumContent': '169 mg', 'fiberContent': '1 g', 'sugarContent': '1 g', 'unsaturatedFatContent': '7 g', 'servingSize': '1 serving'}",American,6 servings,https://addapinch.com/wp-content/uploads/2014/10/chicken-salad-with-pickles-recipe-DSC_5393-1.jpg,5.0,Chicken Salad with Pickles makes a delicious meal throughout the year. Perfect for a light lunch or supper and for entertaining.,Complete
"Salad,Side Dish",Waldorf Salad,10,"2 red apples (Honey Crisp, Red Delicious, unpeeled and chopped into bite-sized pieces), 2 celery (sliced), 1 cup red seedless grapes (halved), 1/2 cup walnuts halves, 4 tablespoons mayonnaise, large lettuce leaves","IngredientGroup(ingredients=['2 red apples (Honey Crisp, Red Delicious, unpeeled and chopped into bite-sized pieces)', '2 celery (sliced)', '1 cup red seedless grapes (halved)', '1/2 cup walnuts halves', '4 tablespoons mayonnaise', 'large lettuce leaves'], purpose=None)","Add apples, celery, grapes, and walnuts to medium size bowl. Stir in mayonnaise.
When ready to serve, place large lettuce leaves onto a salad plate or bowl. Top with apple mixture and serve cool.","{'calories': '267 kcal', 'carbohydrateContent': '22 g', 'proteinContent': '3 g', 'fatContent': '20 g', 'saturatedFatContent': '2 g', 'cholesterolContent': '5 mg', 'sodiumContent': '106 mg', 'fiberContent': '3 g', 'sugarContent': '16 g', 'servingSize': '1 serving'}",American,4 servings,https://addapinch.com/wp-content/uploads/2014/06/waldorf-salad-recipe-DSC_4175-1.jpg,5.0,"The classic Waldorf Salad makes a delicious salad recipe. Including apples, celery, nuts, and grapes, this salad is always refreshing.",Complete
Side Dish,Pesto Pasta Salad Recipe,20,"1 16-ounce package bowtie pasta, 1 pint grape tomatoes (halved), 1/2 red onion (diced), 1 Feta cheese, 1/4 cup sunflower seeds, 4 cups fresh basil, 2-3 cloves garlic, 1/4 cup sunflower seeds, 1/2 teaspoon kosher salt, 3/4 cup olive oil, 3/4 cup Parmesan cheese","IngredientGroup(ingredients=['1 16-ounce package bowtie pasta', '1 pint grape tomatoes (halved)', '1/2 red onion (diced)', '1 Feta cheese', '1/4 cup sunflower seeds'], purpose=None), IngredientGroup(ingredients=['4 cups fresh basil', '2-3 cloves garlic', '1/4 cup sunflower seeds', '1/2 teaspoon kosher salt', '3/4 cup olive oil', '3/4 cup Parmesan cheese'], purpose='For the Pesto:')","Bring pasta to boil in large stockpot over medium heat. Cook according to package instructions. Remove from heat and pour through a strainer when cooked. Pour into a large mixing bowl. Add grape tomatoes, onion, feta cheese and sunflower seeds. Make pesto by adding all ingredients to a food processor or blender until smooth. Pour over pasta and stir until well-combined. Serve warm or store in an airtight container and store in the refrigerator. Bring to room temperature to serve.","{'calories': '377 kcal', 'carbohydrateContent': '7 g', 'proteinContent': '8 g', 'fatContent': '36 g', 'saturatedFatContent': '6 g', 'cholesterolContent': '9 mg', 'sodiumContent': '403 mg', 'fiberContent': '2 g', 'sugarContent': '3 g', 'unsaturatedFatContent': '29 g', 'servingSize': '1 serving'}",American,6 servings,https://addapinch.com/wp-content/uploads/2014/06/pesto-pasta-salad-recipe-DSC_4098-2.jpg,5.0,"Pesto Pasta Salad makes a delicious recipe perfect for serving warm or cold! Made with pasta, fresh pesto, tomatoes, onions, and cheese, pesto pasta salad is always a favorite.",Complete
Dressing,Buttermilk Ranch Dressing Recipe,5,"1/4 cup buttermilk, 1 cups mayonnaise, 1/2 cup sour cream, 1 teaspoon lemon juice, 1 teaspoon Worcestershire sauce (or Coconut Aminos), 1 tablespoon apple cider vinegar, 1 tablespoon fresh parsley (minced or 2 teaspoons dried parsley), 1 tablespoon fresh dill (minced or 2 teaspoons dried dill ), 1 tablespoon onion (minced or 1 teaspoon onion powder), 1 clove garlic (minced or 1/2 teaspoon garlic powder), 1/8 teaspoon dry mustard, 1/8 teaspoon cayenne pepper, 1/2 teaspoon kosher salt, 1/2 teaspoon ground black pepper","IngredientGroup(ingredients=['1/4 cup buttermilk', '1 cups mayonnaise', '1/2 cup sour cream', '1 teaspoon lemon juice', '1 teaspoon Worcestershire sauce (or Coconut Aminos)', '1 tablespoon apple cider vinegar', '1 tablespoon fresh parsley (minced or 2 teaspoons dried parsley)', '1 tablespoon fresh dill (minced or 2 teaspoons dried dill )', '1 tablespoon onion (minced or 1 teaspoon onion powder)', '1 clove garlic (minced or 1/2 teaspoon garlic powder)', '1/8 teaspoon dry mustard', '1/8 teaspoon cayenne pepper', '1/2 teaspoon kosher salt', '1/2 teaspoon ground black pepper'], purpose=None)",Add all ingredients to a large bowl and whisk together until well combined. Store in an airtight container in the refrigerator.,"{'servingSize': '2 tablespoons', 'calories': '33 kcal', 'carbohydrateContent': '2 g', 'proteinContent': '2 g', 'fatContent': '2 g', 'saturatedFatContent': '1 g', 'transFatContent': '1 g', 'cholesterolContent': '6 mg', 'sodiumContent': '121 mg', 'fiberContent': '1 g', 'sugarContent': '1 g', 'unsaturatedFatContent': '2 g'}",American,12 servings,https://addapinch.com/wp-content/uploads/2014/05/buttermilk-ranch-dressing-recipe-DSC_4038-2.jpg,5.0,"Buttermilk Ranch Dressing is a classic dressing recipe. Made of buttermilk, sour cream, mayonnaise, herbs, and spices, this ranch dressing recipe is a must-have.",Complete
Salad,Chicken Salad Stuffed Tomatoes Recipe,10,"1 pound chicken breasts (cooked and cut into 1/2-inch pieces), 1 cup chopped celery, 4 green onions (chopped), 1 cup mayonnaise, 1/2 teaspoon celery salt, 1/2 cup sliced almonds, 8-10 medium tomatoes (cored)","IngredientGroup(ingredients=['1 pound chicken breasts (cooked and cut into 1/2-inch pieces)', '1 cup chopped celery', '4 green onions (chopped)', '1 cup mayonnaise', '1/2 teaspoon celery salt', '1/2 cup sliced almonds', '8-10 medium tomatoes (cored)'], purpose=None)","Stir together chicken, celery, onions, mayonnaise, celery salt and almonds. Scoop into cored tomatoes and serve cold.","{'calories': '190 kcal', 'carbohydrateContent': '10 g', 'proteinContent': '19 g', 'fatContent': '9 g', 'saturatedFatContent': '1 g', 'transFatContent': '1 g', 'cholesterolContent': '38 mg', 'sodiumContent': '237 mg', 'fiberContent': '4 g', 'sugarContent': '5 g', 'unsaturatedFatContent': '7 g', 'servingSize': '1 serving'}",American,8 servings,https://addapinch.com/wp-content/uploads/2014/05/tomato-stuffed-chicken-salad-recipe-DSC_3617-1.jpg,5.0,"Chicken Salad is always a favorite. This version of chicken salad stuffed into tomatoes is perfect served for a luncheon, shower, or a light supper with friends.",Complete
Dressing,Raspberry Vinaigrette Recipe,5,"½ cup olive oil, ½ cup apple cider vinegar, 1/2 cup raspberry sauce recipe, 1 teaspoon Dijon mustard, salt and pepper (to taste)","IngredientGroup(ingredients=['½ cup olive oil', '½ cup apple cider vinegar', '1/2 cup raspberry sauce recipe', '1 teaspoon Dijon mustard', 'salt and pepper (to taste)'], purpose=None)","Whisk all ingredients together in a small bowl until very well-combined, about 3-5 minutes.
Alternately, you can add all the ingredients to a Mason jar, screw on the lid, and shake vigorously until well-combined.","{'servingSize': '2 tablespoons', 'calories': '53 kcal', 'carbohydrateContent': '1 g', 'proteinContent': '0.05 g', 'fatContent': '5 g', 'saturatedFatContent': '1 g', 'sodiumContent': '3 mg', 'fiberContent': '0.2 g', 'sugarContent': '1 g', 'unsaturatedFatContent': '5 g'}",American,20 servings,https://addapinch.com/wp-content/uploads/2014/03/raspberry-vinaigrette-recipe-DSC_2632-1.jpg,5.0,"Raspberry Vinaigrette makes a delicious addition to so many dishes from chicken recipes, salad recipes, and drizzled on fruit. Get this simple raspberry vinaigrette salad dressing recipe.",Complete
Salad,Buffalo Shrimp Salad Recipe,15,"1 pound shrimp (peeled and deveined), 1 tablespoon olive oil, 1 tablespoon unsalted butter, 1 clove garlic (minced), 1/4 cup buffalo sauce, salad greens, 1/2 red onion (sliced), 1 cucumber (sliced), 1 medium tomato (sliced), blue cheese (optional)","IngredientGroup(ingredients=['1 pound shrimp (peeled and deveined)', '1 tablespoon olive oil', '1 tablespoon unsalted butter', '1 clove garlic (minced)', '1/4 cup buffalo sauce', 'salad greens', '1/2 red onion (sliced)', '1 cucumber (sliced)', '1 medium tomato (sliced)', 'blue cheese (optional)'], purpose=None)","Rinse shrimp and pat dry with a paper towel. Drizzle olive oil into medium skillet and add butter over medium-low heat. Once butter has melted, add in shrimp and garlic. Cook, stirring often, until the shrimp have turned pink, about 3-5 minutes. Add in buffalo sauce and cook another 1-2 minutes until thickened. Remove skillet from heat and set aside.
Place salad greens on each plate, topped with onion, cucumber, and tomatoes. Spoon on shrimp, being sure to spoon on additional sauce onto the salad. Top with blue cheese and serve.","{'calories': '221 kcal', 'carbohydrateContent': '6 g', 'proteinContent': '17 g', 'fatContent': '14 g', 'saturatedFatContent': '2 g', 'transFatContent': '1 g', 'cholesterolContent': '165 mg', 'sodiumContent': '902 mg', 'fiberContent': '1 g', 'sugarContent': '2 g', 'unsaturatedFatContent': '4 g', 'servingSize': '1 serving'}",American,4 servings,https://addapinch.com/wp-content/uploads/2014/01/buffalo-shrimp-salad-recipe-DSC_1711-2.jpg,5.0,"Shrimp salad makes a favorite, easy, and quick meal. This buffalo shrimp salad will quickly become a go-to, quick-fix recipe.",Complete
Main Course,Cobb Salad Lettuce Wraps Recipe,10,"Lettuce Leaves (Recommended Iceberg, Boston, or Romaine), 2 boiled eggs (quartered), 1 avocado (sliced), 1 medium tomato (sliced), 2 chicken breasts (cooked and sliced thinly), 1/4 medium red onion (diced), 4 slices bacon (cooked, Canadian or thick-sliced), blue cheese crumbles, red wine vinaigrette","IngredientGroup(ingredients=['Lettuce Leaves (Recommended Iceberg, Boston, or Romaine)', '2 boiled eggs (quartered)', '1 avocado (sliced)', '1 medium tomato (sliced)', '2 chicken breasts (cooked and sliced thinly)', '1/4 medium red onion (diced)', '4 slices bacon (cooked, Canadian or thick-sliced)', 'blue cheese crumbles', 'red wine vinaigrette'], purpose=None)","Wash lettuce leaves and blot dry with paper towels. Place lettuce leaves flat on a plate and layer with eggs, avocado, tomato, chicken slices, onion, and bacon. Top with blue cheese crumbles and drizzle with red wine vinaigrette.
Serve immediately.","{'calories': '567 kcal', 'carbohydrateContent': '13 g', 'proteinContent': '39 g', 'fatContent': '41 g', 'saturatedFatContent': '10 g', 'transFatContent': '0.1 g', 'cholesterolContent': '288 mg', 'sodiumContent': '495 mg', 'fiberContent': '8 g', 'sugarContent': '3 g', 'unsaturatedFatContent': '26 g', 'servingSize': '1 serving'}",American,2 servings,https://addapinch.com/wp-content/uploads/2014/01/cobb-salad-lettuce-wraps-DSC_1743-2.jpg,4.5,Lettuce wraps make a favorite quick-fix lunch or supper. These cobb salad lettuce wraps are sure to become a favorite.,Complete
