Category,Title,Total Time,All Ingredients,Ingredient Groups,Instructions,Nutrition,Cuisine,Yields,Image,Ratings,Description,Status
"Main Course,Soup",Chicken Taco Soup Recipe,30,"2 chicken breasts (boneless and skinless), 1 tablespoon taco seasoning, 1-1/2 cups chicken stock or broth, 1 (15-ounce) can black beans, drained, 1 (15-1/4 ounce) can whole kernel corn, drained, 1 (16-ounce) can mild chili beans, undrained, 1 (10-ounce) can diced tomatoes with green chiles, 1 (14 1/2-ounce) can stewed tomatoes, 2 1/2 tablespoons ranch seasoning mix, 1 (4-ounce) can green chiles, salt and pepper (when serving), tortilla chips, Sour cream, Green onions (chopped), Cheddar cheese (shredded)","IngredientGroup(ingredients=['2 chicken breasts (boneless and skinless)', '1 tablespoon taco seasoning', '1-1/2 cups chicken stock or broth', '1 (15-ounce) can black beans, drained', '1 (15-1/4 ounce) can whole kernel corn, drained', '1 (16-ounce) can mild chili beans, undrained', '1 (10-ounce) can diced tomatoes with green chiles', '1 (14 1/2-ounce) can stewed tomatoes', '2 1/2 tablespoons ranch seasoning mix', '1 (4-ounce) can green chiles', 'salt and pepper (when serving)'], purpose=None), IngredientGroup(ingredients=['tortilla chips', 'Sour cream', 'Green onions (chopped)', 'Cheddar cheese (shredded)'], purpose='Optional toppings:')","Stovetop Chicken Taco Soup Recipe
Add the chicken, taco seasoning, chicken stock, broth or water, black beans, corn, chili beans, tomatoes, ranch seasoning, and green chilis to a Dutch oven set over medium heat. Cover and cook until the chicken is cooked through, tender and easily pulls apart with two forks, about 30 minutes. Serve with optional toppings.
Slow Cooker Chicken Taco Soup Recipe
Add chicken to slow cooker. Add taco seasoning, chicken stock, broth or water, black beans, corn, chili beans, tomatoes, ranch seasoning, and the green chilies. Stir until well combined.
Cook on low setting for 6 hours. Serve with tortilla chips, sour cream, chopped green onions, or shredded cheese.
Instant Pot Chicken Taco Soup Recipe
Add the chicken to the Instant Pot. Add the taco seasoning, chicken stock, broth or water, black beans, corn, chili beans, tomatoes, ranch seasoning and green chilis to the Instant Pot. Stir until well combined.
Secure the lid to the Instant Pot and seal the vent. Cook for 10 minutes on High Setting. Allow the pressure to release naturally for 10 minutes and then carefully release the remaining pressure. Remove the lid of the Instant Pot. Shred the chicken with two forks and serve. Serve with tortilla chips, sour cream, chopped green onions, or shredded cheese.","{'calories': '78 kcal', 'carbohydrateContent': '3 g', 'proteinContent': '12 g', 'fatContent': '1 g', 'saturatedFatContent': '1 g', 'cholesterolContent': '36 mg', 'sodiumContent': '444 mg', 'fiberContent': '1 g', 'sugarContent': '1 g', 'servingSize': '1 serving'}",American,8 servings,https://addapinch.com/wp-content/uploads/2019/09/chicken-taco-soup-recipe-2460.jpg,5.0,"Chicken Taco Soup Recipe - So quick and easy, this chicken taco soup recipe is flavorful and delicious! Made with chicken, beans, corn, it is on the table in less than 30 minutes!",Complete
"Main Course,Soup",Taco Soup Recipe,30,"2 pounds ground beef (or ground chicken or ground turkey), 1 tablespoon taco seasoning, 1-1/2 cups water, 1 (15-ounce) can black beans (drained and rinsed), 1 (15-1/4 ounce) can whole kernel corn (drained, or use frozen whole kernel corn), 1 (16-ounce) can mild chili beans (undrained), 1 (10-ounce) can diced tomatoes with green chiles, 1 (14 1/2-ounce) can stewed tomatoes, 2 1/2 tablespoons ranch seasoning mix, 1 (4-ounce) can green chiles (optional), Salt and pepper (to taste when serving), tortilla chips, Sour cream, Green onions (chopped), Cheddar cheese (shredded)","IngredientGroup(ingredients=['2 pounds ground beef (or ground chicken or ground turkey)', '1 tablespoon taco seasoning', '1-1/2 cups water', '1 (15-ounce) can black beans (drained and rinsed)', '1 (15-1/4 ounce) can whole kernel corn (drained, or use frozen whole kernel corn)', '1 (16-ounce) can mild chili beans (undrained)', '1 (10-ounce) can diced tomatoes with green chiles', '1 (14 1/2-ounce) can stewed tomatoes', '2 1/2 tablespoons ranch seasoning mix', '1 (4-ounce) can green chiles (optional)', 'Salt and pepper (to taste when serving)'], purpose=None), IngredientGroup(ingredients=['tortilla chips', 'Sour cream', 'Green onions (chopped)', 'Cheddar cheese (shredded)'], purpose='Optional toppings:')","Stovetop Taco Soup Recipe
Cook ground beef in a large Dutch oven over medium heat until browned, about 5 minutes. Drain excess fat.
Add taco seasoning and stir until well combined.
Add water and mix well. Add all other ingredients and stir until well combined. Bring to a full boil. Reduce heat to simmer and simmer uncovered until all ingredients are heated well throughout, about 15 minutes.
Remove from heat. Add salt and pepper to taste. Serve with tortilla chips, sour cream, chopped green onions, or shredded cheddar cheese
Slow Cooker Taco Soup Recipe
Cook ground beef in a large skillet over medium heat until browned, about 5 minutes. Drain excess fat. Pour the browned meat into the slow cooker. Add taco seasoning, water, black beans, corn, chili beans, tomatoes, ranch seasoning, and the green chilies. Stir until well combined.
Cook on low setting for 6 hours. Serve with tortilla chips, sour cream, chopped green onions, or shredded cheese.
Instant Pot Taco Soup Recipe
Set the Instant Pot to Saute. Add ground beef to the Instant Pot and cook until the ground beef has browned, about 3 minutes. Drain excess fat. Add the taco seasoning, water, black beans, corn, chili beans, tomatoes, ranch seasoning and green chilis to the Instant Pot. Stir until well combined.
Secure the lid to the Instant Pot and seal the vent. Cook for 10 minutes on High Setting. Allow the pressure to release naturally for 10 minutes and then carefully release the remaining pressure. Remove the lid of the Instant Pot. Serve with tortilla chips, sour cream, chopped green onions, or shredded cheese.","{'calories': '390 kcal', 'proteinContent': '25 g', 'fatContent': '23 g', 'saturatedFatContent': '9 g', 'cholesterolContent': '81 mg', 'sodiumContent': '707 mg', 'carbohydrateContent': '19 g', 'fiberContent': '4 g', 'sugarContent': '1 g', 'servingSize': '1 serving'}",American,8 servings,https://addapinch.com/wp-content/uploads/2017/08/taco-soup-recipe_DSC2237.jpg,5.0,"This easy Taco Soup recipe is hearty and delicious, uses my homemade taco seasoning, and is ready in under 30 minutes! Instructions included to make this THREE ways - on the stovetop, in a slow cooker or in an Instant Pot!",Complete
Salad,Spinach Salad with Hot Bacon Dressing,20,"8 cups spinach, 1 pear (sliced), 1/2 cup pecans (toasted), 1/2 red onion (sliced), gorgonzola crumbles, 6 strips bacon (chopped and cooked (reserve 3 tablespoons for the dressing below)), 3 tablespoons bacon drippings (from cooking the bacon for the salad), 3 tablespoons apple cider vinegar, 2 teaspoons sugar, 1/2 teaspoon Dijon mustard, pinch kosher salt, pinch ground black pepper","IngredientGroup(ingredients=['8 cups spinach', '1 pear (sliced)', '1/2 cup pecans (toasted)', '1/2 red onion (sliced)', 'gorgonzola crumbles', '6 strips bacon (chopped and cooked (reserve 3 tablespoons for the dressing below))'], purpose=None), IngredientGroup(ingredients=['3 tablespoons bacon drippings (from cooking the bacon for the salad)', '3 tablespoons apple cider vinegar', '2 teaspoons sugar', '1/2 teaspoon Dijon mustard', 'pinch kosher salt', 'pinch ground black pepper'], purpose='For the Hot Bacon Dressing:')","Make the salad. Layer the fresh baby spinach, pear slices, toasted pecans, and red onion slices in a salad bowl or a platter. Top with bacon and blue cheese crumbles.
Make the dressing. Whisk together the salad dressing ingredients and drizzle over the spinach salad.
Serve. Toss the salad to coat all of the ingredients with the dressing. Serve.","{'carbohydrateContent': '10 g', 'proteinContent': '5 g', 'fatContent': '15 g', 'saturatedFatContent': '3 g', 'transFatContent': '1 g', 'cholesterolContent': '15 mg', 'sodiumContent': '183 mg', 'fiberContent': '3 g', 'sugarContent': '5 g', 'calories': '186 kcal', 'unsaturatedFatContent': '10 g', 'servingSize': '1 serving'}",American,6 servings,https://addapinch.com/wp-content/uploads/2010/10/Add-a-Pinch_Spinach-Salad-with-Warm-Bacon-Dressing_014.jpg,5.0,"This spinach salad has bacon, pears, pecans, onion, and blue cheese served with a hot bacon dressing. Perfect as a side or topped with protein for a meal.",Complete
Soup,Pasta Fagioli Recipe,30,"1 pound ground beef, ½ medium onion (finely chopped), 2 medium carrots (shredded or finely chopped), 3 stalks celery (chopped), 3 cloves garlic (minced), 4 cups vegetable broth, 1 (15-ounce) can diced tomatoes, 1 (8-ounce can) tomato sauce, 2 teaspoons chopped fresh basil or 1 teaspoon dried basil, 1½ teaspoons fresh oregano or 1 teaspoon dried oregano, 1 teaspoon fresh thyme, 1 teaspoon kosher salt, ½ teaspoon ground black pepper, 1½ cups uncooked ditalini pasta, 1 (15-ounce can) red kidney beans, 1 15-ounce can great northern beans, grated Parmesan cheese (for garnish), freshly chopped parsley (for garnish)","IngredientGroup(ingredients=['1 pound ground beef', '½ medium onion (finely chopped)', '2 medium carrots (shredded or finely chopped)', '3 stalks celery (chopped)', '3 cloves garlic (minced)', '4 cups vegetable broth', '1 (15-ounce) can diced tomatoes', '1 (8-ounce can) tomato sauce', '2 teaspoons chopped fresh basil or 1 teaspoon dried basil', '1½ teaspoons fresh oregano or 1 teaspoon dried oregano', '1 teaspoon fresh thyme', '1 teaspoon kosher salt', '½ teaspoon ground black pepper', '1½ cups uncooked ditalini pasta', '1 (15-ounce can) red kidney beans', '1 15-ounce can great northern beans', 'grated Parmesan cheese (for garnish)', 'freshly chopped parsley (for garnish)'], purpose=None)","Brown ground beef in stockpot set over medium heat, stirring frequently until cooked throughout, about 5 minutes. Drain away any drippings from the beef and stir in the onions, carrots, and celery and cook until just tender, about 3 minutes. Stir in the garlic and reduce the heat to low. Stir in the stock, tomatoes, tomato sauce, basil, oregano, thyme, salt and pepper. Bring to a boil and stir in the ditalini, along with the beans and their liquid. Reduce the heat to medium and cook until the vegetables are tender and the pasta is al dente, about 10 minutes.
Serve warm with grated Parmesan cheese and parsley, optional.","{'calories': '365 kcal', 'carbohydrateContent': '35 g', 'proteinContent': '19 g', 'fatContent': '15 g', 'saturatedFatContent': '5 g', 'cholesterolContent': '53 mg', 'sodiumContent': '472 mg', 'fiberContent': '2 g', 'sugarContent': '2 g', 'servingSize': '1 serving'}",American,6 servings,https://addapinch.com/wp-content/uploads/2017/10/pasta-fagioli-soup-recipe_DSC5563.jpg,5.0,"Pasta Fagioli Recipe – If you love the Olive Garden Pasta Fagioli recipe, then I think you’ll love this homemade version as much or more! Ready in 30 minutes!",Complete
Salad,Apple Pear Salad with Pomegranate Vinaigrette,15,"1/4 cup Pomegranate juice, 1/4 cup honey, 1 tablespoon apple cider vinegar, 1 tablespoon Dijon mustard, 1/2 cup olive oil, 3 apples, 3 pears, 4 cups mixed salad greens, 1 cup roasted pecans, bleu cheese crumbles (I use Maytag), Pomegranate seeds","IngredientGroup(ingredients=['1/4 cup Pomegranate juice', '1/4 cup honey', '1 tablespoon apple cider vinegar', '1 tablespoon Dijon mustard', '1/2 cup olive oil'], purpose='Pomegranate Vinaigrette'), IngredientGroup(ingredients=['3 apples', '3 pears', '4 cups mixed salad greens', '1 cup roasted pecans', 'bleu cheese crumbles (I use Maytag)', 'Pomegranate seeds'], purpose='Salad')","Pomegranate Vinaigrette
In a large measuring cup, combine Pomegranate juice, honey, vinegar, and mustard. Whisk together until well-combined. Continue to whisk as you add in olive oil to emulsify. Pour dressing into serving container and set aside.
Apple Pear Salad
In a medium bowl, pour about 1/2 cup of Pomegranate Vinaigrette. Core and thinly slice apples and pears, adding to the bowl and tossing in the vinaigrette.
In another large serving bowl, combine salad greens, roasted pecans, bleu cheese crumbles and pomegranate seeds. Using a slotted spoon, remove fruit from dressing and add into the salad bowl.
Serve with Pomegranate Vinaigrette Dressing.","{'calories': '156 kcal', 'carbohydrateContent': '20 g', 'fatContent': '9 g', 'saturatedFatContent': '1 g', 'sodiumContent': '19 mg', 'fiberContent': '2 g', 'sugarContent': '15 g', 'servingSize': '1 serving'}",American,12 servings,https://addapinch.com/wp-content/uploads/2012/11/apple-pear-salad-recipe_DSC0889-scaled.jpg,5.0,"Apple Pear Salad Recipe - This Apple Pear Salad with Pomegranate Vinaigrette makes a delicious salad anytime of year, but especially throughout the holidays.",Complete
Main Course,Chicken Salad with Grapes Recipe,5,"4 cups cooked, chopped chicken, 1 cup chopped celery, 1 cup red seedless grapes (halved), 1/2 cup dried cranberries, 1/2 cup roasted pecans (chopped), 1 cup mayonnaise (or Greek Yogurt), 1/2 teaspoon kosher salt, 1/2 teaspoon ground black pepper, celery leaves (chopped (optional))","IngredientGroup(ingredients=['4 cups cooked, chopped chicken', '1 cup chopped celery', '1 cup red seedless grapes (halved)', '1/2 cup dried cranberries', '1/2 cup roasted pecans (chopped)', '1 cup mayonnaise (or Greek Yogurt)', '1/2 teaspoon kosher salt', '1/2 teaspoon ground black pepper', 'celery leaves (chopped (optional))'], purpose=None)","Add chopped chicken to a large bowl along with celery, grapes, dried cranberries, chopped pecans, mayonnaise, salt and pepper. If using chopped celery leaves, add these as well.
Stir together until just combined. Serve and enjoy!","{'calories': '262 kcal', 'carbohydrateContent': '11 g', 'proteinContent': '40 g', 'fatContent': '6 g', 'saturatedFatContent': '1 g', 'cholesterolContent': '106 mg', 'sodiumContent': '279 mg', 'fiberContent': '2 g', 'sugarContent': '8 g', 'servingSize': '1 serving'}",American,8 servings,https://addapinch.com/wp-content/uploads/2017/06/chicken-salad-recipe-DSC_2042.jpg,4.96,"Chicken Salad with Grapes Recipe - This chicken salad recipe makes a delicious, quick meal. Made with chicken, grapes, and roasted nuts, it is always a favorite!",Complete
"Main Course,Soup",Slow Cooker Vegetable Soup Recipe,255,"2 pounds ground beef (optional), ½ medium onion (diced), 2 cups fresh or frozen mixed vegetables (or 2 (15-ounce) cans mixed vegetables, drained), 2 cups fresh or frozen Lima beans (or 1 (15-ounce) can Lima beans, drained), 2 cups fresh or frozen corn kernels (or 1 (15-ounce) can niblet corn, drained), 2 cups carrots sliced (or 1 (15-ounce) can carrots, drained), 4 pounds peeled and diced whole tomatoes (or 4 (15-ounce) cans diced tomatoes), 1 (15-ounce) can tomatoes and okra, 2 cups water, 1 teaspoon kosher salt, ½ teaspoon ground black pepper","IngredientGroup(ingredients=['2 pounds ground beef (optional)', '½ medium onion (diced)', '2 cups fresh or frozen mixed vegetables (or 2 (15-ounce) cans mixed vegetables, drained)', '2 cups fresh or frozen Lima beans (or 1 (15-ounce) can Lima beans, drained)', '2 cups fresh or frozen corn kernels (or 1 (15-ounce) can niblet corn, drained)', '2 cups carrots sliced (or 1 (15-ounce) can carrots, drained)', '4 pounds peeled and diced whole tomatoes (or 4 (15-ounce) cans diced tomatoes)', '1 (15-ounce) can tomatoes and okra', '2 cups water', '1 teaspoon kosher salt', '½ teaspoon ground black pepper'], purpose=None)","Cook ground beef, if using, and onions until browned. Drain away the drippings from the browned beef and discard the drippings. Add the beef and onions to the slow cooker along with all other ingredients.
Cook in the slow cooker for 4 hours on low.
Taste and adjust seasonings as needed","{'servingSize': '2 cups', 'calories': '466 kcal', 'carbohydrateContent': '38 g', 'proteinContent': '28 g', 'fatContent': '23 g', 'saturatedFatContent': '8 g', 'cholesterolContent': '80 mg', 'fiberContent': '9 g', 'sugarContent': '8 g'}",American,8 servings,https://addapinch.com/wp-content/uploads/2016/11/slow-cooker-vegetable-soup-DSC_1395.jpg,4.88,"Slow Cooker Vegetable Soup Recipe - Loaded with vegetables, this vegetable soup is made even easier in the slow cooker! Includes optional ground beef for meat lovers as well as vegan options!",Complete
"Main Course,Soup",Slow Cooker Minestrone Soup,250,"2 cups carrots (, sliced or 1 (15-ounce) can carrots, drained), 2 cups sliced celery, 2 cups green beans (, ends trimmed and cut into 1/2-inch pieces), 1 medium Russet potato (, scrubbed clean and cut into 1-inch chunks), 1 (15-ounce) can red kidney beans ( , drained and rinsed), 1 (15-ounce) can great Northern beans or canellini (or canellini, drained and rinsed), 1 (28-ounce) can diced tomatoes, 6 cups vegetable broth, 2 Bay leaves, 1 1/2 tablespoons Italian Seasoning, 1 pinch red pepper flakes (, optional), 1 medium zucchini (, sliced), 1 1/2 cups uncooked ditalini pasta, 2 cups spinach, grated fresh parmesan (optional)","IngredientGroup(ingredients=['2 cups carrots (, sliced or 1 (15-ounce) can carrots, drained)', '2 cups sliced celery', '2 cups green beans (, ends trimmed and cut into 1/2-inch pieces)', '1 medium Russet potato (, scrubbed clean and cut into 1-inch chunks)', '1 (15-ounce) can red kidney beans ( , drained and rinsed)', '1 (15-ounce) can great Northern beans or canellini (or canellini, drained and rinsed)', '1 (28-ounce) can diced tomatoes', '6 cups vegetable broth', '2 Bay leaves', '1 1/2 tablespoons Italian Seasoning', '1 pinch red pepper flakes (, optional)', '1 medium zucchini (, sliced)', '1 1/2 cups uncooked ditalini pasta', '2 cups spinach', 'grated fresh parmesan (optional)'], purpose=None)","Add carrots, celery, green beans, and potatoes to at least a 6-quart slow cooker. Stir in the canned beans, tomatoes, vegetable stock, bay leaves, Italian seasoning, and red pepper flakes. Secure the lid and cook on the low setting for 6-8 hours or the high setting for 4 hours.
About 30 minutes prior to serving, stir in the zucchini and the pasta. Remove the lid and stir in the spinach.
Serve warm with grated fresh parmesan, if desired.","{'servingSize': '2.5 cups', 'calories': '181 kcal', 'carbohydrateContent': '38 g', 'proteinContent': '6 g', 'sodiumContent': '760 mg', 'fiberContent': '4 g', 'sugarContent': '6 g'}",American,8 servings,https://addapinch.com/wp-content/uploads/2018/01/Slow-Cooker-Minestrone-Soup-Recipe-5-scaled.jpg,5.0,"Slow Cooker Minestrone Soup Recipe – Loaded with seasonal vegetables, this minestrone soup is made even easier in this slow cooker recipe! A definite family favorite!",Complete
Dressing,Balsamic Vinaigrette Recipe,3,"3/4 cup olive oil, 1/4 cup balsamic vinegar, 1 teaspoon honey (optional, brown sugar, agave or any non-refrigerated sweetener), 1/2 teaspoon Stone House Seasoning","IngredientGroup(ingredients=['3/4 cup olive oil', '1/4 cup balsamic vinegar', '1 teaspoon honey (optional, brown sugar, agave or any non-refrigerated sweetener)', '1/2 teaspoon Stone House Seasoning'], purpose=None)","Blender Balsamic Vinaigrette Method
Add all ingredients to a blender, turning on and off or using the pulse feature for 30 seconds. Taste and add more vinegar or olive oil to adjust to your taste. Add sugar at this time if needed. Return lid and pulse vinaigrette again for about 30 seconds until well-combined. Serve or transfer to an airtight container.
Jar Balsamic Vinaigrette Method
Add all ingredients to a jar with a tight fitting lid, such as a Mason jar, that will hold 1 1/2 cups of liquid. Affix the lid to the jar tightly. Shake the jar vigorously for 30 seconds. Taste and add more vinegar or olive oil to adjust to your taste. Add sugar at this time if needed. Return the lid and shake again vigorously until well combined. Serve or store with the lid tightly sealed.
Whisk Balsamic Vinaigrette Method
Add all ingredients to a bowl or container that will hold 1 1/2 cups of liquid. Whisk vigorously for 30 seconds. Taste and add more vinegar or olive oil to adjust to your taste. Add sugar at this time if needed. Whisk again vigorously until well combined. Serve or transfer to an airtight container.","{'servingSize': '1 tablespoon', 'calories': '71 kcal', 'carbohydrateContent': '4 g', 'proteinContent': '0.2 g', 'fatContent': '7 g'}",American,1 serving,https://addapinch.com/wp-content/uploads/2012/06/balsamic-vinaigrette-dressing-recipe-609-scaled.jpg,5.0,"Balsamic Vinaigrette Dressing is one of the easiest and most diverse dressings. Ready in three minutes, it can be served with a salad, vegetables, or drizzled on top of fish or chicken for an amazing meal.",Complete
"Salad,Side Dish",Warm Potato Salad with Bacon and Onion Recipe,30,"3 pounds red potatoes, 8 slices bacon (cooked and diced), 1/2 medium red onion (diced), 1/4 cup distilled white vinegar, 2 tablespoons water, 1 tablespoon granulated sugar, 1 teaspoon Stone House Seasoning","IngredientGroup(ingredients=['3 pounds red potatoes', '8 slices bacon (cooked and diced)', '1/2 medium red onion (diced)', '1/4 cup distilled white vinegar', '2 tablespoons water', '1 tablespoon granulated sugar', '1 teaspoon Stone House Seasoning'], purpose=None)","Boil red potatoes until fork tender, about 20 minutes. Drain and cut potatoes into wedges. Add to a large bowl for mixing.
In a large skillet, add diced bacon and cook until crispy, about 5 minutes. Remove from skillet with a slotted spoon and add to potatoes.
Add diced onion to skillet and cook until tender, about 3-5 minutes. Remove from skillet with a slotted spoon and add to potatoes and bacon.
Combine vinegar, water, sugar, and Stone House Seasoning in a small bowl. Pour into skillet with the bacon drippings and cook until it thickens, about 1-2 minutes. Pour over potatoes and toss until all ingredients are well-coated. Serve warm.","{'calories': '294 kcal', 'carbohydrateContent': '39 g', 'proteinContent': '8 g', 'fatContent': '12 g', 'saturatedFatContent': '4 g', 'cholesterolContent': '19 mg', 'sodiumContent': '623 mg', 'fiberContent': '4 g', 'sugarContent': '5 g', 'servingSize': '1 serving'}",American,6 servings,https://addapinch.com/wp-content/uploads/2012/05/warm-potato-salad-with-bacon-recipe-566-scaled.jpg,5.0,Warm Potato Salad with Bacon and Onions is a simple potato salad to pull together and perfect for summertime entertaining and camping trips!,Complete
"Dressing,Salad",White Balsamic Vinaigrette Recipe,5,"3/4 cup olive oil, 1/4 cup white balsamic vinegar, 1 teaspoon brown sugar, honey, cane sugar or agave (must be non-refrigerated sweetener), 1/2 teaspoon Stone House Seasoning","IngredientGroup(ingredients=['3/4 cup olive oil', '1/4 cup white balsamic vinegar', '1 teaspoon brown sugar, honey, cane sugar or agave (must be non-refrigerated sweetener)', '1/2 teaspoon Stone House Seasoning'], purpose=None)",Add all ingredients to a Mason Jar. Screw on the lid tightly and shake the jar vigorously to combine the dressing. Remove the lid and serve.,"{'servingSize': '1 tablespoon', 'calories': '93 kcal', 'fatContent': '10 g', 'saturatedFatContent': '1 g', 'sodiumContent': '73 mg'}",American,16 servings,https://addapinch.com/wp-content/uploads/2019/05/white-balsamic-dressing-recipe-562-scaled.jpg,5.0,"White Balsamic Dressing Recipe - Light, slightly sweet and tangy, this simple dressing recipe is made with 4 ingredients and is ready in 5 minutes! Perfect for any salad!",Complete
"Salad,Side Dish",Pesto Caprese Pasta Salad,25,"1 (16-ounce) package uncooked pasta (farfalle, penne, or spiral), 1 (6.7-ounce) package sundried tomatoes (drained from oil), 5 slices bacon (cooked and crumbled), 1/4 medium red onion (diced), 1 (8-ounce) package mozzarella balls, 1 1/2 cups pesto, 1 teaspoon Stone House Seasoning, 1 bunch fresh basil (torn into pieces)","IngredientGroup(ingredients=['1 (16-ounce) package uncooked pasta (farfalle, penne, or spiral)', '1 (6.7-ounce) package sundried tomatoes (drained from oil)', '5 slices bacon (cooked and crumbled)', '1/4 medium red onion (diced)', '1 (8-ounce) package mozzarella balls', '1 1/2 cups pesto', '1 teaspoon Stone House Seasoning', '1 bunch fresh basil (torn into pieces)'], purpose=None)","Cook pasta according to package instructions. Drain and place into a large mixing bowl. Add sun-dried tomatoes, bacon, red onion, mozzarella balls, pesto, and Stone House Seasoning. Stir well to combine.
When ready to serve, tear fresh basil leaves into pieces and stir into the pasta salad.","{'calories': '358 kcal', 'carbohydrateContent': '37 g', 'proteinContent': '9 g', 'fatContent': '18 g', 'saturatedFatContent': '3 g', 'cholesterolContent': '10 mg', 'sodiumContent': '423 mg', 'fiberContent': '2 g', 'sugarContent': '2 g', 'servingSize': '1 serving'}",American,10 servings,https://addapinch.com/wp-content/uploads/2019/04/pesto-caprese-pasta-salad-recipe-372-scaled.jpg,5.0,"Pesto Caprese Pasta Salad Recipe - A classic pasta updated with a bright pesto dressing, sundried tomatoes, and bacon. A perfect quick and easy side dish!",Complete
