Category,Title,Total Time,All Ingredients,Ingredient Groups,Instructions,Nutrition,Cuisine,Yields,Image,Ratings,Description,Status
Main Course,Caprese Grilled Cheese Sandwich Recipe,15,"2 slices sourdough bread, 3 tablespoons pesto, 3 slices mozzarella cheese, 2 slices tomato, 2-3 medium fresh basil, balsamic glaze, butter (room temperature)","IngredientGroup(ingredients=['2 slices sourdough bread', '3 tablespoons pesto', '3 slices mozzarella cheese', '2 slices tomato', '2-3 medium fresh basil', 'balsamic glaze', 'butter (room temperature)'], purpose=None)","Preheat skillet or grill pan to medium heat.
Spread pesto onto one slice of sourdough bread. Layer with mozzarella cheese, tomato, basil leaves and a drizzle of balsamic glaze. Top with second slice of sourdough bread.
Butter the bottom outside slice of the sourdough bread. Place into heated skillet or griddle. Cook until golden brown, about 3-5 minutes. Butter top outside piece of sourdough bread. Flip and cook until golden brown, about 3-5 minutes.
Remove the golden brown grilled cheese sandwich from the skillet or griddle. Cut in half and serve warm.","{'calories': '484 kcal', 'carbohydrateContent': '28 g', 'proteinContent': '36 g', 'fatContent': '38 g', 'saturatedFatContent': '14 g', 'cholesterolContent': '70 mg', 'sodiumContent': '745 mg', 'fiberContent': '4 g', 'sugarContent': '7 g', 'servingSize': '1 serving'}",American,1 serving,https://addapinch.com/wp-content/uploads/2019/04/caprese-grilled-cheese-sandwich-recipe-363-scaled.jpg,5.0,"This Caprese Grilled Cheese Sandwich recipe makes a simple and delicious gourmet grilled cheese sandwich with sourdough, pesto, ripe tomatoes, fresh basil, and melty mozzarella! It's so good and it's ready in minutes!",Complete
"Main Course,Snack",Deep Dish Pizza Cups Recipe,25,"1 recipe pizza dough (homemade or storebought), 1/2 cup pizza sauce, 1/4 cup ricotta cheese (or cottage cheese), 1 cup mozzarella cheese (grated), 1/2 cup parmesan cheese (grated), pepperoni","IngredientGroup(ingredients=['1 recipe pizza dough (homemade or storebought)', '1/2 cup pizza sauce', '1/4 cup ricotta cheese (or cottage cheese)', '1 cup mozzarella cheese (grated)', '1/2 cup parmesan cheese (grated)', 'pepperoni'], purpose=None)","Preheat oven to 375º F. Coat a 12-cup muffin pan with olive oil. Divide pizza dough into 12 equal portions and press each of the portions into the individual muffin cups.
Customize your deep dish pizza cups.
Pepperoni Pizza Cups
Top each of the pizza cups that you'd like as pepperoni pizza cups with about 1 tablespoon each of pizza sauce followed by about 2 tablespoons each of Mozzarella cheese and 1 tablespoon of Parmesan cheese. Top each of the pizza cups with pepperoni pieces.
Cheese Pizza Cups
Top each of the pizza cups that you'd like as cheese pizza cups with about 1 tablespoon each of pizza sauce followed by about 2 tablespoons each of Mozzarella cheese and 1 tablespoon of Parmesan cheese.
White Cheese Pizza Cups
Top each of the pizza cups that you'd like as white cheese pizza cups with about 1 tablespoon each of ricotta cheese or cottage cheese followed by about 2 tablespoons each of Mozzarella cheese and 1 tablespoon of Parmesan cheese.
Bake until the cheese is melted and the pizza cups are cooked throughout, about 20 minutes. Remove from the oven and allow to rest about 3 - 5 minutes before serving.","{'servingSize': '2 cups', 'calories': '271 kcal', 'carbohydrateContent': '33 g', 'proteinContent': '13 g', 'fatContent': '9 g', 'saturatedFatContent': '5 g', 'cholesterolContent': '25 mg', 'sodiumContent': '837 mg', 'fiberContent': '1 g', 'sugarContent': '5 g'}","American,Italian",6 servings,https://addapinch.com/wp-content/uploads/2018/10/deep-dish-pizza-cups-recipe-DSC_0626-scaled.jpg,5.0,"These easy Deep Dish Pizza Cups make a fun and delicious way to serve everyone's favorite pizza! Perfectly sized pizza for quick and easy meals, meal prep, and more!",Complete
Salad,Grilled Chicken Fiesta Salad Recipe,30,"4 - 6 cups salad greens, 2 chicken breasts (grilled and sliced), 1 ear corn (grilled and removed from the cob), 1 (15-ounce) can black beans (drained and rinsed), 1 pint cherry tomatoes (halved or quartered), 1/2 medium red onion (sliced thinly), 1 cup crushed tortilla chips, 1/4 cup cilantro, 1 cup salsa recipe (or store-bought), 1 medium avocado, 1 medium lime","IngredientGroup(ingredients=['4 - 6 cups salad greens', '2 chicken breasts (grilled and sliced)', '1 ear corn (grilled and removed from the cob)', '1 (15-ounce) can black beans (drained and rinsed)', '1 pint cherry tomatoes (halved or quartered)', '1/2 medium red onion (sliced thinly)', '1 cup crushed tortilla chips', '1/4 cup cilantro', '1 cup salsa recipe (or store-bought)', '1 medium avocado', '1 medium lime'], purpose=None)","Grill the chicken breasts over direct heat at 400ºF for 6 to 8 minutes. Carefully flip the chicken breasts and cook until the chicken reaches 160º F - 165º F when checked with an internal thermometer, about 6 to 8 more minutes. Remove from the grill and let the chicken rest for 5 minutes before slicing.
Arrange salad greens on a large platter or toss into a large bowl. Top with grilled chicken slices, corn, black beans, tomatoes, onion, crushed tortilla chips, and torn fresh cilantro.
Pour salsa into a small cup and place on the platter alongside the salad for serving. Halve the avocado and place alongside the salad, or go ahead and dice and toss into the salad. Slice the lime and squeeze the lime juice over the salad and serve.","{'servingSize': '1 cup', 'calories': '354 kcal', 'carbohydrateContent': '34 g', 'proteinContent': '32 g', 'fatContent': '10 g', 'saturatedFatContent': '1 g', 'cholesterolContent': '73 mg', 'sodiumContent': '671 mg', 'fiberContent': '4 g', 'sugarContent': '6 g'}",American,4 servings,https://addapinch.com/wp-content/uploads/2018/06/grilled-chicken-fiesta-salad-recipe_DSC0069-scaled.jpg,5.0,Grilled Chicken Fiesta Salad Recipe - This simple grilled chicken salad recipe is kicked up a notch for a spicy Tex-Mex favorite!,Complete
Salad,Easy Chicken Club Salad Recipe,10,"6 cups salad greens, 3 medium chicken breasts (cooked, cooled and sliced or rotisserie chicken), 6 slices bacon (cooked, cooled and chopped), 1 pint grape tomatoes (halved), 4 large hard boiled eggs (quartered), 1 large cucumber (peeled and chopped), 1/2 cup shredded cheese, 4 slices ham or turkey (stacked, rolled and sliced)","IngredientGroup(ingredients=['6 cups salad greens', '3 medium chicken breasts (cooked, cooled and sliced or rotisserie chicken)', '6 slices bacon (cooked, cooled and chopped)', '1 pint grape tomatoes (halved)', '4 large hard boiled eggs (quartered)', '1 large cucumber (peeled and chopped)', '1/2 cup shredded cheese', '4 slices ham or turkey (stacked, rolled and sliced)'], purpose=None)",Layer salad greens onto a large platter. Arrange chicken in the center on top of the salad greens. Then arrange rows of the remaining ingredients on top of the salad greens. Serve with your favorite dressing.,"{'calories': '372 kcal', 'carbohydrateContent': '6 g', 'proteinContent': '39 g', 'fatContent': '21 g', 'saturatedFatContent': '7 g', 'cholesterolContent': '230 mg', 'sodiumContent': '613 mg', 'fiberContent': '1 g', 'sugarContent': '3 g', 'servingSize': '1 serving'}",American,6 servings,https://addapinch.com/wp-content/uploads/2019/05/club-salad-recipe-635-scaled.jpg,5.0,"This Easy Chicken Club Salad Recipe is a delicious twist on the favorite layered club sandwich. Made of tender chicken, bacon, tomatoes, and so much more! It is always a favorite!",Complete
"Salad,Side Dish",Grilled Corn Salad Recipe,25,"2 ears corn, 2 medium tomatoes (or 1/2 pint grape tomatoes, quartered), 1 medium jalapeno pepper (seeded and diced), 2 medium green onions (sliced), 1 large avocado (peeled and diced), 1 large lime, cilantro, kosher salt","IngredientGroup(ingredients=['2 ears corn', '2 medium tomatoes (or 1/2 pint grape tomatoes, quartered)', '1 medium jalapeno pepper (seeded and diced)', '2 medium green onions (sliced)', '1 large avocado (peeled and diced)', '1 large lime', 'cilantro', 'kosher salt'], purpose=None)","Preheat the grill or grill pan to high heat. If needed, brush the grill or grill pan with olive oil to prevent sticking.
Prepare the corn for grilling. If already shucked, remove all of the silks from the corn. If in the shucks, you can optionally shuck and silk the corn or leave in the shucks for grilling.
Grill the corn for 15 - 20 minutes, turning every 5 minutes until the corn or the corn husk has a slight char and/ or grill marks. Remove the corn from the grill and allow to cool enough to handle. Once cooled slightly, place the corn cob on the tip on top of a cutting board. Using a sharp knife, carefully cut the corn kernels away from the cob. Repeat with the second cob of corn.
Place the tomatoes, jalapeno, and sliced onions in a medium bowl. Add the corn, avocado, lime juice, cilantro and salt. Gently toss to combine. Transfer to a serving bowl and serve.","{'calories': '92 kcal', 'carbohydrateContent': '13 g', 'proteinContent': '2 g', 'fatContent': '5 g', 'saturatedFatContent': '1 g', 'sodiumContent': '61 mg', 'fiberContent': '3 g', 'sugarContent': '2 g', 'servingSize': '1 serving'}",American,6 servings,https://addapinch.com/wp-content/uploads/2019/06/grilled-corn-salad-recipe-1210-scaled.jpg,5.0,"This mouthwatering Grilled Corn Salad is loaded with fresh corn, creamy avocado, fresh tomato, jalapeno, and more, all tossed in fresh cilantro and lime. Such an easy and delicious corn salad that is perfect for cookouts and summer barbecues!",Complete
"Appetizer,Salad,Snack",Honey Lime Fruit Salad Recipe,15,"1 pound fresh strawberries (hulled and sliced), 10 ounces fresh blueberries, 10 ounces fresh raspberries, 10 ounces fresh blackberries, 1/2 whole pineapple (cored and cut into 1-inch chunks, or 1 (8-ounce) can pineapple chunks (with juices reserved)), 1 whole kiwi (peeled and diced), 2 cups red grapes (or green grapes, if preferred. Use whole or slice in half.), 2 mandarin oranges (peeled and sectioned, or 1 (8.25-ounce) can), 3 tablespoons honey, 1 tablespoon lime juice, 2 tablespoon pineapple juice","IngredientGroup(ingredients=['1 pound fresh strawberries (hulled and sliced)', '10 ounces fresh blueberries', '10 ounces fresh raspberries', '10 ounces fresh blackberries', '1/2 whole pineapple (cored and cut into 1-inch chunks, or 1 (8-ounce) can pineapple chunks (with juices reserved))', '1 whole kiwi (peeled and diced)', '2 cups red grapes (or green grapes, if preferred. Use whole or slice in half.)', '2 mandarin oranges (peeled and sectioned, or 1 (8.25-ounce) can)'], purpose=None), IngredientGroup(ingredients=['3 tablespoons honey', '1 tablespoon lime juice', '2 tablespoon pineapple juice'], purpose='For the Honey Lime Dressing')","Prep. Wash and cut up all of the fruit as needed. Add the fruit to a large bowl.
Make the dressing. In a small bowl, whisk together the honey, lime, and pineapple juice.
Assemble the fruit salad. When ready to serve, pour the dressing over the prepared fruit and gently toss to coat.","{'calories': '109 kcal', 'carbohydrateContent': '27 g', 'proteinContent': '2 g', 'fatContent': '1 g', 'saturatedFatContent': '0.05 g', 'sodiumContent': '3 mg', 'fiberContent': '6 g', 'sugarContent': '20 g', 'unsaturatedFatContent': '0.4 g', 'servingSize': '1 serving'}",American,10 servings,https://addapinch.com/wp-content/uploads/2017/06/honey-lime-fruit-salad-recipe-DSC_0506-scaled.jpg,5.0,"Honey Lime Fruit Salad makes the best fruit salad recipe! Colorful, juicy fruits with a honey and lime dressing make this a refreshing and incredibly delicious crowd favorite.",Complete
"Main Course,Salad",Balsamic Steak Salad Recipe,22,"balsamic vinaigrette, 1 (3/4 pound) sirloin steak, 6 cups salad greens (mixed), 10 cherry tomatoes (halved), 1 (8-ounce) package mozzarella cheese (cubed), 1/2 medium red onion (sliced thinly), fresh basil","IngredientGroup(ingredients=['balsamic vinaigrette', '1 (3/4 pound) sirloin steak', '6 cups salad greens (mixed)', '10 cherry tomatoes (halved)', '1 (8-ounce) package mozzarella cheese (cubed)', '1/2 medium red onion (sliced thinly)', 'fresh basil'], purpose=None)","Add steak to a zip top bag and pour in 1/4 cup of balsamic vinaigrette. Remove as much air as possible from the bag and seal. Coat the steak well with balsamic vinaigrette. Chill in the refrigerator overnight or throughout the day (about 8 hours) to marinate.
Remove the steak from the marinade and discard the zip top bag and the leftover marinade. Cook the steak on the grill or as a skillet steak to desired doneness. Use an internal temperature probe to check for you preferred level of doneness. Rare (120º F – 130º F), Medium Rare (130º F – 140º F), Medium (140º F – 150º F), Medium Well (150º F – 160º F).
Remove the steak and allow it to rest as you prepare the remainder of the steak salad.
Arrange the salad greens, tomatoes, cheese and red onion on a large platter or in a large salad serving bowl. Slice the steak into 1/4-inch slices and arrange on the salad. Top with fresh basil and serve with balsamic vinaigrette dressing.","{'calories': '289 kcal', 'carbohydrateContent': '15 g', 'proteinContent': '18 g', 'fatContent': '19 g', 'sodiumContent': '178 mg', 'sugarContent': '1 g', 'servingSize': '1 serving'}",American,4 servings,https://addapinch.com/wp-content/uploads/2018/06/balsamic-steak-salad-recipe_DSC0132-scaled.jpg,5.0,"This hearty, delicious Balsamic Steak Salad recipe is loaded with juicy steak, crisp greens, mozzarella, and more, all topped with a homemade Balsamic Vinaigrette. It makes a scrumptious and satisfying dinner salad!",Complete
Salad,Caprese Salad,10,"2 large tomatoes (washed and sliced into 1/4-inch slices), 12 ounces Mozzarella cheese (sliced into 1/4-inch slices), 1/2 cup fresh basil (washed, rolled and sliced into thin strips), 1 tablespoon olive oil, 1 tablespoon balsamic glaze, 1/2 teaspoon kosher salt (optional), 1/2 teaspoon ground black pepper (optional)","IngredientGroup(ingredients=['2 large tomatoes (washed and sliced into 1/4-inch slices)', '12 ounces Mozzarella cheese (sliced into 1/4-inch slices)', '1/2 cup fresh basil (washed, rolled and sliced into thin strips)', '1 tablespoon olive oil', '1 tablespoon balsamic glaze', '1/2 teaspoon kosher salt (optional)', '1/2 teaspoon ground black pepper (optional)'], purpose=None)","Assemble caprese salad by alternating tomato and mozzarella slices on a medium platter. Top the slices with strips of basil and drizzle with olive oil. Drizzle with balsamic glaze.
Serve immediately.","{'calories': '203 kcal', 'carbohydrateContent': '4 g', 'proteinContent': '13 g', 'fatContent': '15 g', 'saturatedFatContent': '8 g', 'cholesterolContent': '45 mg', 'sodiumContent': '552 mg', 'fiberContent': '1 g', 'sugarContent': '2 g', 'unsaturatedFatContent': '6 g', 'servingSize': '1 serving'}","American,Italian",6 servings,https://addapinch.com/wp-content/uploads/2010/11/Caprese-salad-recipe.jpg,5.0,"This Caprese Salad recipe is a classic salad made with just five ingredients - tomatoes, mozzarella, olive oil, basil, and balsamic glaze!",Complete
"Main Course,Salad",Greek Chicken Pasta Salad Recipe,20,"1 (16-ounce) package farfalle pasta, 2 medium chicken breasts (boneless and skinless), 1 teaspoon Stone House Seasoning, 1 pint grape tomatoes (halved), 1 large English cucumber (peeled and sliced), 1 small bell pepper (diced), 1 small red pepper (diced), 1/2 small red onion (diced), 1 (8-ounce) jar black olives (drained and pitted), 1 (6-ounce) package Feta cheese, 1/4 cup olive oil, 1/4 cup red wine vinegar, 1/2 teaspoon Stone House Seasoning, 1/2 teaspoon dried oregano, 1/2 teaspoon dried basil, 1 teaspoon Dijon mustard","IngredientGroup(ingredients=['1 (16-ounce) package farfalle pasta', '2 medium chicken breasts (boneless and skinless)', '1 teaspoon Stone House Seasoning', '1 pint grape tomatoes (halved)', '1 large English cucumber (peeled and sliced)', '1 small bell pepper (diced)', '1 small red pepper (diced)', '1/2 small red onion (diced)', '1 (8-ounce) jar black olives (drained and pitted)', '1 (6-ounce) package Feta cheese'], purpose=None), IngredientGroup(ingredients=['1/4 cup olive oil', '1/4 cup red wine vinegar', '1/2 teaspoon Stone House Seasoning', '1/2 teaspoon dried oregano', '1/2 teaspoon dried basil', '1 teaspoon Dijon mustard'], purpose='For the Greek Pasta Salad Dressing:')","Cook the pasta according to package instructions, drain and allow to cool.
Meanwhile, spray a grill pan with olive oil and set over medium heat. Cut chicken breasts in half lengthwise and arrange the four pieces on the grill pan. Sprinkle with Stone House Seasoning and cook on one side for 4 minutes. Turn over and cook on the other side until the chicken is cooked throughout and registers 165º F when checked with an internal thermometer, about 4 more minutes. Remove the chicken from the grill pan and cut into 1/2-inch pieces.
Add the halved grape tomatoes, cucumber slices, diced peppers and onions, pitted olives, diced chicken and the feta cheese to the pasta.
For the Greek Pasta Salad Dressing:
Whisk together the olive oil, vinegar, Stone House Seasoning, oregano, basil, and Dijon mustard until well combined.
Pour the Greek Pasta Salad Dressing over the pasta salad and toss to combine.","{'calories': '192 kcal', 'carbohydrateContent': '30 g', 'proteinContent': '5 g', 'fatContent': '5 g', 'sodiumContent': '12 mg', 'fiberContent': '1 g', 'sugarContent': '2 g', 'servingSize': '1 serving'}","American,Mediterranean",12 servings,https://addapinch.com/wp-content/uploads/2018/05/greek-chicken-pasta-salad-recipe-0515-scaled.jpg,5.0,"Greek Chicken Pasta Salad Recipe - This easy pasta salad recipe is so easy and delicious! Made with grilled chicken, pasta, an assortment of vegetables and topped with feta cheese and a delicious Greek dressing!",Complete
Salad,BLT Pasta Salad Recipe,25,"1 (16-ounce ) package uncooked pasta (farfalle, penne, or spiral), 1 pint grape tomatoes (halved), 5 slices bacon (cooked and chopped), 2 cups spinach, 1 (8-ounce) package Mozzarella cheese (cut into bite-sized pieces), 1/4 cup red onion (chopped), 1 cup balsamic vinaigrette","IngredientGroup(ingredients=['1 (16-ounce ) package uncooked pasta (farfalle, penne, or spiral)', '1 pint grape tomatoes (halved)', '5 slices bacon (cooked and chopped)', '2 cups spinach', '1 (8-ounce) package Mozzarella cheese (cut into bite-sized pieces)', '1/4 cup red onion (chopped)', '1 cup balsamic vinaigrette'], purpose=None)","Cook pasta according to package instructions for al dente pasta. Rinse the pasta in cold water and drain well. Add the pasta to a large mixing bowl.
Add tomatoes, bacon, spinach, Mozzarella, and red onion to the pasta. Pour in 1/2 cup of the balsamic vinaigrette and toss to combine. Add more balsamic vinaigrette to make sure that all of the ingredients are well coated. Serve with additional balsamic vinaigrette on the side.","{'calories': '217 kcal', 'carbohydrateContent': '35 g', 'proteinContent': '8 g', 'fatContent': '5 g', 'saturatedFatContent': '1 g', 'cholesterolContent': '7 mg', 'sodiumContent': '77 mg', 'fiberContent': '5 g', 'sugarContent': '1 g', 'servingSize': '1 serving'}",American,10 servings,https://addapinch.com/wp-content/uploads/2019/05/blt-pasta-salad-recipe-759-scaled.jpg,5.0,"BLT Pasta Salad Recipe - Everyone's favorite bacon, lettuce, and tomato has a fresh spin in this pasta salad recipe. Perfect for lunch or a light supper!",Complete
"Main Course,Salad",Grilled Chicken Salad with Strawberries and Avocado Recipe,30,"2 chicken breasts (boneless, skinless), 1 cup Balsamic Dressing, 6 cups spinach, 1 pint fresh strawberries (hulled and quartered), 1 pint fresh blueberries, 1/2 cup roasted pecans, 1/4 medium red onion (sliced thinly), 1 medium avocado (peeled, pitted, and sliced), 1 (4-ounce) package goat cheese, fresh basil","IngredientGroup(ingredients=['2 chicken breasts (boneless, skinless)', '1 cup Balsamic Dressing', '6 cups spinach', '1 pint fresh strawberries (hulled and quartered)', '1 pint fresh blueberries', '1/2 cup roasted pecans', '1/4 medium red onion (sliced thinly)', '1 medium avocado (peeled, pitted, and sliced)', '1 (4-ounce) package goat cheese', 'fresh basil'], purpose=None)","Add chicken and 1/2 cup balsamic dressing to a large zip top bag. Press to remove as much air as possible as you seal the bag. Turn the bag to make sure that the chicken is well coated with the balsamic dressing. Chill in the refrigerator for at least 30 minutes.
Spritz a grill pan with olive oil spray and place over medium heat. Remove the chicken from the marinade and place onto the grill pan. Discard the zip top bag and the used balsamic dressing marinade. Cook the chicken for 6 minutes on one side, then use tongs and turn the chicken to the other side and cook for an additional 6 minutes or until the chicken is cooked through and reaches 165º F when checked with an internal thermometer. Remove the grill pan from the heat and allow the chicken to rest as you prepare the remaining ingredients.
Add the spinach, strawberries, blueberries, pecans, and onion to a large bowl. Drizzle about 2 tablespoons of the dressing over the ingredients and toss lightly to combine.
Slice the cooked chicken and add to the salad along with the avocado and goat cheese. Top with torn basil leaves and the remaining dressing and serve.","{'calories': '2263 kcal', 'carbohydrateContent': '154 g', 'proteinContent': '69 g', 'fatContent': '162 g', 'saturatedFatContent': '17 g', 'transFatContent': '0.03 g', 'cholesterolContent': '145 mg', 'sodiumContent': '2557 mg', 'fiberContent': '43 g', 'sugarContent': '83 g', 'unsaturatedFatContent': '59 g', 'servingSize': '1 serving'}",American,6 servings,https://addapinch.com/wp-content/uploads/2019/05/grilled-chicken-spinach-salad-berries-avocado-recipe-577-scaled.jpg,5.0,"Grilled Chicken Salad with Strawberries and Avocado Recipe - This simple grilled chicken salad is made with fresh spinach, sweet berries and creamy avocado, then tossed with a quick balsamic dressing. Ready in 30 minutes!",Complete
Main Course,Bart's Best Hamburger Recipe,20,"1 1/2 pounds ground chuck ((80% lean)), 1 teaspoon Stone House Seasoning, olive oil, 4 hamburger buns, 4 slices cheese, 4 slices tomato, 4 slices butter lettuce, 4 slices red onion, 4-8 slices dill pickles, mayonnaise, ketchup, mustard","IngredientGroup(ingredients=['1 1/2 pounds ground chuck ((80% lean))', '1 teaspoon Stone House Seasoning', 'olive oil', '4 hamburger buns'], purpose=None), IngredientGroup(ingredients=['4 slices cheese', '4 slices tomato', '4 slices butter lettuce', '4 slices red onion', '4-8 slices dill pickles', 'mayonnaise', 'ketchup', 'mustard'], purpose='Optional Hamburger Toppings')","Divide the ground chuck into 4 portions and form each into a hamburger patty. Use your thumb and make a depression in the center of the hamburger. Sprinkle both sides of the hamburger with Stone House Seasoning.
How to Grill Hamburgers
Heat the grill or grill pan to medium-high heat. Brush the grill with oil and then arrange the hamburgers on the grill and cook on the first side for about 3 minutes. Flip the burgers and cook until they reach your preferred level of doneness by inserting an instant-read meat thermometer into the center of the hamburger, but at least 145º F. I recommend 160º F. Remove from the grill.
Add the hamburger buns to the grill, interior side down, and grill for about 3 minutes.
Make Skillet Hamburgers
Arrange hamburger patties in a skillet set over medium heat. Cook on the first side for 3 minutes. Flip the burgers and cook another 3 to 5 minutes until they reach your preferred level of doneness by inserting an instant-read meat thermometer into the center of the hamburger, but at least 145º F. I recommend 160º F. Remove from the skillet.
Make Ary Fryer Hamburgers
Place hamburger patties into the air fryer basket and cook at 360º F for 5 minutes. Flip the burgers and cook another 3 to 5 minutes until they reach your preferred level of doneness by inserting an instant-read meat thermometer into the center of the hamburger, but at least 145º F. I recommend 160º F.
To serve
Place each of the hamburgers onto a bun, add your favorite toppings and serve.","{'calories': '694 kcal', 'carbohydrateContent': '28 g', 'proteinContent': '42 g', 'fatContent': '45 g', 'saturatedFatContent': '19 g', 'cholesterolContent': '150 mg', 'sodiumContent': '1861 mg', 'fiberContent': '3 g', 'sugarContent': '6 g', 'servingSize': '1 serving'}",American,4 servings,https://addapinch.com/wp-content/uploads/2019/05/barts-best-hamburgers-recipe-876-scaled.jpg,5.0,"This Best Hamburger recipe, two ingredients and a few time-tested tips are all you need for the best hamburgers every time!",Complete
