Category,Title,Total Time,All Ingredients,Ingredient Groups,Instructions,Nutrition,Cuisine,Yields,Image,Ratings,Description,Status
Side Dish,Pinto Bean Recipe,310,"1 pound dried pinto beans (picked over and rinsed), 1/2 teaspoon oregano, 1/2 teaspoon chili powder, 1/2 teaspoon kosher salt, 1/2 teaspoon ground black pepper, 1/2 teaspoon garlic powder, 1 onion (finely chopped), 1 ham bone (or 1/2 pound cooked bacon)","IngredientGroup(ingredients=['1 pound dried pinto beans (picked over and rinsed)', '1/2 teaspoon oregano', '1/2 teaspoon chili powder', '1/2 teaspoon kosher salt', '1/2 teaspoon ground black pepper', '1/2 teaspoon garlic powder', '1 onion (finely chopped)', '1 ham bone (or 1/2 pound cooked bacon)'], purpose=None)","Slow Cooker Pinto Beans Recipe:
Add the dried beans to all large stockpot and allow to soak overnight. Drain the dried beans and pour into crock of slow cooker. Add in all other ingredients and combine well. Add water until the beans are fully covered.
Cook the pinto beans on high until beans are tender, about 5 hours.
Stovetop Pinto Beans Recipe:
Add the dried beans to all large stockpot and allow to soak overnight. Drain the dried beans and add in all other ingredients and combine well. Add water until the beans are fully covered.
Bring the beans to a boil over high heat and boil for 15 minutes. Reduce the temperature to low and allow the pinto beans to simmer until they tender when pressed against the side of the stockpot with a wooden spoon, 2 to 3 hours. Add water to the beans as needed.
Instant Pot Pinto Beans Recipe:
Add the dried beans, as well as all of the remaining ingredients, to a 6-quart pressure cooker. Add water until the beans are fully covered, taking care not to fill the pressure cooker more than half full of water.
Seal the pressure cooker and cook the beans under high pressure for 30 minutes. Use either the ""quick release"" method or the natural release method with your pressure cooker. The quick release method will quickly release the pressure from your pressure cooker so that you may remove the lid. The natural release method releases the pressure more slowly, but allows the beans to continue cooking a bit longer and are somewhat more tender.","{'calories': '272 kcal', 'carbohydrateContent': '49 g', 'proteinContent': '16 g', 'fatContent': '1 g', 'saturatedFatContent': '0.2 g', 'sodiumContent': '207 mg', 'fiberContent': '12 g', 'sugarContent': '2 g', 'unsaturatedFatContent': '0.5 g', 'servingSize': '1 serving'}",American,6 servings,https://addapinch.com/wp-content/uploads/2011/10/pinto-beans-recipe-0018.jpg,4.95,"This delicious, savory southern Pinto Beans recipe is a time-tested, traditional favorite! The recipe includes stovetop, slow cooker, pressure cooker, and freezing instructions.",Complete
"Sauce,Side Dish",Make Ahead Turkey Gravy Recipe,17,"1/2 cup salted butter (cubed), 1/2 teaspoon kosher salt, 1/2 teaspoon ground black pepper, 1/2 cup all-purpose flour, 3 cups turkey stock (or turkey broth, chicken broth or pan drippings from cooking turkey, if you have them.)","IngredientGroup(ingredients=['1/2 cup salted butter (cubed)', '1/2 teaspoon kosher salt', '1/2 teaspoon ground black pepper', '1/2 cup all-purpose flour', '3 cups turkey stock (or turkey broth, chicken broth or pan drippings from cooking turkey, if you have them.)'], purpose=None)","Make a roux. Melt butter in a medium saucepan set over medium heat. Sprinkle with salt and pepper and slowly whisk in flour. Cook until the flour is fully incorporated into the butter and gravy is your preferred color (from light blonde to a nut a brown color).
Add stock. Once that stage is reached, constantly whisking, slowly pour in the turkey stock and cook until the gravy is thickened.
Serve, store, or freeze. Remove from the heat and serve immediately or cool, pour into an airtight container and store or freeze. If serving from made-ahead turkey gravy, reheat in a medium saucepan until warmed throughout If the gravy is too thick, add more stock until it reaches the desired consistency.","{'servingSize': '1 tablespoon', 'calories': '27 kcal', 'carbohydrateContent': '2 g', 'proteinContent': '1 g', 'fatContent': '2 g', 'saturatedFatContent': '1 g', 'transFatContent': '0.1 g', 'cholesterolContent': '6 mg', 'sodiumContent': '61 mg', 'fiberContent': '0.04 g', 'sugarContent': '0.2 g', 'unsaturatedFatContent': '1.1 g'}",American,48 servings,https://addapinch.com/wp-content/uploads/2016/11/make-ahead-turkey-gravy-recipe_DSC4513.jpg,5.0,"Make Ahead Turkey Gravy Recipe - This easy turkey gravy recipe is essential to your holiday menu! Simple enough to make on the holiday, but perfect as a make ahead gravy recipe!",Complete
Side Dish,"Instant Pot ""Baked"" Potatoes Recipe",10,"1 cup water, 6 Russet potatoes","IngredientGroup(ingredients=['1 cup water', '6 Russet potatoes'], purpose=None)","Place a steamer basket into the Instant Pot and add 1 cup water.
Scrub potatoes until skins are clean. Place on top of the steamer basket.
Cover and place vent on lid to ""Sealed"".
Set on ""Steam"" program and set time for 10 minutes.
When finished cooking, don't open lid. Allow pressure to release naturally, about 20 minutes.
Carefully remove lid and serve.","{'calories': '168 kcal', 'carbohydrateContent': '38 g', 'proteinContent': '4 g', 'sodiumContent': '13 mg', 'fiberContent': '2 g', 'sugarContent': '1 g', 'servingSize': '1 serving'}",American,6 servings,https://addapinch.com/wp-content/uploads/2019/09/instant-pot-baked-potatoes-recipe-2217.jpg,5.0,"Instant Pot ""Baked"" Potatoes make a quick and easy way to prepare everyone's favorite baked potatoes! Ready in less than 30 minutes!",Complete
Main Course,Lemon Parmesan Pasta Recipe,15,"8 ounces pasta (spaghetti, linguine, fettuccine recommended), 2 large lemons (or enough to provide 2 tablespoons juice and 1 tablespoon fresh zest per serving), 1 cup grated Parmesan cheese, Stone House Seasoning (to taste)","IngredientGroup(ingredients=['8 ounces pasta (spaghetti, linguine, fettuccine recommended)', '2 large lemons (or enough to provide 2 tablespoons juice and 1 tablespoon fresh zest per serving)', '1 cup grated Parmesan cheese', 'Stone House Seasoning (to taste)'], purpose=None)","Cook pasta according to package directions for al dente pasta. Drain and reserve 1/2 cup of the pasta water.
To the pasta, add the zest and juice of the lemons. Then add the Parmesan cheese. Stir to combine. Add the pasta water 1 tablespoon at a time and stir together until well combined. You may not need all of the pasta water that has been reserved.
Add Stone House Seasoning to taste and serve.","{'calories': '349 kcal', 'carbohydrateContent': '53 g', 'proteinContent': '18 g', 'fatContent': '8 g', 'saturatedFatContent': '5 g', 'cholesterolContent': '22 mg', 'sodiumContent': '388 mg', 'fiberContent': '5 g', 'sugarContent': '4 g', 'servingSize': '1 serving'}",American,4 servings,https://addapinch.com/wp-content/uploads/2019/06/lemon-parmesan-pasta-recipe-1095-scaled.jpg,5.0,This Lemon Parmesan Pasta Recipe is a quick and easy pasta recipe that makes the perfect back pocket recipe for busy weeknights. Ready in less than 15 minutes!,Complete
Breakfast,Instant Pot Grits Recipe,15,"1 1/2 cups stone ground grits, 8 cups water, 2 teaspoons kosher salt, 2 cups cream or half and half, 6 tablespoons butter (+ more for serving)","IngredientGroup(ingredients=['1 1/2 cups stone ground grits', '8 cups water', '2 teaspoons kosher salt', '2 cups cream or half and half', '6 tablespoons butter (+ more for serving)'], purpose=None)","Spray inside of Instant Pot with olive oil or nonstick cooking spray. Add water, grits and salt. Stir well to combine. Secure the lid to the Instant Pot and set to HIGH setting for 10 minutes with natural pressure release, about 15 minutes.
Once the grits have cooked and the pressure has released naturally, carefully remove the lid to the Instant Pot. Stir in the cream and add the butter. Serve with additional butter and cheese if desired.","{'calories': '350 kcal', 'carbohydrateContent': '35 g', 'proteinContent': '6 g', 'fatContent': '21 g', 'saturatedFatContent': '13 g', 'cholesterolContent': '60 mg', 'sodiumContent': '925 mg', 'fiberContent': '1 g', 'sugarContent': '1 g', 'servingSize': '1 serving'}",American,6 servings,https://addapinch.com/wp-content/uploads/2019/06/instant-pot-grits-recipe-926-2-scaled.jpg,4.93,"Instant Pot Grits Recipe - These creamy, rich and delicious grits are a classic Southern favorite made in minutes using the Instant Pot.",Complete
"Salad,Side Dish",Warm Potato Salad with Bacon and Onion Recipe,30,"3 pounds red potatoes, 8 slices bacon (cooked and diced), 1/2 medium red onion (diced), 1/4 cup distilled white vinegar, 2 tablespoons water, 1 tablespoon granulated sugar, 1 teaspoon Stone House Seasoning","IngredientGroup(ingredients=['3 pounds red potatoes', '8 slices bacon (cooked and diced)', '1/2 medium red onion (diced)', '1/4 cup distilled white vinegar', '2 tablespoons water', '1 tablespoon granulated sugar', '1 teaspoon Stone House Seasoning'], purpose=None)","Boil red potatoes until fork tender, about 20 minutes. Drain and cut potatoes into wedges. Add to a large bowl for mixing.
In a large skillet, add diced bacon and cook until crispy, about 5 minutes. Remove from skillet with a slotted spoon and add to potatoes.
Add diced onion to skillet and cook until tender, about 3-5 minutes. Remove from skillet with a slotted spoon and add to potatoes and bacon.
Combine vinegar, water, sugar, and Stone House Seasoning in a small bowl. Pour into skillet with the bacon drippings and cook until it thickens, about 1-2 minutes. Pour over potatoes and toss until all ingredients are well-coated. Serve warm.","{'calories': '294 kcal', 'carbohydrateContent': '39 g', 'proteinContent': '8 g', 'fatContent': '12 g', 'saturatedFatContent': '4 g', 'cholesterolContent': '19 mg', 'sodiumContent': '623 mg', 'fiberContent': '4 g', 'sugarContent': '5 g', 'servingSize': '1 serving'}",American,6 servings,https://addapinch.com/wp-content/uploads/2012/05/warm-potato-salad-with-bacon-recipe-566-scaled.jpg,5.0,Warm Potato Salad with Bacon and Onions is a simple potato salad to pull together and perfect for summertime entertaining and camping trips!,Complete
"Salad,Side Dish",Pesto Caprese Pasta Salad,25,"1 (16-ounce) package uncooked pasta (farfalle, penne, or spiral), 1 (6.7-ounce) package sundried tomatoes (drained from oil), 5 slices bacon (cooked and crumbled), 1/4 medium red onion (diced), 1 (8-ounce) package mozzarella balls, 1 1/2 cups pesto, 1 teaspoon Stone House Seasoning, 1 bunch fresh basil (torn into pieces)","IngredientGroup(ingredients=['1 (16-ounce) package uncooked pasta (farfalle, penne, or spiral)', '1 (6.7-ounce) package sundried tomatoes (drained from oil)', '5 slices bacon (cooked and crumbled)', '1/4 medium red onion (diced)', '1 (8-ounce) package mozzarella balls', '1 1/2 cups pesto', '1 teaspoon Stone House Seasoning', '1 bunch fresh basil (torn into pieces)'], purpose=None)","Cook pasta according to package instructions. Drain and place into a large mixing bowl. Add sun-dried tomatoes, bacon, red onion, mozzarella balls, pesto, and Stone House Seasoning. Stir well to combine.
When ready to serve, tear fresh basil leaves into pieces and stir into the pasta salad.","{'calories': '358 kcal', 'carbohydrateContent': '37 g', 'proteinContent': '9 g', 'fatContent': '18 g', 'saturatedFatContent': '3 g', 'cholesterolContent': '10 mg', 'sodiumContent': '423 mg', 'fiberContent': '2 g', 'sugarContent': '2 g', 'servingSize': '1 serving'}",American,10 servings,https://addapinch.com/wp-content/uploads/2019/04/pesto-caprese-pasta-salad-recipe-372-scaled.jpg,5.0,"Pesto Caprese Pasta Salad Recipe - A classic pasta updated with a bright pesto dressing, sundried tomatoes, and bacon. A perfect quick and easy side dish!",Complete
Side Dish,Squash Casserole Recipe,50,"2 tablespoons butter, 4 cups sliced yellow squash, 1 medium onion (chopped), 2 large eggs, 1 cup grated cheddar cheese, 1 cup milk, 2 tablespoons butter, ¼ teaspoon cayenne pepper (optional), ½ teaspoon kosher salt, ½ teaspoon ground black pepper, 1 sleeve Ritz crackers","IngredientGroup(ingredients=['2 tablespoons butter', '4 cups sliced yellow squash', '1 medium onion (chopped)', '2 large eggs', '1 cup grated cheddar cheese', '1 cup milk', '2 tablespoons butter', '¼ teaspoon cayenne pepper (optional)', '½ teaspoon kosher salt', '½ teaspoon ground black pepper', '1 sleeve Ritz crackers'], purpose=None)","Preheat oven to 350º F.
Melt 2 tablespoons butter in medium skillet or saute pan over medium-low heat. Add squash and onions and cook until tender.
To a large bowl, add eggs and lightly whisk. Add cheese and milk and whisk into egg until well-combined. Add cooked squash and onions to egg mixture and stir well to combined. Melt remaining 2 tablespoons butter in skillet used to cook squash and onions. Add to squash casserole mixture. Add cayenne pepper, if using, along with salt and pepper. Stir well to combine.
Spray a 9x13 casserole dish with cooking spray and pour squash casserole mixture into the baking dish. Top evenly with crushed Ritz crackers. Place in preheated oven and bake 45 minutes, or until top has lightly browned and casserole does not ""jiggle"" when the dish is moved.
Allow to sit for about 3 minutes before serving.","{'calories': '106 kcal', 'servingSize': '1 serving'}",American,12 servings,https://addapinch.com/wp-content/uploads/2015/03/squash-casserole-DSC_1981.jpg,4.98,"Squash Casserole is an essential dish for holidays and special events. Topped with a buttery cracker topping, this squash casserole is an all-time favorite!",Complete
Side Dish,Garlic Butter Roasted Asparagus Recipe,25,"2 tablespoons melted butter, 2 cloves garlic (minced), 1 teaspoon Kosher salt, 1/2 teaspoon ground black pepper","IngredientGroup(ingredients=['2 tablespoons melted butter', '2 cloves garlic (minced)', '1 teaspoon Kosher salt', '1/2 teaspoon ground black pepper'], purpose=None)","Preheat oven to 425º F. Line a baking sheet with parchment paper.
Place the asparagus in a single layer onto the lined baking sheet. Mix together melted butter, garlic, salt, and pepper and drizzle over the asparagus. Gently toss to coat.
Bake for 20-25 minutes, or until fork tender. Remove from the oven and serve.","{'calories': '52 kcal', 'fatContent': '5 g', 'saturatedFatContent': '3 g', 'cholesterolContent': '15 mg', 'sodiumContent': '631 mg', 'servingSize': '1 serving'}",American,4 servings,https://addapinch.com/wp-content/uploads/2017/02/garlic-roasted-asparagus-recipe_DSC0071.jpg,5.0,"Garlic Butter Roasted Asparagus makes a quick and easy, delicious side dish recipe!",Complete
Side Dish,Slow Cooker Turnip Greens Recipe,330,"2 large bunches fresh turnip greens, 3 medium turnips (peeled and cut into quarters), 1 (1/2 pound) ham hock (or 2 tablespoons olive oil), 1 tablespoon granulated sugar (optional), pinch red pepper flakes (optional)","IngredientGroup(ingredients=['2 large bunches fresh turnip greens', '3 medium turnips (peeled and cut into quarters)', '1 (1/2 pound) ham hock (or 2 tablespoons olive oil)', '1 tablespoon granulated sugar (optional)', 'pinch red pepper flakes (optional)'], purpose=None)","Fill clean sink about halfway with lukewarm water. Chop turnip greens and place into the sink to clean. Agitate the water and turnip greens with your hands to dislodge any dirt and grit from the turnip greens. Drain water and repeat once or twice until the greens feel clean and no dirt remains in the bottom of the sink when rinsing.
Spray insert of slow cooker with non-stick cooking spray.
Add half of greens to the slow cooker with about 1 cup of water, peeled and quartered turnips, and ham hock or olive oil. If you are using the sugar and red pepper flakes, add those as well.
Cook on low setting for about 1 hour until greens have reduced. Add remaining greens to the slow cooker and set time on low for 4 more hours.
Note: The longer turnip greens cook, the better the flavor, in my opinion.","{'carbohydrateContent': '28 g', 'proteinContent': '6 g', 'fatContent': '1 g', 'saturatedFatContent': '1 g', 'cholesterolContent': '1 mg', 'sodiumContent': '170 mg', 'fiberContent': '12 g', 'sugarContent': '4 g', 'calories': '127 kcal', 'unsaturatedFatContent': '2 g', 'servingSize': '1 serving'}",American,10 servings,https://addapinch.com/wp-content/uploads/2013/09/slow-cooker-turnip-greens-DSC_6006-3.jpg,5.0,"Slow Cooker Turnip Greens makes easy work of a delicious Southern dish. This turnip greens recipe is a favorite and perfect for busy weeknights, Sunday suppers and New Year’s Day!",Complete
Side Dish,Slow Cooker Garlic Mashed Potatoes Recipe,245,"5 pounds russet potatoes (peeled and cubed into 1-inch pieces), 3 medium garlic cloves (chopped), 1 1/2 teaspoons kosher salt, 1/2 teaspoon ground black pepper, 3 1/2 cups milk (divided), 1/2 cup salted butter (; cubed), Optional toppings: chives (parsley, rosemary)","IngredientGroup(ingredients=['5 pounds russet potatoes (peeled and cubed into 1-inch pieces)', '3 medium garlic cloves (chopped)', '1 1/2 teaspoons kosher salt', '1/2 teaspoon ground black pepper', '3 1/2 cups milk (divided)', '1/2 cup salted butter (; cubed)', 'Optional toppings: chives (parsley, rosemary)'], purpose=None)","Spray the slow cooker insert with nonstick cooking spray. Add potatoes, garlic, salt, pepper, and 1 1/2 cups of the milk to the slow cooker. Stir to combine. Cook until the potatoes are tender on the HIGH setting for 4 hours.
Once the potatoes are tender, add the remaining 2 cups of milk and butter to the slow cooker and mash the potatoes with a potato masher until creamy.
Transfer the potatoes to a serving dish and top with optional toppings.","{'calories': '392 kcal', 'carbohydrateContent': '57 g', 'proteinContent': '10 g', 'fatContent': '15 g', 'saturatedFatContent': '9 g', 'transFatContent': '0.5 g', 'cholesterolContent': '43 mg', 'sodiumContent': '582 mg', 'fiberContent': '4 g', 'sugarContent': '7 g', 'unsaturatedFatContent': '5 g', 'servingSize': '1 serving'}",American,8 servings,https://addapinch.com/wp-content/uploads/2016/10/slow-cooker-mashed-potatoes-recipe_DSC4392.jpg,5.0,This Slow Cooker Garlic Mashed Potatoes recipe makes an easy way to make a favorite side dish by letting the slow cooker do all the hard work!,Complete
Side Dish,Grilled Okra Recipe,15,"1 pound okra (washed), 2 teaspoons olive oil, kosher salt (to taste), ground black pepper (to taste), pinch cayenne pepper (optional)","IngredientGroup(ingredients=['1 pound okra (washed)', '2 teaspoons olive oil', 'kosher salt (to taste)', 'ground black pepper (to taste)', 'pinch cayenne pepper (optional)'], purpose=None)","Skewer okra or place in a grill basket to prevent it from going through the grill grates while cooking. Drizzle with olive oil and place onto grill that has been preheated to around 450º F.
Cook until the skin of the okra begins to caramelize and then flip to cook the other side.
Remove from the grill and sprinkle with salt and pepper to taste. Add cayenne pepper, if desired.
Serve warm.","{'calories': '36 kcal', 'carbohydrateContent': '5 g', 'proteinContent': '1 g', 'fatContent': '1 g', 'sodiumContent': '5 mg', 'fiberContent': '2 g', 'sugarContent': '1 g', 'servingSize': '1 serving'}",American,6 servings,https://addapinch.com/wp-content/uploads/2013/06/grilled-okra-DSC_3444-3.jpg,5.0,"Grilled Okra makes a delicious addition to any meal. Get this simple, yet scrumptious grilled okra recipe to serve soon!",Complete
Side Dish,Refried Beans Recipe,20,"2 cups cooked pinto beans (drained with cooking liquid reserved or 1 (15-ounce) can), 1 tablespoon olive oil, ½ cup chopped onion (optional), 2 cloves garlic (minced (optional)), 1 teaspoon ground cumin, 1½ teaspoons kosher salt, 1 teaspoon ground black pepper","IngredientGroup(ingredients=['2 cups cooked pinto beans (drained with cooking liquid reserved or 1 (15-ounce) can)', '1 tablespoon olive oil', '½ cup chopped onion (optional)', '2 cloves garlic (minced (optional))', '1 teaspoon ground cumin', '1½ teaspoons kosher salt', '1 teaspoon ground black pepper'], purpose=None)","Add the olive oil to a large skillet set over medium heat. Add the onion and garlic and saute until tender and translucent. Add beans, cumin, salt, and pepper to the skillet . Add reserved liquid a little at a time until beans are at desired consistency and not dry. Cook until beans are heated throughout. Mash beans with a potato masher or the back of a wooden spoon to your desired texture. Remove from heat and serve.","{'calories': '56 kcal', 'carbohydrateContent': '7 g', 'proteinContent': '2 g', 'fatContent': '2 g', 'sodiumContent': '551 mg', 'fiberContent': '2 g', 'servingSize': '1 serving'}","American,Mexican",8 servings,https://addapinch.com/wp-content/uploads/2017/10/refried-beans-recipe-0029-scaled.jpg,5.0,"Refried Beans Recipe – This quick and easy refried beans recipe made with pinto beans, onion, and spices makes a delicious side dish for so many meals!",Complete
Side Dish,Instant Pot Mashed Potatoes Recipe,15,"6 medium (about 3 pounds) Russet or Yukon Gold potatoes, 8 tablespoons butter (softened + 2 tablespoons cut into pieces), about 3/4 cup half and half, 1 teaspoon kosher salt, 1 1/2 teaspoons ground black pepper","IngredientGroup(ingredients=['6 medium (about 3 pounds) Russet or Yukon Gold potatoes', '8 tablespoons butter (softened + 2 tablespoons cut into pieces)', 'about 3/4 cup half and half', '1 teaspoon kosher salt', '1 1/2 teaspoons ground black pepper'], purpose=None)","Place steamer basket in the Instant Pot and add 1 cup water.
Arrange scrubbed potatoes on their ends inside the steamer basket. Cover the Instant Pot and place vent on lid to ""Sealed"". Set the Instant Pot on ""Steam"" program and set time for 10 minutes.
When finished cooking, don't open the lid. Allow pressure to reduce naturally, about 25 minutes.
Remove lid and remove the steamed potatoes from the steamer basket, carefully wipe the peelings away with a paper towel and transfer to a large mixing bowl. Add the butter to the potatoes using a potato masher until the potatoes are well mashed. Slowly incorporate the half and half, mashing and stirring until just enough of the half and half has been incorporated and the potatoes are the consistency you prefer. Stir in the salt and pepper and serve.","{'calories': '101 kcal', 'servingSize': '1 serving'}",American,8 servings,https://addapinch.com/wp-content/uploads/2017/11/instant-pot-perfect-mashed-potatoes-0090.jpg,5.0,"Instant Pot Mashed Potatoes - The Instant Pot pressure cooker makes for quick and easy, perfect mashed potatoes every time!",Complete
Side Dish,Slow Cooker Green Beans Recipe,190,"3 pounds fresh green beans (trimmed), 1/2 cup melted butter, 1/2 cup packed light brown sugar, 1 teaspoon kosher salt, 1/2 teaspoon ground black pepper, 3/4 teaspoon garlic powder, 1 tablespoon soy sauce or coconut aminos, 1 cup chicken stock or broth (optional), 3 slices bacon (diced (optional))","IngredientGroup(ingredients=['3 pounds fresh green beans (trimmed)', '1/2 cup melted butter', '1/2 cup packed light brown sugar', '1 teaspoon kosher salt', '1/2 teaspoon ground black pepper', '3/4 teaspoon garlic powder', '1 tablespoon soy sauce or coconut aminos', '1 cup chicken stock or broth (optional)', '3 slices bacon (diced (optional))'], purpose=None)","Whisk together the melted butter, brown sugar, salt, pepper, garlic, and the soy sauce or coconut aminos until smooth.
Add the green beans to at least a 4-quart slow cooker. Pour the marinade over the top. Toss to coat. Secure the lid of the slow cooker and cook for 3 hours on high or 6 hours on low. If you prefer a more tender green bean, add the optional chicken stock or water to the the slow cooker for cooking your green beans.
Cook the diced bacon until crispy, if using. Remove from the skillet with a slotted spoon and add to the top of your green beans once they have finished cooking for serving.","{'servingSize': '0.5 cup', 'calories': '202 kcal', 'carbohydrateContent': '21 g', 'proteinContent': '4 g', 'fatContent': '12 g', 'saturatedFatContent': '6 g', 'cholesterolContent': '29 mg', 'sodiumContent': '402 mg', 'fiberContent': '3 g', 'sugarContent': '15 g'}",American,10 servings,https://addapinch.com/wp-content/uploads/2017/11/slow-cooker-green-beans-recipe0073.jpg,5.0,Slow Cooker Green Beans Recipe - These are the best slow cooker green beans and have everyone coming back for more!,Complete
Salad,Cucumber and Tomato Salad Recipe,10,"2 cucumber (sliced), 1 pint cherry tomatoes (halved or 2 medium tomatoes, diced), 1 medium onion (diced, optional), 1/2 cup Italian dressing (homemade or store-bought)","IngredientGroup(ingredients=['2 cucumber (sliced)', '1 pint cherry tomatoes (halved or 2 medium tomatoes, diced)', '1 medium onion (diced, optional)', '1/2 cup Italian dressing (homemade or store-bought)'], purpose=None)","Add the sliced cucumbers, tomatoes, onion (if using), and dressing to a large bowl. Gently toss all of the ingredients together to coat with the dressing.","{'servingSize': '0.5 cup', 'calories': '60 kcal', 'carbohydrateContent': '7 g', 'proteinContent': '1 g', 'fatContent': '3 g', 'sodiumContent': '154 mg', 'fiberContent': '1 g', 'sugarContent': '4 g'}",American,8 servings,https://addapinch.com/wp-content/uploads/2012/06/cucumber-tomato-salad-recipe-addapinch-1177.jpg,5.0,"Cucumber Tomato Salad Recipe - A quick and easy summer staple, this cucumber and tomato salad goes well with fish, chicken, pork, or a plate filled with veggies! Add in onions too if you like!",Complete
