Category,Title,Total Time,All Ingredients,Ingredient Groups,Instructions,Nutrition,Cuisine,Yields,Image,Ratings,Description,Status
Side Dish,Mashed Potatoes with Horseradish and Garlic Recipe,60,"5 pounds Russet ( or Yukon gold potatoes, peeled and cut into chunks), 1/2 cup butter (melted + 2 tablespoons cut into pieces), ¾ cup half and half, cloves from about 2 bulbs of roasted garlic, 2 tablespoons prepared horseradish, 1 teaspoon Kosher salt, 1½ teaspoons ground black pepper","IngredientGroup(ingredients=['5 pounds Russet ( or Yukon gold potatoes, peeled and cut into chunks)', '1/2 cup butter (melted + 2 tablespoons cut into pieces)', '¾ cup half and half', 'cloves from about 2 bulbs of roasted garlic', '2 tablespoons prepared horseradish', '1 teaspoon Kosher salt', '1½ teaspoons ground black pepper'], purpose=None)","Place potatoes into large saucepan and add enough water to cover, plus about 1 inch. Cook over medium-low heat until fork tender, about 15-20 minutes.
In a medium saucepan, melt butter, add half and half and roasted garlic. Heat until simmering.
Drain potatoes and pour potatoes back into saucepan used to cook them. Mash potatoes over low heat until smooth. Add the melted butter and half and half mixture to potatoes. Continue to mash the potatoes until creamy. Stir in prepared horseradish. Then, mix well with a wooden spoon until light, fluffy and smooth. Stir in salt and pepper.
Pour potatoes into a serving bowl for serving.
Serve warm.","{'calories': '218 kcal', 'carbohydrateContent': '35 g', 'proteinContent': '5 g', 'fatContent': '7 g', 'saturatedFatContent': '3 g', 'transFatContent': '1 g', 'cholesterolContent': '14 mg', 'sodiumContent': '317 mg', 'fiberContent': '3 g', 'sugarContent': '1 g', 'unsaturatedFatContent': '4 g', 'servingSize': '1 serving'}",American,12 servings,https://addapinch.com/wp-content/uploads/2013/11/mashed-potatoes-horseradish-garlic-DSC_0510-3.jpg,5.0,Mashed Potatoes with Horseradish and Garlic give everyone's favorite side dish a tasty update and kicks them up a notch or two!,Complete
Breakfast,Breakfast Potatoes Recipe,25,"1/4 cup olive oil, 1/2 cup butter, 5 pound Yukon Gold potatoes (chopped), 3 cloves garlic (minced), 1 onion (chopped), 1 bell pepper (seeded and roughly chopped), 1 red pepper (seeded and roughly chopped), 1 teaspoon Kosher salt, 1/4 teaspoon cayenne pepper","IngredientGroup(ingredients=['1/4 cup olive oil', '1/2 cup butter', '5 pound Yukon Gold potatoes (chopped)', '3 cloves garlic (minced)', '1 onion (chopped)', '1 bell pepper (seeded and roughly chopped)', '1 red pepper (seeded and roughly chopped)', '1 teaspoon Kosher salt', '1/4 teaspoon cayenne pepper'], purpose=None)","Add olive oil and butter to a large skillet over medium heat. Allow butter to melt and add potatoes, garlic, onions, and bell peppers to the skillet, stirring frequently to prevent sticking. Cook until fork tender, about 15 minutes. Stir in salt and cayenne pepper.
Serve warm.","{'calories': '395 kcal', 'carbohydrateContent': '53 g', 'proteinContent': '6 g', 'fatContent': '19 g', 'saturatedFatContent': '8 g', 'transFatContent': '1 g', 'cholesterolContent': '31 mg', 'sodiumContent': '411 mg', 'fiberContent': '7 g', 'sugarContent': '4 g', 'unsaturatedFatContent': '9 g', 'servingSize': '1 serving'}",American,8 servings,https://addapinch.com/wp-content/uploads/2013/10/breakfast-potatoes-DSC_6063-2.jpg,5.0,"Breakfast Potatoes make a delicious addition to any breakfast or brunch menu. Get this scrumptious, yet so very simple breakfast potatoes recipe.",Complete
Side Dish,How to Cook Butternut Squash,241,1 2 pound butternut squash,"IngredientGroup(ingredients=['1 2 pound butternut squash'], purpose=None)","Wrap butternut squash with aluminum foil or parchment paper and place inside the slow cooker insert. Cook on high for 4 hours or low for 6 hours.
Remove from slow cooker and allow to cool for about 15 minutes before trying to handle.
Unwrap butternut squash, slice it in half with a knife, and then scoop out the seeds and membrane from the inside of the butternut squash and discard.
Scoop out the soft butternut squash flesh with a large spoon and place into an airtight container for later use.
Keep refrigerated up to one week in an airtight container.","{'calories': '82 kcal', 'carbohydrateContent': '22 g', 'proteinContent': '2 g', 'sodiumContent': '8 mg', 'fiberContent': '6 g', 'sugarContent': '4 g', 'servingSize': '1 serving'}",American,3 servings,https://addapinch.com/wp-content/uploads/2016/03/how-to-cook-butternut-squash-DSC_5886.jpg,5.0,Learning How to Cook Butternut Squash the easy way makes life so simple. Get these easy tips for cooking butternut squash.,Complete
Side Dish,Slow Cooker Baked Potatoes Recipe,365,"4-6 Russet or Yukon Gold potatoes, olive oil, kosher salt","IngredientGroup(ingredients=['4-6 Russet or Yukon Gold potatoes', 'olive oil', 'kosher salt'], purpose=None)","Scrub baking potatoes clean and place on a piece of aluminum foil. Drizzle with olive oil and sprinkle with salt. Wrap tightly with aluminum foil.
Make balls, about 4-6, out of aluminum foil about the size of a tennis ball and arrange on the bottom of the slow cooker insert.
Place foil-wrapped potatoes into slow cooker insert and cook on high for 4 hours or low for 6-8 hours. Leave on warm until ready to serve.","{'calories': '112 kcal', 'carbohydrateContent': '26 g', 'proteinContent': '3 g', 'fatContent': '1 g', 'saturatedFatContent': '1 g', 'sodiumContent': '7 mg', 'fiberContent': '2 g', 'sugarContent': '1 g', 'unsaturatedFatContent': '2 g', 'servingSize': '1 serving'}",American,6 servings,https://addapinch.com/wp-content/uploads/2013/09/baked-potatoes-DSC_5845-3.jpg,4.91,"Baked Potatoes are an all-time favorite dish. Get this recipe for Slow Cooker Baked Potatoes for the perfect, restaurant quality baked potato!",Complete
Side Dish,Mushroom and Onion Saute Recipe,13,"2 tablespoons olive oil, 1 pint sliced white or portobello mushrooms (cleaned), 1 sweet onion (thinly sliced), 1/2 teaspoons kosher salt, 1/4 teaspoon ground black pepper, 1/2 teaspoon fresh herbs (thyme, rosemary, or parsley)","IngredientGroup(ingredients=['2 tablespoons olive oil', '1 pint sliced white or portobello mushrooms (cleaned)', '1 sweet onion (thinly sliced)', '1/2 teaspoons kosher salt', '1/4 teaspoon ground black pepper', '1/2 teaspoon fresh herbs (thyme, rosemary, or parsley)'], purpose=None)","Heat butter or olive oil over medium heat in a medium skillet. Add mushrooms, onions, and salt. Cook until fork tender, about 10 minutes, stirring frequently. Stir in black pepper and fresh herbs, if using.
Serve warm.","{'calories': '115 kcal', 'carbohydrateContent': '11 g', 'proteinContent': '3 g', 'fatContent': '7 g', 'saturatedFatContent': '1 g', 'transFatContent': '0.01 g', 'sodiumContent': '308 mg', 'fiberContent': '2 g', 'sugarContent': '7 g', 'unsaturatedFatContent': '6 g', 'servingSize': '1 serving'}",American,4 servings,https://addapinch.com/wp-content/uploads/2013/08/mushroom-onion-saute-DSC_4855-3.jpg,4.88,"Mushroom and Onion Saute makes an essential addition to so many dishes - topper for hamburgers, lettuce wraps, or as a side dish.",Complete
Side Dish,Grilled Zucchini Recipe,20,"1 pound zucchini (sliced lengthwise into 1/4-inch or 1/2-inch slices), 1/4 cup balsamic vinaigrette, salt and pepper (to taste), shredded Parmesan cheese (optional)","IngredientGroup(ingredients=['1 pound zucchini (sliced lengthwise into 1/4-inch or 1/2-inch slices)', '1/4 cup balsamic vinaigrette', 'salt and pepper (to taste)', 'shredded Parmesan cheese (optional)'], purpose=None)","Place zucchini in a long, glass or otherwise non-reactive pan. Pour dressing over zucchini and turn to make sure evenly coated. Cover and all to marinate for 30 minutes to a few hours.
Heat grill to 350º F. Place zucchini slices onto grill and cook about 5 minutes. Flip to grill the other side of the zucchini and cook until fork tender, about 5 more minutes.
Remove from grill with tongs and keep warm until serving. If serving with Parmesan cheese, sprinkle on top while still warm.
Serve warm.","{'calories': '60 kcal', 'carbohydrateContent': '3 g', 'proteinContent': '1 g', 'fatContent': '5 g', 'saturatedFatContent': '1 g', 'sodiumContent': '6 mg', 'fiberContent': '1 g', 'sugarContent': '2 g', 'servingSize': '1 serving'}",American,6 servings,https://addapinch.com/wp-content/uploads/2013/08/grilled-zucchini-DSC_4840-2.jpg,5.0,"This Grilled Zucchini is such an easy and delicious side dish! So tender and flavorful, this is a perfect recipe for this favorite vegetable!",Complete
Side Dish,Fried Okra Recipe,21,"2 pounds okra (sliced), 3/4 cup corn meal, 1/2 cup all-purpose flour, 1/2 teaspoon kosher salt, 1/4 cup Canola or vegetable oil","IngredientGroup(ingredients=['2 pounds okra (sliced)', '3/4 cup corn meal', '1/2 cup all-purpose flour', '1/2 teaspoon kosher salt', '1/4 cup Canola or vegetable oil'], purpose=None)","Preheat oven to 350º F.
Mix together okra, corn meal, flour, and salt in a large mixing bowl, making sure well-coated.
In the meantime, heat oil in a large skillet over medium heat.
Add okra to skillet once oil has reached the point where if a drop of water is added it will sizzle.
Allow okra to brown on one side, about 3 minutes, before gently stirring. Once both sides of okra have browned, about 3 more minutes, place into preheated oven. Cook until fork tender, about 10 minutes.","{'carbohydrateContent': '34 g', 'proteinContent': '6 g', 'fatContent': '11 g', 'saturatedFatContent': '2 g', 'transFatContent': '0.1 g', 'sodiumContent': '205 mg', 'fiberContent': '7 g', 'sugarContent': '3 g', 'calories': '244 kcal', 'unsaturatedFatContent': '9 g', 'servingSize': '1 serving'}",American,6 servings,https://addapinch.com/wp-content/uploads/2013/07/Fried-Okra-Recipe-addapinch-387-2.jpg,4.78,"Fried Okra is a Southern staple. So simple to make, fried okra makes the perfect side dish. Get this heirloom family fried okra recipe that you'll love.",Complete
Side Dish,Tomato Pie Recipe,55,"1 9-inch unbaked pie crust, 3 medium tomatoes (thinly sliced), 1 teaspoon Kosher salt, 1 sweet onion (thinly sliced), 1 teaspoon ground black pepper, 1 tablespoon olive oil, 2 tablespoons chopped basil, 1 cup grated cheddar cheese, 1/2 cup grated Parmesan cheese, 1/4 cup mayonnaise","IngredientGroup(ingredients=['1 9-inch unbaked pie crust', '3 medium tomatoes (thinly sliced)', '1 teaspoon Kosher salt', '1 sweet onion (thinly sliced)', '1 teaspoon ground black pepper', '1 tablespoon olive oil', '2 tablespoons chopped basil', '1 cup grated cheddar cheese', '1/2 cup grated Parmesan cheese', '1/4 cup mayonnaise'], purpose=None)","Preheat oven to 425º F. Prepare pie crust for blind baking by placing unbaked pie crust into pie plate, crimping edges and pricking bottom and sides with a fork for venting. Then, line unbaked pie crust with a sheet of parchment paper and fill with dried beans. Bake pie crust until lightly golden brown, about 20 minutes. Remove from oven, remove dried beans and parchment paper (storing for later use) and set aside. Reduce oven to 350º F.
In the meantime, spread tomatoes onto a baking sheet lined with paper towels. Sprinkle tomato slices with salt and then top with another layer of paper towels. Allow tomatoes to rest for at least 15 minutes to dry as much as possible.
Layer tomatoes and onion slices in pie crust until filled. Sprinkle with black pepper and drizzle with olive oil. Sprinkle on chopped basil.
Mix together cheddar and Parmesan cheeses in a small bowl with mayonnaise. Spread on top of Tomato Pie to ensure completely covered.
Bake Tomato Pie at 350º F for approximately 40 minutes.
Remove from oven and allow to rest for about 5 minutes before slicing.","{'calories': '246 kcal', 'carbohydrateContent': '10 g', 'proteinContent': '10 g', 'fatContent': '19 g', 'saturatedFatContent': '7 g', 'transFatContent': '1 g', 'cholesterolContent': '31 mg', 'sodiumContent': '717 mg', 'fiberContent': '1 g', 'sugarContent': '5 g', 'unsaturatedFatContent': '11 g', 'servingSize': '1 serving'}",American,6 servings,https://addapinch.com/wp-content/uploads/2013/07/Tomato-Pie-Recipe-DSC_3516-2.jpg,4.5,"Tomato Pie is a perfect summertime recipe. Get this family-favorite recipe for Tomato Pie full of ripe tomatoes, sweet onions, and cheesy goodness!",Complete
Side Dish,Squash and Onions Recipe,15,"2 tablespoons butter, 5 medium yellow squash (sliced), 1/2 sweet onion (diced), salt and pepper","IngredientGroup(ingredients=['2 tablespoons butter', '5 medium yellow squash (sliced)', '1/2 sweet onion (diced)', 'salt and pepper'], purpose=None)","Melt butter over medium-low heat in a skillet. Add squash and onions and cook until onions are translucent and squash has become fork tender, about 8-10 minutes.
Remove from heat. Add salt and pepper to taste.
Serve warm.","{'calories': '63 kcal', 'carbohydrateContent': '6 g', 'proteinContent': '2 g', 'fatContent': '4 g', 'saturatedFatContent': '1 g', 'sodiumContent': '48 mg', 'fiberContent': '2 g', 'sugarContent': '4 g', 'unsaturatedFatContent': '3 g', 'servingSize': '1 serving'}",American,6 servings,https://addapinch.com/wp-content/uploads/2013/06/squash-onions-DSC_3312-2.jpg,4.97,"This classic Squash and Onions recipe is a family-favorite side dish throughout the year, but especially during the summer. Get this easy Squash and Onions recipe your family will love!",Complete
Appetizer,Fried Green Tomatoes Caprese Stacks Recipe,20,"1 recipe Fried Green Tomatoes, 8 ounces Mozzarella cheese (sliced), 8 whole basil leaves, balsamic glaze","IngredientGroup(ingredients=['1 recipe Fried Green Tomatoes', '8 ounces Mozzarella cheese (sliced)', '8 whole basil leaves', 'balsamic glaze'], purpose=None)","Fry green tomatoes following the recipe instructions.
Cut Mozzarella cheese into 8 individual pieces.
Assemble fried green tomatoes caprese stacks by placing one fried green tomato on a plate. Top the tomato with a piece of Mozzarella cheese, then with a basil leaf, then with another fried green tomato. Repeat with another piece of cheese, another basil leaf and top with a final fried green tomato. Drizzle top with balsamic glaze.
Serve warm.","{'calories': '246 kcal', 'carbohydrateContent': '19 g', 'proteinContent': '13 g', 'fatContent': '13 g', 'saturatedFatContent': '7 g', 'cholesterolContent': '45 mg', 'sodiumContent': '364 mg', 'fiberContent': '0.01 g', 'sugarContent': '19 g', 'unsaturatedFatContent': '4.4 g', 'servingSize': '1 serving'}",American,4 servings,https://addapinch.com/wp-content/uploads/2013/06/fried-green-tomato-caprese-stacks-DSC_3358-3.jpg,5.0,"Fried Green Tomatoes are a Southern delicacy and really shine in these Fried Green Tomatoes Caprese Stacks. Perfect for easy, elegant entertaining or as a weeknight side dish.",Complete
"Salad,Side Dish",Cucumber Salad Recipe,15,"2 cucumber (peeled and sliced), sweet onion, 1/2 cup distilled white vinegar, 2 teaspoons sugar, 1 teaspoon kosher salt, 1 teaspoon ground black pepper, 1 clove garlic (finely minced), 1/2 cup water","IngredientGroup(ingredients=['2 cucumber (peeled and sliced)', 'sweet onion', '1/2 cup distilled white vinegar', '2 teaspoons sugar', '1 teaspoon kosher salt', '1 teaspoon ground black pepper', '1 clove garlic (finely minced)', '1/2 cup water'], purpose=None)","Place cucumber slices into large bowl. Cut Vidalia onion into long thin strips and add to the bowl.
In 2-cup measuring cup, add vinegar, sugar, salt, garlic, and water. Mix well with a fork and pour over cucumber and onions. Cover tightly with plastic wrap and store in the refrigerator at least an hour before serving.","{'carbohydrateContent': '3 g', 'proteinContent': '0.5 g', 'fatContent': '0.1 g', 'saturatedFatContent': '0.01 g', 'sodiumContent': '293 mg', 'fiberContent': '1 g', 'sugarContent': '2 g', 'calories': '17 kcal', 'unsaturatedFatContent': '0.013 g', 'servingSize': '1 serving'}",American,8 servings,https://addapinch.com/wp-content/uploads/2013/06/cucumber-salad-recipe-029-2-scaled.jpg,4.94,"Cucumber Salad Recipe - This refreshing cucumber salad is a great side dish for any meal - chicken, beef, pork, fish, or vegetables! A longtime family favorite ready in minutes and full of flavor!",Complete
Side Dish,Lima Beans with Ham Recipe,120,"1 (1-pound) bag dried large Lima beans, Water (to cover plus about an inch for soaking beans), 1 tablespoon butter ( or vegetable oil), 1/2 cup chopped onion, 2 cloves garlic (chopped), 2 cups ham (roughly chopped), 1/4 teaspoon ground black pepper, 4 cups chicken stock ( or broth)","IngredientGroup(ingredients=['1 (1-pound) bag dried large Lima beans', 'Water (to cover plus about an inch for soaking beans)', '1 tablespoon butter ( or vegetable oil)', '1/2 cup chopped onion', '2 cloves garlic (chopped)', '2 cups ham (roughly chopped)', '1/4 teaspoon ground black pepper', '4 cups chicken stock ( or broth)'], purpose=None)","Rinse Lima beans and place into a large stockpot or Dutch oven with just enough water to cover them, plus about an inch. Allow to soak about an hour to overnight, making sure beans always have plenty of water for soaking. Drain beans and rinse them again and set aside.
Meanwhile, in the bottom of another stockpot Dutch oven, heat the butter or vegetable oil over medium to low heat. Add onion and garlic and sauté until just tender, about 3 minutes. Add chopped ham and cook for about 3 minutes. Add the pepper, chicken stock, and about 4 cups of water. Add beans and bring to a boil, reduce heat to medium and let simmer for about 1 hour or until the beans are tender and the sauce has thickened.","{'calories': '338 kcal', 'carbohydrateContent': '41 g', 'proteinContent': '23 g', 'fatContent': '9 g', 'saturatedFatContent': '3 g', 'transFatContent': '0.1 g', 'cholesterolContent': '29 mg', 'sodiumContent': '609 mg', 'fiberContent': '11 g', 'sugarContent': '7 g', 'unsaturatedFatContent': '5 g', 'servingSize': '1 serving'}",American,8 servings,https://addapinch.com/wp-content/uploads/2013/04/Lima-Beans-with-Ham-DSC_2222-1.png,5.0,"Lima beans with ham make a wonderful, hearty meal.",Complete
Side Dish,Broccoli Slaw Recipe,10,"2 (12-ounce) bag broccoli slaw, 1/2 red onion (chopped), 1/4 cup light mayonnaise (or Greek yogurt), 1 tablespoon apple cider vinegar, 1 teaspoon granulated sugar, 1 tablespoons lime juice, salt and pepper (to taste), 1 teaspoon chopped fresh parsley (optional)","IngredientGroup(ingredients=['2 (12-ounce) bag broccoli slaw', '1/2 red onion (chopped)', '1/4 cup light mayonnaise (or Greek yogurt)', '1 tablespoon apple cider vinegar', '1 teaspoon granulated sugar', '1 tablespoons lime juice', 'salt and pepper (to taste)', '1 teaspoon chopped fresh parsley (optional)'], purpose=None)","Pour broccoli slaw into a large bowl. Add chopped red onion.
In a 2-cup measuring cup, add mayonnaise or yogurt, vinegar, sugar, and lime juice. Whisk together with a fork and pour half of dressing over broccoli slaw.
Toss slaw together to make sure well-dressed. Add additional dressing as needed. Season with salt and pepper, to taste. Mix well.
Add chopped parsley as garnish (optional).
Serve with remaining dressing on the side.","{'calories': '29 kcal', 'carbohydrateContent': '2 g', 'proteinContent': '1 g', 'fatContent': '2 g', 'saturatedFatContent': '1 g', 'transFatContent': '1 g', 'cholesterolContent': '1 mg', 'sodiumContent': '70 mg', 'fiberContent': '1 g', 'sugarContent': '1 g', 'unsaturatedFatContent': '2 g', 'servingSize': '1 serving'}",American,6 servings,https://addapinch.com/wp-content/uploads/2013/02/broccoli-slaw-DSC_1944-1.jpg,4.94,"This simple Broccoli Slaw is an easy to follow recipe that is a definite crowd favorite. The perfect side dish recipe for picnics, grilling, tailgating, and entertaining!",Complete
Side Dish,Broccoli Recipe,25,"2 bunches broccoli (cleaned), 2 tablespoons olive oil, water, butter (optional), salt and pepper","IngredientGroup(ingredients=['2 bunches broccoli (cleaned)', '2 tablespoons olive oil', 'water', 'butter (optional)', 'salt and pepper'], purpose=None)","Cut florets off each bunch of broccoli, taking care to cut florets into similar sizes as much as possible for even cooking. Clean stalks with a vegetable peeler to remove any stems or leaves. Cut upper part of stalk closet to florets into 1-inch thick slices.
Add broccoli to a heavy-bottomed pot. Cover with water and drizzle in about 2 tablespoons of olive oil.
Cook over medium-low heat for 20-30 minutes or until the stalk of a floret can be easily pierced with a fork.
Remove broccoli with a slotted spoon into a serving bowl. Serve warm with butter and salt and pepper to taste.","{'calories': '110 kcal', 'carbohydrateContent': '13 g', 'proteinContent': '6 g', 'fatContent': '5 g', 'saturatedFatContent': '1 g', 'sodiumContent': '67 mg', 'fiberContent': '5 g', 'sugarContent': '3 g', 'unsaturatedFatContent': '4 g', 'servingSize': '1 serving'}",American,6 servings,https://addapinch.com/wp-content/uploads/2013/01/broccoli-boiled-DSC_1455-3.jpg,5.0,A broccoli recipe perfect for picky eaters.,Complete
Side Dish,Loaded Smashed Potatoes,30,"5 pounds red potatoes (scrubbed), 1/2 cup butter (melted + 2 tablespoons cut into pieces), ¾ cup half and half, cloves from about 2 bulbs of roasted garlic, 1/2 cup sour cream, 8 slices bacon (crumbled), 8 ounces cheddar cheese (shredded), 1 teaspoon kosher salt, 1½ teaspoons ground black pepper","IngredientGroup(ingredients=['5 pounds red potatoes (scrubbed)', '1/2 cup butter (melted + 2 tablespoons cut into pieces)', '¾ cup half and half', 'cloves from about 2 bulbs of roasted garlic', '1/2 cup sour cream', '8 slices bacon (crumbled)', '8 ounces cheddar cheese (shredded)', '1 teaspoon kosher salt', '1½ teaspoons ground black pepper'], purpose=None)","Place potatoes into large saucepan and add enough water to cover, plus about 1 inch. Cook over medium-low heat until fork tender, about 15-20 minutes.
In a medium saucepan, melt butter, add half and half and roasted garlic. Heat until simmering.
Drain potatoes and pour potatoes back into saucepan used to cook them. Smash potatoes over low heat until chunks of potatoes remain, but the majority of the potatoes are smooth. Add the melted butter and half and half mixture to potatoes. Continue to mash the potatoes to incorporate the half and half mixture. Then, mix in garlic, sour cream, bacon crumbles, and cheddar cheese with a spoon until well-combined. Stir in salt and pepper.
Pour potatoes into a serving bowl for serving.
Make-Ahead Tip: Prepare mashed potatoes and pour into a casserole dish. Cover tightly with aluminum foil or a lid and refrigerate until about 20 minutes before ready to serve. Then, place in a preheated oven at 350º F for 20 minutes.
When you remove from the oven, top with remaining 2 tablespoons of butter and a sprinkle of salt and pepper, if desired.
Serve warm.","{'calories': '423 kcal', 'carbohydrateContent': '38 g', 'proteinContent': '14 g', 'fatContent': '25 g', 'saturatedFatContent': '14 g', 'transFatContent': '1 g', 'cholesterolContent': '70 mg', 'sodiumContent': '673 mg', 'fiberContent': '4 g', 'sugarContent': '3 g', 'unsaturatedFatContent': '8 g', 'servingSize': '1 serving'}",American,10 servings,https://addapinch.com/wp-content/uploads/2013/01/loaded-smashed-potatoes-DSC_1274-2.jpg,5.0,Loaded Smashed Potatoes make a perfect side dish. Great for entertaining!,Complete
Side Dish,Roasted Garlic Mashed Potatoes Recipe,60,"5 pounds potatoes (, Russet or Yukon gold potatoes, peeled and cut into chunks), 8 tablespoons butter (melted + 2 tablespoons cut into pieces), 3/4 cup half and half, 2 cloves garlic, 1 teaspoon kosher salt, 1 1/2 teaspoons ground black pepper","IngredientGroup(ingredients=['5 pounds potatoes (, Russet or Yukon gold potatoes, peeled and cut into chunks)', '8 tablespoons butter (melted + 2 tablespoons cut into pieces)', '3/4 cup half and half', '2 cloves garlic', '1 teaspoon kosher salt', '1 1/2 teaspoons ground black pepper'], purpose=None)","Place potatoes into large saucepan and add enough water to cover, plus about 1 inch. Cook over medium-low heat until fork tender, about 15-20 minutes.
In a medium saucepan, melt butter, add half and half and roasted garlic. Heat until simmering.
Drain potatoes and pour potatoes back into saucepan used to cook them. Mash potatoes over low heat until smooth. Add the melted butter and half and half mixture to potatoes. Continue to mash the potatoes until creamy. Then, mix well with a wooden spoon until light, fluffy and smooth. Stir in salt and pepper.
Pour potatoes into a serving bowl for serving.
Serve warm.","{'carbohydrateContent': '34 g', 'proteinContent': '4 g', 'fatContent': '9 g', 'saturatedFatContent': '6 g', 'transFatContent': '0.3 g', 'cholesterolContent': '25 mg', 'sodiumContent': '275 mg', 'fiberContent': '4 g', 'sugarContent': '2 g', 'calories': '234 kcal', 'unsaturatedFatContent': '2.5 g', 'servingSize': '1 serving'}",American,12 servings,https://addapinch.com/wp-content/uploads/2012/11/mashed-potatoes-DSC_1008-4.jpg,5.0,"Roasted Garlic Mashed Potatoes are a delicious, creamy addition to any meal and make special occasions even more delectable. Make ahead instructions included!",Complete
